name,address,access,remarks,latitude,longitude
クラブセガ 名張,名張市希央台3-15?,名張駅が最寄です,,,
楽市楽座 イオンモール東員店,三重県員弁郡東員町長深字築田510番地1　3F?,三岐鉄道東員駅より直行路線バス約5分三岐鉄道山城駅より直行路線バス約10分,,,
サンボウル,伊賀市小田町南出1528?,名阪国道上野東ICより車で約15分,,,
モーリーファンタジー伊賀上野店,伊賀市上野茅町2519&br()イオン伊賀上野店2階?,,旧：ファンタジーアイランド…,,
ドリームキャンディ,三重県伊賀市小田町711−1?,,,,
プラザパル,伊賀市小田町稲久保256-1&br()ジョイシティ伊賀上野B館3F?,伊賀鉄道上野市駅より徒歩15分,旧：ナムコランド,,
モーリーファンタジー伊勢ララパーク店,伊勢市小木町曽弥538&br()イオンタウン伊勢ララパーク店2階?,,参考画像,,
セガ伊勢,伊勢市中須町666?,,画像　2017年4月1日より「AGスクエア伊勢」から「セガ伊勢」に店名が変更となりました。　旧：AGスクエア伊勢店　旧：アーバンスクエア伊勢店居抜きではありません,,
小俣ベリー ｹﾞｰﾑｺｰﾅｰ,三重県伊勢市小俣町相合４３１?,,参考画像,,
鳥羽一番館 1FGC,三重県鳥羽市鳥羽1丁目2383−13 鳥羽一番街1階?,近鉄鳥羽線鳥羽駅JR参宮線鳥羽駅,,,
鳥羽一番館 3FGC,三重県鳥羽市鳥羽1丁目2383−13 鳥羽一番街3階?,近鉄鳥羽線鳥羽駅JR参宮線鳥羽駅,,,
イオン鳥羽店 2F,三重県鳥羽市大明西町１－１?,最寄駅 志摩赤崎,参考画像　クレーンゲーム・スロット数台のみ,,
イオン熊野店　ファミリーランド,三重県熊野市井戸町字井土３５３－１?,JR熊野駅から徒歩10分,営業時間 10:00～18:00,,
イオン大安店　らんらんらんど,いなべ市大安町高柳１９４５?,三岐鉄道 三里駅より徒歩10分,,,
モーリーファンタジー阿児店,志摩市阿児町鵜方3215&br()イオン阿児店2階?,,旧：ファンタジーアイランド…8号です。,,
ゲームパークMECHA菰野店,三重県三重郡菰野町大字宿野字神明田357,,,,
遊RUN飛行川越店,三重郡川越町大字高松字天神29-1,近鉄富田駅,,,
らんらんらんど菰野店,三重郡菰野町大字竹成字高原3998-7&br()ピアゴ菰野店1F?,,,,
アソビックスあさひ,三重郡朝日町181?,伊勢湾岸自動車道 みえ川越ICから約1km,旧：セガワールドあさひ,,
ラウンドワンスタジアムみえ・川越IC店,三重郡川越町大字南福崎851番地1?,伊勢湾岸自動車道 みえ川越ICすぐ,,,
T/S イオンモール明和店,多気郡明和町中村1223&br()イオンモール明和2F?,,旧:アミューズメントme、T/Sイオン明和店専門棟の中です,,
モーリーファンタジー明和店,多気郡明和町中村長波賀1223番地&br()イオンモール明和2F?,,イオンの中です,,
ゲームセンター・めいわ,三重県多気郡明和町蓑村２６６?,近鉄山田線斎宮駅徒歩20分,お好み焼「道とん堀」めいわ店、カラオケバンダイめいわ店のある複合施設『バンダイワールドめいわ』内,,
ジェイニークレージー,度会郡御薗村大字新開70-1,,,,
オートスナック滝原,度会郡大宮町滝原,国道42号沿い,参考,,
ジャスコシティ玉城店,度会郡玉城町世古字鳥戸411-1,,,,
ニコニコランド,南牟婁郡御浜町大字阿田和4926-5,R42沿い公共交通では阿田和駅が最寄です,バンダイワールド2店舗とは同一OPです。,,
アクション堅田,大津市今堅田2丁目40-10ACT堅田ビル2F,JR湖西線堅田駅下車徒歩10分,旧：ダイエー跡地,,
スーパーヒーロー堅田,大津市真野2-31-30,JR湖西線堅田駅下車15分琵琶湖大橋の近く,OPはフウキではありません。建物は旧セガワールド真野店を流用,,
プレイランドサンポッポ堅田,大津市本堅田5-20-10,,,,
らんらんらんど瀬田店,大津市一里山1-3-1ヒカリ屋瀬田店4F,,,,
モーリーファンタジー西大津店,大津市皇子が丘3-11-1イオン西大津店4階,,,,
ラウンドワン 浜大津アーカス店,"大津市浜町2-1浜大津アーカス内2F,3F",京阪浜大津駅下車徒歩4分,アーカス改装工事後に新規テナントとして開店,,
滋賀レジャーランド大津店,大津市におの浜3-1-43,JR琵琶湖線膳所駅より徒歩10分,AGスクエア大津店跡地に2017年9月開店,,
TFSアクア近江八幡店,近江八幡市鷹飼町179イオン近江八幡SC2番街アクア21 1F,JR近江八幡駅前,旧：宝島近江八幡店2013年8月開店,,
TFSイオン近江八幡店,近江八幡市鷹飼町179イオン近江八幡SC2番街1F,JR近江八幡駅前,TFSアクア近江八幡店とは同一フランチャイジーだが別（イオン棟の中です）,,
らんらんらんどピアゴ近江八幡店,近江八幡市鷹飼町字一本木223番地3ピアゴ近江八幡店2F,,,,
らんらんらんどダイエー近江八幡店,近江八幡市桜宮町202-1ダイエー近江八幡店1F,,？HPに店舗名は載っていない,,
らんらんらんどユーストア近江八幡店,近江八幡市鷹飼町字一本木223番地3ユーストア近江八幡店2F,,？HPに店舗名は載っていない,,
アミパラ草津店,滋賀県草津市木川町311-1JJタウン2F,,2015/07/24 オープン予定旧：K-CAT草津店,,
セガワールド草津,草津市西渋川1-23-15A-SQUARE　SARA内,JR草津駅下車徒歩2分,,,
アクション草津,草津市野路3丁目1-11,国道1号線南田山交差点そば,,,
Bb 南草津店,草津市野路5丁目13番1号,,ビジター最初の1時間600円､延長15分150円の複合型レジャー施設別途:会員料金､パック料金有り,,
エースレーン草津,草津市野路9丁目8-12,バイパス野路中央交差点角,ガオラ跡地に開店,,
ゲームランド草津,草津市新浜町300イオンモール草津3F,,専門棟の中です。,,
モーリーファンタジー草津店,草津市新浜町300イオンモール草津3F,,旧：ファンタジーアイランド…イオンの中です。,,
ゲームディーノ彦根店,彦根市西沼波町166,R8沿い。ひこね芹川駅が最寄,2013年6月開店,,
ビバシティ彦根店ゲームコーナー,彦根市竹ヶ鼻町43-1ビバシティ彦根2F,南彦根駅が最寄,"旧：ワンダーパーク彦根店,namcoビバシティ彦根店",,
ハローズガーデン彦根店,彦根市馬場2-1-1カインズモール彦根店内,,,,
プレイランドサンポッポ彦根,彦根市大東町2-28,,,,
アクション長浜,長浜市川崎町字八王子375,長浜ICおりて国道8号線彦根方面へ,赤い建物が目印,,
ファミリーランド,長浜市北船町3-21 平和堂 長浜店3F,JR長浜駅 東口出てすぐ,プライズ、シール機のみ,,
ファンタジーアイランド長浜店,長浜市山階町271-1イオン長浜店2階,,,,
アミュージアム草津店,栗東市小柿7-8-8テイサンスクエアー内,JR草津駅から徒歩10分,,,
アミューズメントJungle栗東店,栗東市栗東町綣2-4-5,,,,
プレイランド栗東,栗東市綣2-3-22,,,,
宝島 八日市店,東近江市八日市浜野町3-1ショッピングプラザアピア4F,,,,
ファンタジックランド,東近江市八日市緑町9-30,,,,
セガワールド甲西,湖南市夏見二ツ橋356-1,,,,
メルヘンランド甲西中央店,湖南市中央1丁目38平和堂甲西中央店3F,,,,
ナムコランドアルプラザ水口店,甲賀市水口町名坂411-9アルプラザ水口店別館2F,,規模は大幅に縮小,,
ビバーチ水口店,甲賀市水口町北脇1772-4,国道1号沿い,,,
ぷらっとらんど野洲店,野洲市乙窪字長操480-1ザ・ビッグエキストラ野洲店1階,,イオンの新業態のお店に転換しています。,,
ACT守山,守山市播磨田町306,,1，2，3番館という形で存在。パチンコ店と併設,,
アクション愛知川,愛知郡愛荘町長野200番地,国道8号沿い､長野北交差点南100m,,,
らんらんらんど豊郷店,犬上郡豊郷町大字高野瀬字下池田197-1ピアゴ豊郷店1F,,,,
スーパーライフ太秦店内ゲームコーナー,京都府京都市右京区太秦安井池田町6スーパーライフ太秦店3F,JR花園駅・太秦天神川駅下車徒歩5分,ガチャガチャ、トレーディングカードアーケードゲームが有,,
CIEL．NET,京都市右京区西院久保田町6-5シエル．ネット1F,各社バス中ノ橋五条下車すぐ,京都でタクシー事業を行っているMKのアミューズメント施設でシエルとパルケ上賀茂だけ現在も営業中両店共にMKが運営かつタイトーレンタリースシステム利用店でシエルはあらゆる最新の機種を設置していて料金も安価設定の機種も有,,
プラサカプコン京都店,京都市右京区西院追分町25-1イオンモール京都五条3F,専門店棟の中にある本格的なゲームセンター,,,
モーリーファンタジー京都五条店,京都市右京区西院追分町25-1イオンモール京都五条店2F,イオン棟の中にある子供向けのゲームコーナー、同施設は割とイオン系列の店舗に設置してある事が多いです,,,
プレイランド京都,京都市右京区山ノ内池尻町1-1京都ファミリー3F,各社バス四条葛野大路下車すぐ,OPはソユー,,
北大路ビブレプリント＆プライズステーション,京都市北区小山北上総町49-1北大路ビブレ4F,地下鉄北大路駅下車すぐ市バス北大路駅前下車すぐ,店内面積は狭く2016年1月現在はUFOキャッチャーとプリクラのみ設置同じ階で少し離れた場所にトレーディングカードアーケードゲームも設置されている,,
しょうざんボウル,京都市北区衣笠鏡石町47,市バス北木ノ畑町下車徒歩10分,京都市街から少し離れた分かりづらい場所（少し山深い場所）にある。営業時間も22時迄と早いので利用する時や訪問する時は注意今のゲームはほとんど設置されておらず、1990年代頃のレトロゲームが多めに設置されているボウリング場のゲームコーナーという感じだが面積が以前の半分に縮小されている,,
パルケ上賀茂,京都市北区上賀茂西河原町1-1,各社バス柊野別れや西賀茂橋下車が比較的近い,京都でタクシー事業を行っているMKのアミューズメント施設でシエルとパルケ上賀茂だけ現在も営業中両店共にMKが運営していてタイトーレンタリースシステム利用店でパルケ上賀茂は最新の機種は音ゲーを中心に多めになっている,,
エクシブ京都 八瀬離宮内アミューズメントコーナーJOY,京都市左京区八瀬野瀬町74-1,叡山電車八瀬比叡山口駅下車すぐ,ホテル内にあるゲームコーナー昔はこの場所に八瀬遊園～スポーツバレー京都～森のゆうえんちがあった,,
京都ヨドバシ,京都市下京区烏丸通七条下ル東塩小路町590-2,京都駅下車北へ徒歩3分京都タワーの北隣,3階にトレーディングカードアーケードゲーム6階にプリクラやUFOキャッチャーがある,,
PLAYLAND KING 七条店,京都市下京区東境町187,京都駅下車北へ徒歩5分烏丸七条交差点,1階はパチンコキング、建物右隅にある階段が入口で2階にゲームセンターがある(駐輪場や駐車場も有)京都駅前で立地が良く観光客や外国人も結構多い。最新ゲームはもちろんビデオゲームや格闘ゲームの対戦仕様台も今では店舗面積の1/3に縮小されてるものの健在,,
京都オリンピア,京都市中京区新京極蛸薬師下ル東側町502,プリクラ専門店で新京極側から見ると小型飛行機のオブジェとして飾られている（1980年代後半～1990年代前半頃はビデオシステムの直営店だった）,,,
ゲームパニック京都,京都市中京区新京極通三条下ル桜之町415京都松竹座ビル,元々本屋があった場所に2011年12月16日オープン2016年4月に運営会社がレジャランに変更,,,
サードプラネットBivi京都二条店,京都市中京区西ノ京栂尾町1-6,JR・地下鉄二条駅前各社バス二条駅前下車すぐ,,,
ハリケーン寺町京極店,京都市中京区新京極蛸薬師下ル東側町502,2015年9月26日オープンのUFOキャッチャー専門店で元々は富貴系列のスターダストＩがあった、後に空き家状態だったがハリケーンが入居したこちらの方がハリケーンの京都本店よりもお店の面積は広くハリケーンの店舗が2店連なる状態での出店していた2018年に入ってすぐ京都本店が休業して下記の通り同年3月に物産店になっているので、以降ハリケーンは寺町京極店だけ営業している,,,
PLAYLAND KING 円町店,京都市中京区円町西入北側2F,ＪＲ円町駅下車すぐ,設置ゲームは七条キングとほぼ同じだが、円町店のみメダルコーナーがある(駐輪場や駐車場も有),,
ROUND 1 京都河原町店,京都市中京区河原町通三条下ル山崎町250,京阪祇園四条駅・阪急河原町駅各社バス四条河原町下車もしくは京阪三条駅・各社バス河原町三条地下鉄東西線京都市役所前駅下車でも可,駐輪場はオープンの頃から設置されており、駐輪場が完全に無料開放だった頃も有り、立地の良さからラウンドワンと関係が無い利用や放置車両が目立った経緯がある為現在駐輪場は管理会社に委託されている。ラウンドワン利用者は一部無料扱いの設定が有り比較的優遇されているがこの駐輪場を通常利用した場合は周辺の駐輪場と比べ高めの料金設定になっている,,
ミラプリ,京都市中京区中之町554美松別館1F,プリクラ専門店。2016年4月現在休業中の模様,,,
店舗名不明だがAAAの可能性有,京都市中京区中之町546-4,UFOキャッチャー専門店。2016年9月頃開店。元は新京極通りのLeMusee京都本店があった場所にあった。（OPはアミューズメントトラスト）以降摘発されるまで店舗名がよく分からない状態で営業してたが「AAA」という名称の可能性も有るものの詳しく公表されておらず詳細は不明新京極通りの店舗上部にも各店舗の看板が設置されてるものの、この看板も交換される事も無く前の「LeMusse」の看板という状態だった2017年12月23日に大阪と京都の店舗でUFOキャッチャーを使った詐欺事件があり、当店も家宅捜索を受けて経営者が逮捕され以降は再開される事無く12月23日付けで閉店(2018年3月現在も跡地は閉店当時そのままの状態で放置されている状態),,,
ハリケーン京都河原町店,京都市中京区山崎町243,2015年3月下旬オープン、河原町のラウンドワンの向かいにあったUFOキャッチャー専門店2017年12月に閉店確認(詳しい閉店日は不明),,,
ハリケーン京都本店,京都市中京区新京極蛸薬師下ル東側町501,京阪祇園四条駅・阪急河原町駅各社バス四条河原町下車もしくは京阪三条駅・各社バス河原町三条地下鉄東西線京都市役所前駅下車でも可,ハリケーンが京都進出した時の1号店で2018年に休業するまでUFOキャッチャー専門店だった（店舗の外に太鼓の達人が置いてあった時期も有）2018年に入ってからは隣接する寺町京極店のみ営業、京都本店側の店舗には入れない状態だった（休業中は新京極側の入口を塞ぐ様にガチャガチャが置かれていた）2018年3月に告知があり物産店「キャラクターショップ　はんなりー」が3月中旬オープン（「はんなりー」は物販店でゲームセンターで無い為、当wikiには記載してません）。「はんなりー」の店内には前施設で使われてたUFOキャッチャー等の機械等はある程度残っているもののアニメグッツも販売している模様2018年3月現在は新京極通り側は「はんなりー」の看板になっているものの裏側に廻った寺町通りの裏側の入口に旧店舗のハリケーン京都本店の看板が撤去されずに残っている（ただしこの寺町側は倉庫になっているので入店出来ない）,,
こどものひろばレインボーランド,京都市伏見区桃山町西尾12-1イズミヤ六地蔵店2F,京阪六地蔵駅下車徒歩5分,,,
ファンタジーアイランド,京都市伏見区醍醐高畑町1-37アルプラザ醍醐店3F,地下鉄醍醐駅前下車すぐ京阪バス醍醐駅前下車すぐ,,,
ピュアハートキッズランド伏見桃山,京都市伏見区桃山町山ノ下32MOMOアミューズメント棟1F,JR・地下鉄六地蔵駅下車徒歩5分,2013年12月21日より現店舗名で営業中旧ファンタジーキッズリゾート伏見桃山,,
伏見サティー内ゲームコーナー,京都市伏見区御堂前町616伏見サティー4F,京阪電車伏見桃山駅下車徒歩10分,,,
メガドームDOSSE,京都市伏見区横大路下三栖宮ノ後30-1,市バス横大路車庫前下車徒歩5分,,,
ROUND 1 京都伏見店,京都市伏見区下鳥羽平塚町23,市バス国道下鳥羽下車徒歩5分京都らくなんエクスプレス国道毛利橋東・宝酒造前下車すぐ京阪バス伏見警察署前下車徒歩5分,各社バスでも最寄りの場所まで行けるが京都駅八条口より無料の送迎バスも有り（鉄道では駅から2km以上ある上にルートが複雑なので地元の人以外お勧め出来ない,,
キョーイチアミューズメントパーク吉祥院,京都市南区吉祥院石原長田町1-2,市バス久世橋東詰下車すぐ,2014年8月6日ボウリング場を先行リニュアルオープン、1階ゲームセンター部分のみ10月4日オープンタイトーレンタリースシステム利用店,,
ゲームメイト,京都市南区東九条西山王町31京都アバンティ6F,京都駅八条口,2013年10月31日オープンUFOキャッチャー専門店、以前は4階で営業してたが現在は6階に移動している,,
辻商店,京都市南区東九条上殿田町13,JR・近鉄・京都市地下鉄・各社バス京都駅八条口から徒歩5分,駄菓子屋とゲームセンターが一緒になっているお店京都駅八条口から徒歩圏内だが目立った大通り沿いでは無く小さな道沿いの住宅街の中にお店はあるので初めて行く人は要注意,,
namcoイオンモールKYOTO店,京都市南区西九条鳥居口町1イオンモールKYOTO-sakura館4F,京都駅八条口,イオンモールKYOTOにはイオン系列のモーリーファンタジーは無い為、館内で唯一のゲームコーナーです,,
モーリーファンタジー桂南店,京都市南区久世上久世町485ダイエー桂南店2F,阪急洛西口駅下車徒歩20分市バス上久世下車すぐ,旧らんらんらんど桂南店,,
モーリーファンタジー京都桂川店,京都市南区久世高田町376イオンモール京都桂川3F,阪急洛西口駅下車徒歩5分JR桂川駅すぐ,2014年10月17日オープン,,
モーリーファンタジー洛南店,京都市南区吉祥院御池町31イオン洛南店2F,JR西大路駅下車徒歩10分市バス船戸町下車すぐ,2014年3月2日にて施設改装で一旦閉店したが6月12日のリニュアルオープンで復活し名称変更,,
楽市楽座,京都市南区久世高田町376イオンモール京都桂川3F,阪急洛西口駅下車徒歩5分JR桂川駅すぐ,2014年10月17日オープン,,
USLAND桂南店,京都市南区久世上久世町485ダイエー桂南店2F,阪急洛西口駅下車徒歩20分市バス上久世下車すぐ,2016年2月13日オープン,,
スーパーボウル吉祥院,京都市南区吉祥院石原長田町1-2,市バス久世橋東詰下車すぐ,2014年5月まで営業,,
プレイランドわくわくランド,京都市山科区音羽野田町1西友山科店4F,京阪バス山階校前下車すぐ,,,
山科グランドボウル,京都市山科区西野楳本町113,京阪バス川田道下車すぐ,2013年12月21日オープン、現在はパチスロ・プリクラ等のみ,,
プレイランド,京都市山科区椥辻草海道町15-1ヒカリ屋山科店3F,地下鉄・京阪バス椥辻駅下車すぐ,2016年7月現在はヒカリ屋の1階にも子供向けのゲームコーナーが有り,,
らんらんらんど山科店,京都市山科区椥辻草海道町15-1ヒカリ屋山科店3F,地下鉄・京阪バス椥辻駅下車すぐ,,,
モーリーファンタジー綾部店,綾部市綾中町花ノ木30バザールタウン綾部アスパ館2F,JR綾部駅下車すぐ,2014年10月11日開店、旧らんらんらんど綾部店,,
アミューズメントスクエア モナコ宇治,宇治市大久保町旦椋122,京阪バス林停留所下車すぐ,各種ゲーム機がある程度置いてあり宇治では一番最新機種が揃っている,,
キッズUSLANDベルファ宇治店,宇治市槇島町清水48ベルファ宇治2F,近鉄向島駅下車徒歩20分,子供向けの滞在時間に応じて課金されるゲームコーナー,,
キョーイチボウル宇治,宇治市小倉町神楽田55-1,近鉄小倉駅下車徒歩3分,タイトーレンタリースシステム利用店,,
キョーイチアミューズメントパーク,宇治市小倉町神楽田55-1,近鉄小倉駅下車徒歩3分,パチスロやMJ、麻雀格闘倶楽部などは台数が多め,,
ゲームズミルク,宇治市大久保町北ノ山101-5-2F,近鉄大久保駅下車徒歩3分(自衛隊方面),2014年9月22日に2階へ移転し会員制ゲーセンになっている元々ゲーセンがあった1階部分は飲食店になっている,,
スーパーハンマー,宇治市伊勢田町浮面59ドン・キホーテ宇治店内,京阪バス名木北口停留所下車して西へ400m,UFOキャッチャー専門店旧ウィズワン宇治店,,
ぷらっとらんど,宇治市広野町西裏100平和堂100BAN店1F,近鉄大久保駅下車徒歩3分,子供向けゲームコーナー,,
ぷらっとらんど,宇治市槇島町清水48ベルファ宇治1F,近鉄大久保駅下車徒歩3分,スーパーTOKUYAの入口部分にあるUFOキャッチャーとプリクラのみ設置,,
プリッズ宇治店,宇治市莵道平町28アルプラザ宇治東3F,京阪三室戸駅下車徒歩15分,ナムコ系列のお店,,
レインボー小倉内ゲームコーナー,宇治市小倉町神楽田25レインボー小倉店3F,近鉄小倉駅下車すぐ,2015年11-12月ごろオープン,,
ファインワールド,亀岡市古世町西内坪101イオン亀岡店3F,JR亀岡駅下車すぐ,この手の店舗には珍しく「ガンダム戦場の絆」も置いてあった,,
アルプラザボウル亀岡,亀岡市篠町野条上又11-1アルプラザ亀岡店3F,JR馬堀駅下車徒歩15分,,,
西友亀岡店内ゲームコーナー,亀岡市追分町馬場通15-1西友亀岡店B1F,JR亀岡駅下車徒歩3分,4Fにあった大きなゲームコーナーは無くなってます現在は地下1階に移動してるが子供向けで少ししかありません,,
バーチャルバッティング亀岡ドーム,亀岡市千代川町小林植田24-1,JR並河駅又は千代川駅下車徒歩15分,ゲーム機は少ないが麻雀格闘倶楽部はある,,
BIG SANTA亀岡店(タカラ島亀岡店),亀岡市篠町野条上又11-1アルプラザ亀岡店3F,JR馬堀駅下車徒歩15分,2014年6月9日にて旧OPが撤退現在は新OPに変更され7月5日再開,,
ステーションボウル新田辺,京田辺市田辺津田35,近鉄新田辺駅又はJR京田辺駅下車すぐ,UFOキャッチャーやパチスロが数台有る程度,,
ユーイング,京田辺市田辺中央五丁目2-1アルプラザ京田辺店3F,JR京田辺駅下車すぐ近鉄新田辺駅下車徒歩5分,,,
アミューズメントパークタカラ島峰山店,京丹後市峰山町字新町1606-1エール峰山店(峰山マイン)4Ｆ,京都丹後鉄道峰山駅下車徒歩30分丹海バス試験場前又は新町下車,,,
プラザアピア峰山,京丹後市峰山町菅376,京都丹後鉄道峰山駅下車徒歩20分丹海バス菅下車すぐ,,,
イズミヤ大久保店内アミューズメントコーナー,城陽市平川室木85イズミヤ大久保店1F,京阪バス大竹下車すぐ近鉄大久保と久津川の間,ガチャガチャとトレーディングカードアーケードゲームのみ,,
スーパーボウル城陽（現在休業中）,城陽市奈島長尾17,JR山城青谷駅下車徒歩10分,タイトーレンタリースシステム利用店2017年12月31日より隣接するパチンコ屋と共に改装の為休業中,,
namcoアルプラザ城陽店,城陽市富野荒見田112アルプラザ城陽4F,JR長池駅下車徒歩5分,,,
バッターボックス城陽,城陽市観音堂甲田55,JR長池駅下車徒歩10分,,,
