name,address,access,remarks,latitude,longitude
アミューズメントパークMG ZIATH,福山市柳津町1-7-60,同上,旧：セイタイトーZIATH松永福山のMGは近接して2店舗あるので注意,,
ノンノン,福山市神辺町道上十三軒屋6-3,,,,
T/Sフジグラン神辺店,福山市神辺町大字新道上字2-10-26フジグラン神辺店3F,JR福塩線 道上駅下車徒歩20分,旧：ラクガキ王国神辺店国道486号線と国道182号線角,,
アミパラ神辺店,福山市神辺町大字新道上1-2-1,同上,フジグラン神辺店向かい,,
喫茶・じゅく,府中市広谷町877-7,,,,
ファミリープラザ,三次市十日市東4-1-30三次サングリーン1F,三次駅から東へ徒歩約5分,家族向け。ビデオ筐体なし,,
ジョイランド,三次市十日市中1-1-10CCプラザ3F,三次駅から西へ徒歩約5分,家族向け。ビデオ筐体なし,,
ビートル2,三次市南畑敷町603－3,八次駅徒歩3分だが三次からバスのほうがよい?,三次駅西より移転,,
すごろく屋,庄原市板橋町字宮之脇150-1,,旧:ザ・ビッグ庄原店ナムコランド,,
BJ東広島店,東広島市西条町御薗宇6120,西条ICより車で15分375号線経由円城寺入口交差点すぐ,賀茂ボウル隣接,,
アミパラここじゃ店,東広島市西条町下見6-10-19山手電気内,広島大学前の交差点より西へすぐ,,,
ナムコランド東広島店,東広島市西条町御薗宇4405番地フジグラン東広島店内,,,,
セガワールド東広島,東広島市西条中央7-2-14,,,,
TFSゆめタウン東広島店,東広島市西条土与丸1-5-7ゆめタウン東広島4F,JR西条駅下車徒歩約10分,,,
JJCLUB100廿日市店,廿日市市串戸1-8-18 2F,,,,
スペースＶ１廿日市,廿日市市本町4-23,山陽本線廿日市駅下車2号線沿い東へ徒歩15分,,,
廿日市アミューズメントパーク,廿日市市串戸1-8-18,,,,
フジグランナタリー店ナムコランド,廿日市市阿品3-1-1フジグランナタリー店2F,,,,
ピノッキースパティオ吉田店,安芸高田市吉田町吉田594-1 ゆめタウン吉田店2F,,2014年6月開店旧：タカラ島吉田店,,
ナムコランド広島店,安芸郡府中町大須2-1-1イオンモール広島府中3F,JR天神川駅・矢賀駅下車徒歩約7分,イオンモールでは愛称を使いません。,,
モーリーファンタジー広島府中店,安芸郡府中町大須2-1-1イオンモール広島府中3F,,イオン棟の中です,,
セガ海田,安芸郡海田町南大正町3-35,,旧：SWメガ海田,,
フジグラン安芸店子供の国,安芸郡坂町北新地2-3-30フジグラン安芸2F,,,,
THE 3RD PLANET 山口店,山口市湯田温泉6丁目8番号3号,湯田温泉バス停・下湯田バス停より徒歩,湯田自動車学校近く,,
TFS山口メルクス店,山口市大字黒川82-1ハイパーモールメルクス内,,旧：T/Sメルクス店2013年5月、FC店舗へ移行,,
AGスクエア小郡店,山口市小郡前田町3-6イオンタウン小郡内,,結果的には山口にセガのお店が返り咲き。,,
メリーゴーランド大内店,山口市大内長野581ザ・ビッグ大内店2F,,,,
てくもぴあ阿知須店,山口市阿知須4825-1サンリブ阿知須店2F,,,,
アミパラ下関店,下関市長府才川1-42-48,,長府警察署南側,,
ハイテクゲームセンター Ｔ＆Ｇ,下関市秋根本町2-1-11,新下関駅新幹線口より徒歩7分,ビデオレンタルＴ＆Ｇ併設、台数は極少数。18禁,,
まんがハウスまほーどう下関店,下関市秋根本町2-7-8,JR新下関駅、県道34号沿い,入場料不要コーナーに極少数,,
ラッキーパレス新下関,下関市秋根町1-6-14,,,,
ラッキーパレス向洋,下関市後田町1-8-20,,,,
ラウンドワン下関店,下関市東大和町1-3-15,下関駅徒歩10分,,,
らんらんらんど下関店,下関市竹崎町4-4-7シーモールエスト4F,,シーモールエストは旧ダイエー棟。,,
プレイランド サーカス,下関市山の田本町15-2,,地図はいったん外しています。開店は18時から,,
GAME パフェ,下関市竹崎町4-4-8シーモール専門店街5F,,旧：セガワールドシーモール下関,,
ゲームワールドD,下関市綾羅木新町3丁目951-13Mr.MAX2F,,,,
宇部アレックス,宇部市西宇部南3丁目5−53,宇部駅徒歩6分,旧「GAME ALEX」2017年2月リニューアル,,
namcoフジグラン宇部店,宇部市明神町3-1-1フジグラン宇部店2F,宇部岬駅徒歩8分宇部新川駅からバスもあり,ボウリング場併設,,
てくもぴあ宇部店,宇部市妻崎開作411-1,,,,
パークレーン宇部,宇部市昭和町4-11-20,,,,
ユーズボウル宇部,宇部市大字妻崎開作字崎24,流山交差点そば,,,
カッタの湯,宇部市海南町1675,,,,
ドラゴンボール,周南市河東町6-43,JR徳山駅から車で5分,,,
Apuo新南陽店,周南市清水2-2-1ゆめタウン新南陽3F,,,,
ビバーチ周南,周南市古市1-4-1イオンタウン周南内,新南陽駅徒歩15分,,,
フジ新南陽店ちびっこランド,周南市政所2-2-1フジ新南陽店4F,,,,
アミュージアム周南店,下松市中央町21-3THE MALL周南食遊館3F,JR下松駅から車で10分,2016年6月リニューアル,,
ふぇすたらんど下松店,下松市南花岡6丁目8-1サンリブ下松店内,,,,
ネオ・ブラボー,防府市高倉1-3-30,防府西IC、防府東ICより車で10分、佐波1交差点すぐ,,,
プリクラキャンパス,防府市佐波2-6-16,,,,
モーリーファンタジー防府店,防府市中央町1-3イオン防府店3F,,,,
ステップ,防府市天神1丁目7-29,,商店街の中,,
ピノッキースパティオ防府店,防府市八王子2－8－8イズミゆめタウン防府3F,,,,
ピノッキースパティオ南岩国店,岩国市南岩国町1-20-30ゆめタウン南岩国店2F,,,,
フジグラン岩国店アミューズメントパーク,岩国市麻里布町2-9-8フジグラン岩国店6F,,,,
WAIWAI岩国店,岩国市南岩国1-21-12,JR南岩国駅より西へ200m,,,
ギガゾーン岩国店,岩国市室の木,国道2号沿い,,,
ナムコランドおのだサンパーク店,山陽小野田市中川6-4-1おのだサンパーク内,南中川駅が最寄ですが小野田からバスのほうが楽,NLおのだサンパーク店は一部区域が8号です。,,
namcoゆめタウン小野田店,山陽小野田市中川6-4-1ゆめタウン小野田2F,南中川駅が最寄ですが小野田からバスのほうが楽,NLおのだサンパーク店とは別です,,
アミューズトマト,萩市椿東3025-5,東萩駅から北へ徒歩12分、国道191号沿い,2013年7月1日より平日の開店時間が12:00 → 16:00に変更,,
ジョイジョイランド,萩市御許町42-1アトラス萩内,,,,
アミューズメントスペースMAC萩店,山口県萩市大字椿東3000-5萩ロイヤルインテリジェントホテル2F,東萩駅下車すぐ,,,
ユーズボウル萩,萩市大字椿河尻2291‎萩市椿2291,,,,
ふぇすたらんど萩店,萩市唐樋町2-4サンリブ萩店内,,,,
フジ長門店ちびっこランド,長門市仙崎網田322-2,長門市駅徒歩16分,,,
長門ウェーブさんさんランド,長門市東深川803-8長門コミュニティータウンウェーブ内,長門市駅徒歩5分,,,
フラーボ・スパティオ店,柳井市南町4-5-3ゆめタウン柳井2F,,,,
モーリーファンタジー光店,光市浅江字木園1756-1イオン光店2F,,,,
アミューズメントパークMG徳島店,徳島市西新浜町1-45マルナカ徳島店2F,県道29号沿い,,,
アポロゲームセンター沖洲店,徳島市南沖洲1丁目93-1,県道38号沿い,16歳未満入場不可､ケーズデンキ前参考,,
セガ徳島スエヒロボウル,徳島市南末広町4-95-2,,2014年3月開店セガワールドスエヒロとは別店舗として扱います。,,
わくわくらんどタクト店,徳島市南島田町3-55キョーエイタクト店内,県道30号沿い,,,
パレパレ田宮店,徳島市南田宮2丁目2-46遊場1F,県道30号沿い,経営会社はアポロ沖洲店の親会社,,
ラウンドワン徳島･万代店,徳島市万代町4丁目19-1,,,,
ファミリーランド,徳島市寺島本町西1-5徳島そごう9F＆屋上,JR徳島駅徒歩約2分,,,
とくしまファミリーランド,徳島市渋野町入道22番地1,,とくしま動物園に隣接する施設､ゲームコーナーは2ヶ所あり入園料は発生しない､有料駐車場(1日310円),,
ドリームフィールド,徳島市西新浜町2-62-2ドリームフィールド内,徳島駅より南へ約5キロ,メディアカフェハートランド(ネットカフェ､バッティングセンターなどの施設)内ゲームコーナー､台数ごく少数,,
パロ小松島店,小松島市小松島町字領田20ショッピングプラザルピア内,国道55号沿い,敷地内建物に隣接した店舗,,
ナムコランド鳴門店,鳴門市撫養町大桑島字濘岩浜4-1パワーシティ鳴門店別棟,,,,
プレイランド,鳴門市撫養町小桑島字前浜23キョーエイ鳴門駅前店内4F,JR鳴門駅から徒歩約2分,,,
オートレストボックス24,三好市井川町吉岡197,国道192号沿い,コインスナックゲームコーナー的な感じ､小中学生は入店不可,,
ふぇすたらんど脇町店,美馬市脇町字拝原1711-1マルナカ脇町店2F,,,,
ファンタジーランドパルシー店,美馬市脇町大字猪尻字西分116-1ショッピングコアパルシー内,,古めの店,,
アミューズメントパークMGアワーズ店,阿波市阿波町伊沢田88ショッピングプラザアワーズ内,県道12号沿い,,,
コインスナック御所24,阿波市土成町吉田字原田市の一,県道12号沿い,コインスナックゲームコーナー,,
アペックス山川,吉野川市山川町前川197-1,県道3号沿い,ダイソーと建物は同じ､道路沿い看板や地図ではキョーエイ,,
プレイランド,吉野川市鴨島町上下島92-3アクアシティ内,,,,
ジャンボ山川,吉野川市山川町川田995,国道192号沿い,セルフうどんジャンボ山川店併設､コインスナックゲームコーナー,,
アペックス上板,板野郡上板町西分字カヤノ17-1,県道14号沿い,レンタルビデオ店と併設,,
タイトーステーション フジグラン北島店,板野郡北島町鯛浜字西ノ須81-1フジグラン北島店敷地内別棟,,旧：ハロータイトー北島,,
namcoゆめタウン徳島店,板野郡藍住町奥野字東中須88-1ゆめタウン徳島2階,,,,
メジャースポーツアイズミ,板野郡藍住町奥野東中須27メジャースポーツアイズミ内,,ヤマダ電機近くのスポーツ施設内ゲームコーナー､台数ごく少数,,
ゲームコーナーラッキー,名西郡石井町浦庄上浦256-5,JR下浦駅より西へ1.8㎞､国道192号沿い,コインスナックゲームコーナー,,
ポップジョイ石井,名西郡石井町高原字中須16-1,県道30号沿い,ボウリング場内ゲームコーナー,,
namcoフジグラン石井店,名西郡石井町高川原字天神544-1フジグラン石井店2F,県道30号沿い,旧：NL石井店,,
アミュージアム高松,高松市伏石町2144-9,レインボーロード、東バイパス　伏石町交差点,2017年7月リニューアル：音ゲー多・ボウリング併設,,
ソユーゲームフィールド高松店,高松市香西本町1-1イオンモール高松2F,,旧：SOYU GOLDEN CITY高松店,,
モーリーファンタジー高松店,高松市香西本町1-1イオンモール高松3F,,,,
ROUND 1 高松店,高松市松島町2-7-43,R11沿いことでん松島二丁目駅が近いです,,,
アミューズメントパークMG レインボー店,高松市多肥下町630マルナカ2F,,,,
MG BOWL 屋島店,高松市屋島西町(百石)1912-1パワーシティー屋島 生活館3F,,,,
やしま第一健康ランド,高松市屋島西町2274-5,,,,
戦(IKUSA),高松市高松町2554-18,R11沿いことでん屋島駅徒歩5分,16歳未満の児童も入店できます,,
ナムコランド十川店,高松市十川東町55-1フジグラン十川店別棟,,,,
モーリーファンタジー高松東店,高松市福岡町3-8-5イオン高松東店3F,,旧：MF高松サティ店,,
アミューズメントパーク11,高松市浜ノ町59−10‎シーサイドボウル内,JR高松駅徒歩10分､瀬戸大橋通り沿い,,,
セガ高松,高松市勅使町字山王535,R11 勅使交差点,旧：セガワールド高松　2012年10月19日リニューアル,,
ビバラスベガス,高松市西ハゼ町(字清水)18マルナカ栗林南店2F,,,,
ゆめタウン高松店ゆめランド,高松市三条町字中所 608-1ゆめタウン高松内,R11沿い,ゆめキッズから店名変更、音ゲーが太鼓の達人のみ,,
ゲオパーク東バイパス店,高松市太田下町2481-1ゲオ東バイパス店内,,,,
ゲオパークミラクルタウン店,高松市郷東町210-1ゲオミラクルタウン店内,,,,
縁日街道　中村座,高松市上天神町中の坪536パウ高松1F,R11、R193上天神交差点,"ドン・キホーテ内AM5時まで営業,ほぼプライズ機のみ",,
スーパー銭湯あかね温泉,高松市茜町13-1,,パチスロ､クレーン機など台数は極少数,,
関西急行フェリー（株）,高松市玉藻町1-3,,？,,
ヴィラ塩江,高松市塩江町上西字小向乙688-1,,？,,
高松空港,高松市香南町岡1312番地7,,？,,
ゼムスランド,高松市香川町大野916-1ウイングポート内,,ゼムスランドとは別に2Fゲームコーナーがあり、ビデオゲーム系もそちら。1Fにも乗り物系エレメカ有,,
サーカスサーカス坂出店,坂出市江尻町1000-1坂出中央ボウル1F,県道33号沿い坂出警察署前,JR坂出駅徒歩10分,,
H/T 丸亀,丸亀市川西町南1280-1フジグラン丸亀バッハ棟2F,,,,
セガ丸亀,丸亀市蓬莱町56-1パブリックプラザ丸亀内,,2011年3月再リニューアル旧：セガワールド丸亀,,
アミパラ丸亀店,丸亀市飯野町西分584-1XYZ（ジーズ）丸亀モール内,R11バイパス飯野交差点近く丸亀コミュニティバス飯野中津線「長友団地」下車,,,
ビッグウェーブ丸亀店,丸亀市新田町150ゆめタウン丸亀店3F,丸亀コミュニティバス飯野中津線「ゆめタウン前」下車,,,
丸亀ぽかぽか温泉,丸亀市山北町400-1,,ねぎラーメン小山前､施設はあるが…,,
マックスプラザ善通寺,善通寺市中村町1798－2マックスボウル1F,R11中村交差点角,食事可能AM5時まで営業（金土日以外はAM3時まで）,,
ふぇすたらんど豊浜店,観音寺市豊浜町姫浜1158-1マルナカ豊浜店内,,,,
観音寺グランドホテル,観音寺市観音寺町甲294-1,,？,,
ビッグウェーブ三豊店,三豊市豊中町本山22ゆめタウン三豊内,,,,
ファンパラダイス,さぬき市志度1057志度ファミリーボウル内,,ボーリング場内ゲームコーナー,,
アミューズメントパークMG 志度店,さぬき市志度2431-1パルティフジ志度店別棟,,旧：セイタイトー志度,,
クアタラソさぬき津田,さぬき市津田町鶴羽24番地2,,施設はあるが設置しているかは不明,,
クアパーク津田,さぬき市津田町松原地内,,施設はあるが設置しているかは不明,,
ふぇすたらんど白鳥店,東かがわ市白鳥町白鳥字城泉144-1マルナカ白鳥店内,,,,
モーリーファンタジー宇多津店,綾歌郡宇多津町浜二番丁16-1宇多津ビブレ1F,JR宇多津駅より北へ徒歩4分浜街道沿い,旧：ダイナレックス宇多津店,,
プレイランド,綾歌郡宇多津町浜一番町8-1ゴールドタワー内,,入園料と時間(又はﾊﾟｯｸ)料金が必要大型筐体や体感ｹﾞｰﾑ､ﾋﾞﾃﾞｵｹﾞｰﾑは全てﾌﾘｰﾌﾟﾚｲで大型筐体は貴重なものもあり,,
スポーツドーム宇多津,綾歌郡宇多津町浜二番町19,,,,
アミューズメントパークMG 宇多津店,綾歌郡宇多津町2419-1マルナカ新宇多津店内,県道33号(旧国道11号)沿い松下寿電子工業跡地,09年4月26日OPEN,,
瀬戸大橋四国健康村,綾歌郡宇多津町浜一番丁6-10,,施設はあるが…,,
モーリーファンタジー綾川店,綾歌郡綾川町萱原822-1イオンモール綾川3F,国道32号沿い,,,
モーリーファンタジー・F綾川店,綾歌郡綾川町萱原822-1イオンモール綾川3F,同上,旧：ファンタジーアイランド綾川店モーリーファンタジー綾川店とは別,,
アミューズメントT3,仲多度郡まんのう町東高篠1721-1マンガ図書館ティースリー1F‎,県道200号沿い,店舗環境悪し,,
ビレッジ美合,仲多度郡まんのう町勝浦1番地,,施設はあるが…,,
ビデオショップユニバーサル,小豆郡土庄町渕崎上森田2200-3,,？,,
オリンピアゲームコーナー,小豆郡土庄町形崎,,？,,
パラダイスアイランド,小豆郡土庄町字半の池甲1360-71,,？,,
アミューズメントパーク宝島三木店,木田郡三木町大字氷上482-2マルナカ三木店2F,,,,
太洋ボウル,高松市観光通2丁目10-15,,1Fゲームコーナーに別テナント入り(2015年末頃？),,
アミパラ松山店,松山市生石町655－1,JR松山駅より南西1kmバスも可,,,
アミューズメントパークMG 朝生田店,松山市朝生田町773-1第一自動車教習所ビル1F,,,,
アミューズメントパークMG 北条店,松山市下難波御領田甲227-2マルナカ北条店内,,小さなゲームコーナー,,
駅前スタジアム3,松山市大手町2-4-1,JR松山駅より南へ徒歩1分,利用5時間迄P無料,,
ゲームインベース,松山市大街道2-3-2,,プライズ専門店駐車場なし？,,
ショコラ,松山市柳井町1-13-12マンションクレール1F,,ゲーム機を少数設置したカードゲームなども扱っている店ファンサイト駐車場については未確認,,
ショッカー,松山市湊町4-9-8 1F,市駅から銀天街入って2分,駐車場なし？,,
セガ松山,松山市枝松5-7-32,小坂交差点を東に300ｍ松山市駅よりバス,旧：セガワールド枝松,,
T/S衣山店,松山市衣山1-188パルティフジ衣山店1F,伊予鉄高浜線衣山駅より徒歩数分,,,
namcoフジ姫原店,松山市姫原2-4-28フジ姫原別棟2F,,旧：NL姫原店18歳未満の児童も法律、条例の範囲で入場可。,,
namcoフジグラン松山店,松山市宮西1-2-1フジグラン松山店4F,,キッズ向け,,
バンバン2,松山市道後樋又5－28,旧 南海放送より東へ100ｍ,愛媛FCサポートショップ。愛媛FCファンクラブ会員特典あり。参考,,
バンバン衣山,松山市衣山1-248-1,伊予鉄高浜線衣山駅より徒歩,08年4月OPEN愛媛FCサポートショップ。愛媛FCファンクラブ会員特典あり。参考,,
アミューズメントパークMG 大街道店,松山市大街道1-4-17,伊予鉄市内電車大街道駅下車 南へ350ｍ,2014年3月開店,,
モーリーファンタジー松山店,松山市天山1丁目13番5号イオン松山店3F,,旧：ファンタジーアイランド松山店,,
プレイドーム松山,松山市余戸南4-9-40,伊予鉄鎌田駅より徒歩3分,ビデオゲーム専門,,
ラウンドワン松山店,松山市東長戸1-3-10,松山市駅からバス,台揺すり等は厳禁である。（中学生連行）明るい雰囲気だからと舐めると警察沙汰になります。,,
らんらんらんど南松山,松山市朝生田町5-1-25ジョー・プラ2F,,,,
松山中央ボウル,松山市中央1-3-20,,ボウリング場内ゲームコーナークレーン等少数のみ→現在撤去,,
TFS今治ワールドプラザ店,今治市東村1-14-2ワールドプラザ内,今治駅からバス,旧：セガワールド今治,,
ふぇすたらんど今治店,今治市馬越町4丁目8-1イオン今治店3F,,旧：ダイナレックス今治店およびモーリーファンタジー今治店,,
namcoフジグラン今治店,今治市東門町5-13-1フジグラン今治店2Fワンダーパーク今治内,今治駅からバス,旧：ナムコランド今治店,,
楽市楽座イオンモール今治店,愛媛県今治市にぎわい広場1番地1イオンモール今治店2F,今治駅よりシャトルバス有,,,
モーリーファンタジー今治新都市店,愛媛県今治市にぎわい広場1番地1イオンモール今治店2F,今治駅よりシャトルバス有,,,
桑名ボウル,今治市延喜甲198-1,,ボウリング場内ゲームコーナー設置台数極少数,,
アミューズメントパークMG 東予周布店,西条市周布715-1フジ東予店別棟,,,,
ナムコランド西条玉津店,西条市玉津564-1フジ西条玉津店2F　ワンダーパーク西条内,産業道路沿い伊予西条からバス,,,
アミューズメントパークMG 伊予三島店,四国中央市中之庄町(字汐汲道)75-1,国道11号沿い宮脇書店伊予三島店の隣,旧：セガワールド伊予三島,,
アミューズメントパークMG 川之江店,四国中央市妻鳥町(中足鍋)1764-1イオン別館,三島川之江ICより直進 車で3分,,,
ナムコランド川之江店,四国中央市妻鳥町1136-1フジグラン川之江店別館2F,国道192号沿い,,,
川之江中央ボウル,四国中央市川之江町2124,,ボウリング場内ゲームコーナー設置台数少ない,,
アミューズメントパークMG 新居浜店,新居浜市上泉町甲1996-1マルナカ新居浜本店2F,,11/11 OPEN,,
アミューズメントパークMG 新居浜駅前店,新居浜市坂井町2-3-8パルティ・フジ新居浜駅前店内,,,,
子供の国フジグラン新居浜店,新居浜市新須賀町2-10-7フジグラン新居浜店3F,,,,
ハイテクセガ新居浜,新居浜市徳常町6-8,徳常バス停より西へ徒歩10分,旧 シネックス1F,,
プラサカプコン新居浜店,新居浜市前田町8-8イオンモール新居浜2F,,,,
モーリーファンタジー新居浜店,新居浜市前田町8-8イオン新居浜店2F,,,,
ボウルオオクラ,新居浜市船木4616,,ボウリング場内ゲームコーナー設置台数少ない,,
アミューズメントパークMG 宇和島店,宇和島市保田字扇田甲899マルナカ宇和島店内,,,,
クアボウル,宇和島市高串1-435-1クアライフ宇和島内,JR北宇和島駅より徒歩10分,ボーリング場内ゲームコーナー営業時間 平日:13:00～24:00 土日祝日:10:00～24:00,,
ゲームプラザGANGAN,宇和島市保田甲1106-1ショッピングストアーいわむら2階,国道56号沿い,電源は自分で入れるか、1Fの店の人に頼む駐車台数は2～3台程度,,
namcoフジグラン北宇和島店,宇和島市伊吹町字タカヒ甲912-2フジ北宇和島店別棟,JR北宇和島駅より徒歩10分,旧：プリッズ宇和島店,,
namcoアクトピア大洲店,大洲市中村字宮之前246番地1,,旧：ナムコランドアクトピア大洲店,,
アクアボウル,大洲市大洲1024,国道56号沿い大洲消防署の裏の細い道入る,,,
namcoフジグラン北浜店,八幡浜市1259-9フジ八幡浜店3F,八幡浜港のほうが近い,2014年1月開店,,
らんらんらんど八幡浜駅前店,八幡浜市大字松柏丙フケ832-2ありがとうコーポレーションショッパーズ八幡浜駅前店3F,,,,
保内ボウル,八幡浜市保内町宮内1-5-1,,ボウリング場内ゲームコーナー設置台数極少数,,
namcoフジグラン重信店,東温市野田3-1-13フジグラン重信店2F,,,,
ナムコランド宇和店,西予市宇和町卯之町4-654フジ宇和店別棟2F,,,,
らんらんらんど宇和店,西予市宇和町卯之町5-390ありがとうコーポレーションショッパーズ宇和店1F,,,,
SOYU Forest Hunter松前店,伊予郡松前町筒井850エミフルMASAKI AM棟1F,伊予鉄古泉駅より専用バス or 徒歩,,,
ナムコランド砥部店,伊予郡砥部町重光239フジ砥部店2F,,,,
アミューズメントパークMG 内子店,喜多郡内子町内子1455フジ内子店内,R56沿い。内子駅が最寄,,,
ゲームコーナー(仮称),北宇和郡鬼北町近永390フジ広見店内,,プライズ機を中心に少数設置,,
ゲームコーナー(仮称),南宇和郡愛南町城辺乙544フジ南宇和店別館内,,08年8月ナムコ撤退後ゲーム機はいくつか残っている,,
ボウルサンパール,南宇和郡愛南町御荘平城681,,ボウリング場内ゲームコーナー設置台数極少数,,
アミュージアム高知,高知市介良字長丁乙317-1,高知道南国IC降りて車で10分,パワーシティ高知内,,
えの木,高知市旭町3-100-3,土佐電鉄旭町三丁目電停すぐ,駐車台数7台旧：えの木2,,
プレイプラン,高知市比島町3-16-17,高知駅(県交通)より中比島バス停徒歩2分,,,
u!帯屋町店,高知市帯屋町1-13-21,土佐電鉄堀詰駅徒歩2分,,,
ナムコランド葛島店,高知市小倉町3－30,,,,
セガワールドフジグラン,高知市朝倉東町52-15フジグラン高知3F,,,,
プラサカプコン高知店,高知市秦南町1-4-8イオンモール高知2F,,専門棟の中です。,,
