name,address,access,remarks,latitude,longitude
ニコパニトリモール相模原,相模原市南区大野台6-1-1ニトリモール相模原3F,古淵駅,,,
キッズトレイン相模原,相模原市松が枝町17-1イトーヨーカドー相模原店3F,小田急相模原駅,,,
GAME SILK HAT 横須賀中央,横須賀市若松町1-5プライムビル,横須賀中央駅,旧：AM St.Tropez 横須賀中央,,
アミューズメントパラダイスゼロワン,横須賀市若松町1-6ヨコビル内,レトロビデオゲームが多数,,,
プラサカプコン横須賀店,横須賀市若松町2-30モアーズシティ内,,,,
アドアーズ横須賀店,横須賀市本町3-27 横須賀APT 1F,汐入駅、横須賀駅,,,
パロ横須賀店,横須賀市本町2-1-12ショッパーズプラザ横須賀4F,汐入駅、横須賀駅,旧:アトランティックシティー,,
らんらんらんど横須賀店,横須賀市本町2-1-12ショッパーズプラザ横須賀 4F,,同一OPでもパロ横須賀店とは別,,
ゲームランデブー横須賀店,横須賀市本町2-1-12ショッパーズプラザ横須賀 5F,,旧：オクティガーデン,,
リヴインよこすか　キッズパーク,横須賀市平成町3-21-4リヴインよこすか2F,,,,
モーリーファンタジー久里浜店,横須賀市久里浜5-13-1イオン久里浜店3F,,旧：ファンタジーアイランド…,,
ゲームファンタジア平塚店,平塚市紅谷町14-21,JR東海道線　平塚駅,,,
namcoOSC湘南店,平塚市代官町33-1OSC湘南シティ内,〃,旧：ナムコランド平塚店、OSCの方にもゲームコーナーあり,,
アミューズメントランドYAZ平塚店,平塚市田村1-4-26,,,,
SEEK ONE,平塚市田村2-7-31ドン・キホーテビル4F,,,,
アミューズメントべネクス平塚店,平塚市四之宮6-10-27,,,,
GAME PIA大船,鎌倉市大船1-24大船駅前ビル 1F-3F,大船駅,旧：AM～,,
ホームラン,鎌倉市大船1-5-10大船会館 2F,大船駅,,,
ジャンボリー大船店,鎌倉市大船6-1-1イトーヨーカドー大船店2F,大船駅,,,
アドアーズ藤沢北口店,藤沢市藤沢460-1,藤沢駅北口,元アブレイズ藤沢店,,
ゲームインファンファン藤沢店,藤沢市鵠沼石上1-3-8,藤沢駅南口,,,
TFS藤沢店,藤沢市南藤沢21-1,,,,
ゲームランデブーダイエー藤沢店,藤沢市藤沢520ダイエー藤沢店5F,,,,
アニメイト藤沢店,藤沢市鵠沼東1-2藤沢プラザ B1F,,ゲームセンター併設,,
ソユーゲームフィールド湘南店,藤沢市辻堂新町4-1-1湘南モールFILL 2F,,旧：SOYU LAGOON湘南店,,
楽市楽座湘南藤沢店,藤沢市辻堂新町4-3-5ミスターマックス湘南藤沢SC 2F,,,,
ドラマ藤沢店,藤沢市本藤沢5-6-8,小田急線善行駅徒歩15分,,,
プレイランドピカキッズ,藤沢市石川6-2-1イトーヨーカドー湘南台店,,,,
長後ゲームセンター,藤沢市下土棚507,長後駅,,,
カバロ藤沢店,藤沢市鵠沼石上1-10-1イトーヨーカドー藤沢店5F,,,,
T/S小田原シティーモールクレッセ店,小田原市前川120小田原シティーモールクレッセ 2F,,旧：TAC小田原,,
セガワールド小田原,小田原市中里296-1ダイナシティイーストモール イトーヨーカ堂 3F,JR鴨宮駅から徒歩20分小田原厚木道路 小田原東ICから車で5分西湘バイパス 国府津ICから車で5分,,,
小田原メトロポリス,小田原市前川219-4,JR国府津駅から徒歩20分巡礼街道沿い,コロナワールド小田原内,,
T/S小田原店,小田原市栄町1-3-12,小田原駅,ようやくインベーダーの仲間入り小田原の2店舗を間違えないように,,
ヒルトン小田原リゾート＆スパ(ホテル内ゲームコーナー),小田原市根府川583-1,,旧スパウザ小田原,,
モーリーファンタジー茅ヶ崎店,茅ヶ崎市茅ヶ崎2-7-71イオン茅ヶ崎店3F,,旧：ダイナレックスイオン茅ヶ崎中央店と間違えないこと 2015年6月27日にリニューアル,,
モーリーファンタジー茅ケ崎中央店,茅ヶ崎市茅ケ崎3-5-16イオン茅ヶ崎中央店3F,,旧：ファンタジーアイランド茅ヶ崎店イオン茅ヶ崎店と間違えないこと,,
PLAY-IC 東海大学前店,秦野市南矢名1-15-1,東海大学前,,,
コパ3,秦野市南矢名2-19-5,,,,
秦野マスターズボウル,秦野市今川町1-7明玉ビル5F,,ゲームコーナー,,
モーリーファンタジー秦野店,秦野市入船町12-1イオン秦野店2F,,旧：ファンタジーアイランド…,,
SILK HAT 本厚木,厚木市中町2-4-13本厚木駅前ビル,,,,
パームトップス,厚木市中町4-15-9,,旧：LaOXコンピュータ館隣パームトップスはセガです。,,
ゲームインファンファン本厚木店,厚木市中町2-1-6,,,,
イミグランデ本厚木店,厚木市中町3-2-1,,厚木市中町2-11-10から移転,,
ファミリーランド厚木店,厚木市中町4-13-1イトーヨーカドー厚木店内6F,,,,
厚木プラザボウル　ゲームコーナー,厚木市中町2-3-1ダイヤプラザビル7F,,,,
ミリアンパーク,厚木市田村町9-25,本厚木駅徒歩10分,,,
神奈川レジャーランド厚木店,厚木市戸室5-31-1,,TVゲームエリアは24:00まで,,
アクティランド戸室,厚木市戸室1-29-15パシオス2F,,,,
厚木ツマダボウル,厚木市妻田北1丁目11-14,,R246,,
アドアーズ大和店Ａ館,大和市大和東1-4-3大黒屋ビル1F-2F,大和駅,,,
ゲームリスボア,大和市大和東1-3-12,大和駅が近いです,,,
桜ヶ丘ボウル,大和市深見3875,,GC併設,,
アミューズメントべネクス大和店,大和市下鶴間2752-2,,,,
イミグランデ大和店,大和市鶴間2-12-27,,,,
ドヌオス鶴間店,大和市下鶴間2-1-6,,ゲームコーナー,,
プレイランド大和鶴間店,大和市下鶴間1-3-1イトーヨーカドー大和鶴間店3F,,,,
モーリーファンタジー大和鶴間店,大和市下鶴間1-2-1イオン大和鶴間店3F,,,,
モーリーファンタジー大和店,大和市下和田字上ノ原1216-1イオン大和店3F,,MF大和鶴間店と間違えないこと,,
月見野バッティングセンター,大和市下鶴間807-1,,,,
T/S ダイエー伊勢原店,伊勢原市白根630-1ダイエー伊勢原店内,,旧：ダイエー伊勢原,,
ファミリーランド伊勢原店,伊勢原市桜台1-8-1イトーヨーカドー伊勢原店3F,,,,
T/S 海老名ビナウォーク店,海老名市中央1-18-1ビナウォーク6番館2F,海老名駅,旧：タイトートラップ,,
ハローズガーデン海老名店,海老名市中央2-4-1イオン海老名店2F,海老名駅,,,
イミグランデ海老名店,海老名市中央1-19-32,海老名駅,旧サンデーサン,,
ファンタジーキッズリゾート海老名店,海老名市中央3-2-5ショッパーズプラザ海老名3F,海老名駅,,,
ネバーランド2,座間市ひばりが丘4-11-8,さがみ野駅,,,
モラモラ大雄山店,南足柄市関本569ピアゴ大雄山店2F 3F,,,,
ミネボウル,綾瀬市上土棚南5-5-7,,,,
ハローズガーデン綾瀬店,綾瀬市深谷3734-1綾瀬タウンヒルズショッピングセンター2F,,,,
アミューズメントガーデン大磯,中郡大磯町国府本郷546,,,,
ゆう遊空間 新潟弁天橋店,新潟市中央区紫竹山5-1-15,JR新潟駅より車で5分,,,
ファミリーランド,新潟市中央区本町通6-1122-1イトーヨーカドー丸大新潟店6F,,,,
ROUND 1 スタジアム新潟店,新潟市中央区美咲町2-1-38,ホンマ健康ランドそば,,,
DeKKY401ファミリーパーク,新潟市中央区上近江4-12-20DeKKY401 2F,越後線 関谷駅,,,
ビルボードプレイスゲームコーナー,新潟市中央区八千代2-5-7万代シテイビルボードプレイス／BP2内,上越新幹線 新潟駅,,,
シルクドゥガリバー 新潟店,新潟市中央区南笹口1-1-1ドンキホーテ2F,新潟駅徒歩5分,,,
カプコサーカス新潟東,新潟市東区大形本町3-1-2ジャスコシティ新潟東内,,,,
新潟空港ビル,新潟市東区松浜町3710,,,,
モーリーファンタジー新潟東,新潟市東区大形本町3-1-2イオン新潟東店3F,白新線 大形駅,,,
カプコサーカス新潟東,新潟市東区大形本町3-1-2イオン新潟東店内ゲームコーナー,,,,
ゲオ新潟空港通り,新潟市東区浜谷町2-4-6,R113,,,
ポピー豊栄,新潟市北区内島見浦潟2545-2,,,,
モーリーファンタジー・ｆ NIIGATAMINAM店,新潟県新潟市江南区下早通柳田1-1-1イオンモール新潟南2階,,旧名famiu,,
モーリーファンタジー新潟南店,新潟県新潟市江南区下早通柳田1-1-1イオンモール新潟南3階,,,,
ハローズガーデン 新潟亀田店,新潟市江南区鵜ノ子4-446 アピタ亀田店2F,,,,
ゆう遊空間 新潟新津店,新潟市秋葉区程島萱の中1964-1,,,,
わんぱく遊園,新潟市秋葉区新津山谷南4566-1,,,,
メジャーロード白根店,新潟市南区上下諏訪木948-2,,,,
ららぽーと,新潟市南区茨曽根2433-1,,,,
タイトーＦステーション イオン新潟西店,新潟市西区小新南2-1-10 イオン新潟西店3F,,,,
リバプール,新潟市西区寺尾朝日通27-25,JR小針駅より車で5分新潟西郵便局向かい,,,
メジャーロード黒崎店,新潟市西区山田3302,サントノーレ裏,,,
ハローズガーデン 新潟西店,新潟市西区小新白鳥474 アピタ新潟西店2F,,,,
モーリーファンタジー新潟青山店,新潟市西区青山2-5-1,イオン新潟青山店2階,イオン新潟青山店復活に伴い開店,,
TFSイオン新潟西店,新潟市西区小新南2-1-10 イオン新潟西店3F,,旧：TFS新潟サティ店,,
プレイハウス エリナ,新潟市西蒲区津雲田640,JR岩室駅より車で5分,,,
ルナパーク,新潟市西蒲区曽根1554-1,,,,
プレイランド,柏崎市東本町1-16-35ショッピングセンターフォンジェ内,,,,
ナムコランドMEGAドン･キホーテ柏崎店,柏崎市東長浜町4-15MEGAドン･キホーテ柏崎店2F,,旧：ラパーク柏崎ナムコランド店,,
ナムコランドイオン三条店,三条市西裏館2-12-20,,旧：ジャスコ三条店ナムコランド,,
ソユーアスリートパーク 新発田店,新発田市住吉町5-11-5 イオン新発田SC2F,,6/30リニューアルOPEN,,
アピナ上越インター店,上越市下門前1661,,,,
T/S 上越店,上越市富岡3524 J-MAXシアター内,,,,
上越レジャーランボウル,上越市下門前薬島827-2,JR・えちごトキめき鉄道 直江津駅南口から徒歩約20分。関川大橋そば,同系列のカラーワールドと隣接しているが別店舗,,
ファミリーランド,上越市西本町3-8-8 イトーヨーカドー直江津店2F,,,,
ヴィバゾン,糸魚川市寺島3-2-40 2F,,,,
タイトーFステーション燕三条店,燕市井戸巻3-150 県央サティアメニティ棟1F,,,,
モーリーファンタジー県央店,燕市井土巻3-65イオン県央店2階,,,,
オーケーコーラル,燕市佐渡5160,三条燕ICより車で5分,,,
公楽園,燕市分水町大字熊森1283-1,JR分水駅より車で10分,,,
スターフィールド,長岡市新組町2003-1,,,,
テクノポリス,長岡市要町1-8-50,JR宮内駅より車で5分県道498号線沿い,,,
ナムコランドイオン長岡店,長岡市小沢町249-1,,旧：ジャスコ長岡店ナムコランド,,
プラボ長岡,長岡市堺町字浦田31アークガレリア長岡内,,,,
アピナ長岡店,長岡市堺東町22,,,,
プレイランド,岡市城内町2-3-12,JR長岡駅大手口（西口）から徒歩2分,イトーヨーカドー丸大長岡店6F,,
メジャーロード見附店,見附市上新田町字下野沖516-1,,,,
メジャーロード24,見附市今町4-20-568-1,,,,
プレイゾーンバンブー,南魚沼市竹俣60-6,17号モスバーガー隣り,スロットゲーセン,,
メジャーロード六日町,南魚沼市美佐島1801,,,,
ＷＩＮ,村上市田端町13－35,,,,
フリータイム,村上市九日市129,R7沿いJR岩船町駅より徒歩9分,,,
宝島十日町店,十日町市字上島丑735-1,,,,
ACT 五泉店,五泉市木越石道1930,竜門寺の近く,,,
GACEN HAWK,北蒲原郡聖籠町大夫興野,国道113号線沿い,参考,,
T/S ファボーレ婦中店,富山市婦中町下轡田165-1フューチャーシティファボーレ2F,速星駅が最寄だが富山からバスのほうが楽,KID店はありません旧：H/T 府中,,
アピタ富山店ナムコランド,富山市上袋100番地アピタ富山店2F,,,,
アピタ富山東店ゲームコーナー,富山市上冨居3-8-38アピタ富山東店2F,,旧：NLアピタ富山東店、namcoアピタ富山東店ナムコの直営から外れています。,,
GAMEinさんしょう富山駅前店,富山市桜町1-7-5,JR富山駅前,,,
GAMEinさんしょう二口店,富山市二口町5-9-7,,,,
GAMEinさんしょうアピタ富山店,富山市上袋100番地1アピタ2F,,,,
サービスエリアin古沢店,富山市古沢477,県道9号線(富山有沢線)沿い古沢交差点近く,,,
トヤマレジャーランド呉羽店,富山市高木字貝塚2054,県道44号線沿い,「トヤマ」はカタカナです。,,
アピナ富山新庄店,富山市荒川3-2-12,国道41号線沿い,,,
アピナ富山豊田店,富山市豊田町2-12-66,県道172号線沿い豊田2丁目交差点近く,,,
ハローワールド,富山市新庄銀座180,国道41号線沿い神島リビング近く,,,
らんらんらんど富山店,富山市堀川町355-7マイプラザ2F,,,,
アピナ富山南店,富山県富山市堀川町355-3マイプラザ内,,,,
常願寺サービスエリア,富山市水橋二杉120-1,国道8号線沿い水橋二杉交差点付近,8号です,,
アプレシオ呉羽店,富山市呉羽町2454-1,県道44号線(旧8号線)沿い,,,
サービスエリアin高岡店,高岡市石瀬下石瀬857-1,国道8号線富山高岡バイパスを側道へ降りる下石瀬西交差点すぐ,,,
ユーズランド,高岡市下伏間江383イオン高岡SC2F,,,,
Get Game佐野店,高岡市西藤平蔵1256-1AGIO 2階,国道156号線沿い加越能バス北蔵新より徒歩数分,,,
オートレストランぞうさん,高岡市戸出町野瀬689,国道156号線沿い,,,
ゲームスポット207,高岡市鐘紡町1655-3,国道156号線沿い鐘紡町南交差点近く,向かいはクラシエ薬品の漢方工場,,
West Coast,高岡市駅南2丁目1-1,,,,
ゲームスポット306,富山県高岡市昭和町2丁目267-5,国道8号線沿いヤマダ電機高岡店裏,,,
ドライブイン頼成山,砺波市頼成新5657-2,,参考,,
アピタ魚津店ゲームコーナー,魚津市住吉600番地アピタ魚津店2F,,旧：NLアピタ魚津店ナムコの直営から外れています,,
ゲームスポットアップル魚津,魚津市吉島2-407-1,(旧)国道8号線沿いアルペン隣,,,
らんらんらんど魚津店,魚津市駅前新町5-30サンプラザ3F,,,,
らんらんらんど氷見店,氷見市幸町9-78ハッピータウン氷見店2F,,,,
大仙自販機ショップ 氷見店,氷見市柳田4,国道160号線沿い,参考,,
プレイランド黒部,黒部市沓掛645,国道8号線沿い黒部IC入口交差点近く,,,
JINJINダイナー,小矢部市安楽寺2035-1,,,,
クアトロブーム小杉店,射水市小杉町三ヶ2602平和堂小杉店2F,JR小杉駅前,コスモパーク小杉店,,
ゲームセンター海豹,下新川郡入善町,国道8号線沿い,サービスエリアin入善店から西へ少し進んだところ,,
サービスエリアin入善店,下新川郡入善町上野柳堀7253-2,国道8号線沿い,,,
GAMEinさんしょうJr.入善コスモ21店,下新川郡入善町椚山1336番地コスモ21,国道8号線沿い椚山交差点すぐ,小規模ゲームコーナー,,
T/S 金沢,金沢市片町2-1-7宇都宮片町ビル,,不定期に25時まで営業（本店は営業延長許容地域内）,,
金沢コロナワールドメトロポリス金沢店,金沢市無量寺4丁目121番地1,映画館、ドン・キホーテなども併設,,,
スーパーフリークス駅西バイパス店,金沢市駅西新町2-3-10,金沢駅から車で5分、国道8号線沿い,,,
セガワールド金沢,石川県金沢市諸江町30番1,,アルプラザ金沢の営業は21時までだが、セガワ金沢の営業は22時まで。,,
バイパスレジャーランド藤江本店,金沢市藤江南2-41,国道8号線沿い、藤江交差点近く,全エリア8号です。参考,,
バイパスレジャーランド藤江本店新館,金沢市藤江南2-105,,参考,,
ファンタジープラザ金沢,金沢市西泉町4-11長崎屋内,長崎屋が閉店、MEGAドン・キホーテラパーク金沢店へ改装したものの、店は残っている,,,
モーリーファンタジー杜の里,金沢市もりの里1-70イオンもりの里SC イオンもりの里店2F,,,,
ゲーム・パラダイス,金沢市堀川新町5-1アミューズメントスクエア3F,,,,
ベティ,七尾市ウ部38,国道249号線沿い,看板猫がいる,,
コング七尾店,七尾市府中町員外26,七尾フィッシャーマンズワーフ前,,,
ナムコランド輪島,輪島市宅田町45-1パワーシティ輪島ワイプラザ内,市立輪島病院向い,,,
アミュージアム小松店,小松市園町八23-1アルプラザ小松店内2F,,2017年5月OPEN・旧タカラ島　アルプラザ小松店,,
タカラ島 小松店,小松市平面町ア-69イオン小松店1F,,タカラ島アルプラザ小松店と間違えないように,,
コスモランド小松店,小松市有明町105-5,国道8号線沿い、ホテルサンルート小松向かい,,,
バイパスレジャーランド加賀店,加賀市箱宮町ヲ1-1,国道8号線、加賀産業道路終点近く,参考,,
オートレストランヤング湯の国,加賀市庄町カ47,国道8号線沿い,,,
オートグリル羽咋,羽咋市兵庫町タ11-3,,,,
namcoイオンモールかほく店,かほく市内日角タ25番イオンモールかほく2F,,旧：NLイオンモールかほく店、NLイオンかほく店,,
バイパスレジャーランド宇ノ気店,かほく市森子85,国道159号線沿い,参考,,
アピタ松任店ゲームコーナー,白山市幸明町280アピタ松任店2F,,旧：NLアピタ松任店,,
コスモパーク白山,白山市中奥町190-1,,,,
手取フィッシュランド,能美市寺井町栗生ツ58,,,,
アピナ野々市店,野々市市若松町5-5,ホームセンターヤマギシ近く,旧：ののいちスタジアム55,,
スーパーフリークス野々市本店,野々市市若松町21-10,,,,
はにーわんだー,野々市市高橋町14-36,金沢工業大学近く,,,
namcoアルプラザ鹿島店,鹿島郡中能登町井田と1-1アルプラザ鹿島店2F,,旧：アルプラザ鹿島店ナムコランド,,
BIGSANTA,河北郡津幡町北中条1街地1アルプラザ津幡2F,JR津幡駅徒歩10分,,,
フクイレジャーランドワイプラザ店,福井市新保町7-9-1ヤスサキワイプラザB棟2F,国道8号線沿い新保交差点近くえちぜん鉄道越前新保駅からも可,参考,,
JOYLANDベル店,福井市花堂南2-16-1,,,,
JOYLAND江守店,福井市江守中2-1508,,,,
オモローランド ベル店,福井市花堂南2-16-1,,,,
ナムコランドアピタ福井店,福井市飯塚町11-111アピタ福井店2F,,,,
セガ福井,福井市丸山町1-410,国道8号沿いだがえちぜん鉄道「越前開発」から徒歩も可,旧名：セガアリーナ,,
JOYLAND大和田店,福井市大和田町56字10,国道8号線沿い大和田交差点近く,,,
JOYLANDパリオ店,福井市松城町12－7,,,,
レッツワクワクエルパ店,福井市大和田町第32号24エルパ2F,,,,
namcoフェアモール福井大和田店,福井市大和田町第32号23番地アピタ福井大和田店2F,,旧：フェアモール福井ナムコランド,,
スタークラブ,福井市林町第55-16,,,,
アプレシオ米松店,福井市長本町610,国道8号線沿い丸山交差点角,麻格店舗,,
オモローランド,敦賀市白銀町11-5アルプラザ6F,,,,
ナムコランドアピタ敦賀店,敦賀市中央町1-5-5アピタ敦賀店2F,,,,
アシアネット,敦賀市神楽町1-3-21,,,,
USA ARENA,敦賀市木崎40号土三田12番,,,,
セガワールド武生,越前市新町3字13-4,,,,
T/S鯖江店,鯖江市下河端町16－6－1アルプラザ鯖江アミューズ棟内,,旧：S/T鯖江久しぶりの「タイトーステーション」登場です。,,
JOYLAND鯖江店,鯖江市宮前1-6-14,国道8号線沿い,,,
わくわくらんど鯖江店,鯖江市有定町3-1-1,,,,
ファンタジーランド イーザ,坂井市三国町三国東5-1-20,,,,
JOYLANDヴィオ店,大野市鍬掛17-17-1,,,,
大野プレイランド,大野市月美町4-8,,JOYLANDリブレ店？,,
JOYLANDサンプラザ店,勝山市元町1丁目7-28,,(※HPからの転載),,
スタジオプリモ 甲府店,甲府市丸の内1-16-20ココリ 2F,甲府駅,,,
岡島甲府店プレイランド,甲府市丸の内1-21-25岡島甲府店内6F,甲府駅,ナムコ系,,
モーリーファンタジー湯村店,甲府市千塚1-9-14オギノ湯村店4F,,旧：らんらんらんど湯村店,,
ゲームコーナー ワコーズ,甲府市朝気3-1-12オギノイーストモールSCバリオ2F,,元プレイランド・センシンバリオ店,,
ゲームパニック甲府,甲府市国母5-20-24,R20沿い、甲府昭和ICより石和方面へ3分国母駅から徒歩約23分,元パル国母,,
プレイタウンパル 富士吉田,富士吉田市新西原4-12-15,R139沿い,富士急ハイランドそば,,
ゲームQ,富士吉田市上吉田2-5-1Q-STA 4F,富士急行富士山駅,元こども王国ゲームdo,,
都留ファミリーボウル,都留市上谷6-7-13,,,,
TFSラザウォーク甲斐双葉店,甲斐市志田616-1ラザウォーク甲斐双葉店アミューズメント棟1階,R20沿い塩崎駅,,,
モーリーファンタジー石和店,笛吹市石和町松本222-1イオン石和3F,石和温泉駅,旧：ダイナレックス,,
ハローズガーデン石和店,笛吹市石和町窪中島116-1アピタ石和店2F,,,,
ラウンドワン山梨・石和店,笛吹市石和町広瀬737-1,R20沿い甲府駅北口＆酒折駅よりシャトルバス,公称ラウンドワン100号のお店,,
大丸パークレーンズ,中央市下河東3053-1イオンタウン山梨中央内,,,,
ナムコランドリバーシティ店,中央市山之神1122オギノリバーシティーSC2F,,,,
ファミリーアミューズメント田富店,中央市山之神1383-9アピタ田富店2F,,旧：ハローズガーデン田富店,,
楽市楽座イオンモール甲府店,中巨摩郡昭和町飯喰1505-1イオンモール甲府昭和2F,常永駅甲府駅南口よりシャトルバス,,,
モーリーファンタジー甲府昭和店,中巨摩郡昭和町飯喰1505-1イオン甲府昭和店3F,常永駅甲府駅南口よりシャトルバス,,,
カバロ甲府昭和店,中巨摩郡昭和町西条13-1イトーヨーカドー甲府昭和店2F,,旧：わいわいランド,,
プラサカプコン甲府店,中巨摩郡昭和町西条3717,R20沿い,ゲームパニック甲府店すぐそば,,
アミュージアム河口湖店,南都留郡富士河口湖町船津2986河口湖SCベル3F,R139沿い,,,
ゲームセンター,南都留郡富士河口湖町船津6713ー17河口湖バッティングセンター併設ゲーセン,,2015年秋頃閉鎖現在はカプセルホテル,,
アミュージアム南アルプス店,南アルプス市小笠原1423-1トライアル南アルプス店1F,,2017/3/4open,,
ドルフィン長野駅前店,長野市大字南長野南石堂町1367-5,長野駅徒歩5分､千石劇場近く,026-224-4038,,
YAZ 長野店,長野市南石堂町1418,,プライズ、プリクラ,,
スポルトピカデリーボウル,長野市田町2129,,1Fアミューズメントコーナー閉鎖　2Fにゲーム機あり,,
ファミリーランド,長野市大字鶴賀権堂町2201イトーヨーカドー5Fゲームコーナー,,,,
THE 3RD PLANET 長野大通り店,長野市大字鶴賀権堂町1506-3,,旧：デジャ・ヴー長野店,,
アピナ長野村山店,長野市村山502-1,R18号､アップルライン沿い,,,
アピナ長野大橋店,長野市若里7-9-12,R18号､長野大橋北側,,,
スカイバッティングセンター,長野市若里7-3-8,日赤通り､ビックハット南側,,,
ラウンドワンスタジアム長野,長野市大字東和田827-6,国道18号沿い､東和田交差点よりすぐ,,,
アピナ長野川中島店,長野市川中島町御厨967-1,,,,
セガワールド上田,上田市大字上田1847-1,,,,
コインハウス M&M,上田市東内3024-1,国道254号松本方面､荻窪交差点近く,参考,,
モーリーファンタジー上田店,上田市常田2-12-18イオン上田店2F,,,,
ニャライズ,上田市中央4-2-22‎,上田駅より徒歩13分,レトロゲームのリクエストによる基板入替え対応がメイン。店内は狭く設置台数は少ない。平日は17時､土日祝は13時から営業。,,
namcoアリオ上田店,上田市天神3丁目5-1,,旧：NLアリオ上田店,,
パロ佐久店,佐久市大字岩村田字東曽根6-2ステーションパーク佐久内,佐久ICより車で10分,,,
