name,address,access,remarks,latitude,longitude
GAME PIA川口,川口市栄町3-1-16 川口共同ビル 3F,川口駅,旧：AM PIA川口,,
ゲームシティ川口,川口市栄町1-10-5,川口駅徒歩10分,,,
プレイランドこころっこ,川口市本町2丁目7-25 ミエル川口3F,,,,
セガ川口,川口市東領家2-2-10,,旧：セガワールド川口,,
ソユーゴールドフィッシュ川口店,川口市並木元町1番79号アリオ川口3F,川口駅県道35産業道路,,,
楽市楽座 イオンモール川口前川店,川口市前川1丁目1-11 イオンモール川口前川,,旧：～川口キャラ店イオンモールでは母体名に愛称がつかなくなりました。,,
川口スプリングレーンズ,川口市川口6-3-34,県道68,1Fアミューズメントコーナー,,
デイトナIII,川口市芝新町4-30 星野ビル B1F,蕨駅,,,
ゲーム・イン・ヒューストン,川口市西川口1-6-3 西川口ビル 1F-2F,西川口駅,,,
ゲオ川口駅前店,川口市本町4-2-3友愛センタービル,川口駅,実質はリトルパーク旧：ウェアハウス川口駅前店,,
カンカン 娯楽場（ぷらっと）,川口市並木3丁目25-15,JR京浜東北線西川口駅東口,7号営業。,,
アドアーズ蕨,蕨市塚越1-4-4 ラ・セーヌビル 2F,蕨駅,1Fはなくなった,,
ソユーパイレーツキッズ錦町店,蕨市錦町1丁目12-1 イトーヨーカドー錦町店2F,戸田駅,,,
ラウンドワンわらび店,蕨市北町5-1-6,北戸田駅,,,
namcoイオンモール北戸田店,戸田市美女木東1-3-1イオンモール北戸田3F,北戸田駅,旧：ナムコ縁起町二丁目、namcoイオン北戸田店,,
モーリーファンタジー北戸田店,戸田市美女木東1-3-1イオンモール北戸田3F,北戸田駅,イオン棟の中です,,
ゲームシティ戸田,戸田市笹目3-21-9,R17バイパス,,,
ギガステーション戸田店,戸田市大字美女木943-7,,旧ヒューケット戸田店,,
ウェアハウス上尾,上尾市上尾村1044,,,,
FESTA上尾,上尾市愛宕3-1-40 バリュープラザ上尾愛宕店内2F,上尾駅,旧：THE 3RD PLANET上尾店ザ・サードプラネットとのFC契約解消により店舗ブランド統一,,
上尾ミナミボウル,上尾市緑丘1-4-5,北上尾駅,東口徒歩10分,,
ラウンドワンスタジアム上尾店,上尾市平塚917-1,,,,
オートパーラー上尾,上尾市大字久保７０－２,北上尾駅,徒歩10分,,
アピナ上尾店,上尾市緑丘3-311-2上尾ショッピングアベニューP・A・P・A PRINCESS(B棟)内,北上尾駅,旧：ガロパ北上尾店2014年2月開店,,
桶川バッティングセンター,桶川市北１丁目２４−２５,,ゲーム機少々,,
タイトーステーション,北本市深井６丁目８７　Hey World,,旧こころっこ,,
モーリーファンタジー,北本市中央４丁目６３イオン北本店,,旧ハローズガーデン,,
アイビーボウル北本,北本市東間４丁目６０,,ゲーム機少々,,
アミュージアム鴻巣,鴻巣市本町1-1-2 エルミこうのすショッピングモール3F,鴻巣駅前,音ゲー多数,,
邦英ジョイ,鴻巣市神明１丁目８－１０,,,,
ぷれいらんど373北鴻巣店,鴻巣市箕田３１１１－１メガドンキ内,,,,
ラウンドワンさいたま・鴻巣店,鴻巣市箕田3163番7,,,,
ファンタジーランドガルー,鴻巣市袋９０－１アピタ吹上店,,,,
ベネクス川越,川越市大仙波340-1,,,,
キャロム川越インター,川越市大字大塚新田山王前462-6,R16/南大塚駅,,,
ゲームシティプラス川越店,川越市泉町1-1 UNICUS南古谷シネマ棟1階,南古谷駅,,,
モナコ川越1号,川越市新富町2-4-1,同上,,,
丸広百貨店わんぱくランド,川越市新富町2-6-1丸広百貨店内7F,同上,,,
ゲームマグマックス川越,川越市脇田町7-2 山二ビルB1F,同上,元ゲームファンタジア新川越,,
namco川越店,川越市脇田町3-6 長谷川ビル1F・2F,同上,,,
T/S 所沢店,所沢市日吉町3-7 スカイビュービルB1F,所沢駅,旧：シルクハット所沢,,
セガ所沢,所沢市日吉町8-1,所沢駅,旧：CLUBSEGA所沢,,
らんらんらんど所沢店,所沢市東町5-22 ダイエー所沢店,所沢駅,,,
アミューズメントパーク,所沢市上山口2227,西武球場前駅,,,
埼玉スポーツセンター,所沢市南永井1116,みずほ台駅,,,
所沢スターレーン,所沢市星の宮 2-1-37,西所沢駅,,,
きゃらんど新所沢店 ゲームセンター,所沢市緑町１丁目２－１,新所沢駅,,,
新所沢ボウル ボウリング場名,所沢市緑町１丁目２１－２６,新所沢駅,,,
キャロム所沢,所沢市下安松969-1,東所沢駅,,,
キャッツアイ狭山,狭山市入間川3141,狭山市駅（遠）,,,
モーリーファンタジー狭山店,狭山市大字上奥富1126-1 イオン狭山店,狭山市駅,旧：ファンタジーアイランド狭山店,,
セガワールド入間,入間市東藤沢2-18,武蔵藤沢駅,,,
モーリーファンタジー入間店,入間市大字上藤沢462-1 イオン入間ショッピングセンター2F,武蔵藤沢駅,旧ファンタジーアイランド入間店,,
ラウンドワンスタジアム入間店,入間市小谷田3-7-25,R299,,,
アミュージアム新座,新座市東北2-32-12 イオン新座3F,志木駅,,,
あそびの広場,新座市中野2丁目1-38 OSCデオシティ新座ミックスミックス,R463,,,
清瀬ボウル,新座市あたご2丁目4-20,,,,
ラウンドワンスタジアム朝霞店,朝霞市膝折町2-16-10,R254,,,
アドアーズ和光店,和光市本町3-5 Million Annex 和光1～3F,和光市駅,,,
タイトーステーション 和光店,和光市丸山台1-4-5,和光市駅,旧：セガワールド和光,,
ファミリーランド和光店,和光市丸山台1-9-3イトーヨーカドー和光店3F,和光市駅,,,
カバロキッズ上福岡東店,ふじみ野市大原2-1-30イトーヨーカドー上福岡東店2F,上福岡駅,ふじみ野市役所向かい,,
パロ埼玉大井店,ふじみ野市西鶴ヶ丘1-3-15ビバモール埼玉大井ショッピングセンター2F,上福岡駅,元 H/T ビバモール,,
アミューズメントフィールドバイヨン,ふじみ野市うれし野2-16-1LCモールうれし野2F,ふじみ野駅,,,
ダイナレックス大井店,ふじみ野市ふじみ野1丁目2-1 イオン大井店3F,ふじみ野駅,,,
ハローズガーデン 三芳店,入間郡三芳町大字藤久保字北新埜855番403 UNICUS三芳,R254,,,
キャロム坂戸,坂戸市関間2-151-1,R407/坂戸駅,,,
ブーボスボス坂戸,坂戸市片柳1732-1,北坂戸駅,,,
スイーツファンタジーパックン,東松山市あずま町四丁目3番地ピオニウォーク東松山2F,高坂駅高坂駅より路線バス,,,
ファミリーランド東松山店,東松山市箭弓町1-15-13ザ・プライス東松山店4F,東松山駅,,,
アミューズメントランド（西友東松山店）,東松山市小松原町11-1,東松山駅,駅からバス「マイタウン巡回」または「熊谷駅」行き上沼停留所から徒歩3分。子供向けカードゲームのみ,,
ゲオ東松山店,東松山市松本町2丁目1-51,東松山駅,駅から徒歩20分弱。2014年夏時点では太鼓の達人とUFOキャッチャーのみ。,,
あそびのくにファミリーランド,比企郡滑川町大字羽尾2780 ベイシアなめがわモール店,森林公園駅/県道47,,,
ファッションセンターしまむらつきのわ店,比企郡滑川町月の輪1丁目4-1,つきのわ駅,徒歩2分。昔懐かしのゲームが残っている。子供向け。,,
アミューズメントプラザRANZAN,比企郡嵐山町志賀1822 嵐山ドライブイン,R254,,,
越谷バッティングセンター,越谷市宮本町４丁目８８,越谷駅/R4,ゲーム機少々,,
ウェアハウス越谷,越谷市南荻島841-1,県道48,,,
ベネクス越谷,越谷市南荻島2770-1,,,,
テクモピア 南越谷店,越谷市南越谷1-15-1楽園タウン南越谷2F,東武新越谷駅JR南越谷駅,営業時間20:00まで,,
らんらんらんど南越谷店,越谷市南越谷1-2876-1ダイエー南越谷店,,,,
ユーズランド越谷店,越谷市東町4-21-1イオンレイクタウンKAZE 3F,越谷レイクタウン駅,,,
namcoイオンレイクタウン店,越谷市東町2-8イオンレイクタウンMORI 3F,越谷レイクタウン駅,旧：NLイオンレイクタウン店,,
モーリーファンタジー イオンレイクタウン店,越谷市東町2-8イオンレイクタウンMORI 3F,越谷レイクタウン駅,,,
ペニーポット越谷店,越谷市越ヶ谷1-16-6ミスターマックス越谷店2F,,,,
わんぱーく越谷店,越谷市越ヶ谷1-16-6ミスターマックス越谷店2F,,,,
ゲームファクトリーマグマ草加,草加市氷川町1132-1,草加駅,旧ハイテクランドセガ草加,,
スクウェアワン草加,草加市西町632-1,R4,旧セガワールド草加,,
ラウンドワン草加,草加市谷塚上町204番地1,県道103,,,
モーリーファンタジー春日部店,春日部市下柳420-1イオンモール春日部2F,R4/R16,イオン春日部,,
ゲームファンタジア春日部,春日部市中央1-8-15春日部セントラル1-2F,春日部駅,,,
カバロ春日部店,春日部市中央1-13-1イトーヨーカドー春日部店5F,春日部駅,,,
かすかべ湯元温泉,春日部市下大増新田66-1,,,,
埼玉レジャーランド春日部,春日部市大字増富字谷際163-1,R16,,,
ゲーセン クレヨンしんちゃん 嵐を呼ぶプリプリシネマスタジオ,春日部市南1-1-1ララガーデン春日部内,春日部駅,,,
ゲームパニック三郷,三郷市彦野2-25,R298,1000円80枚,,
ラクガキ王国三郷,三郷市天神2-22 イトーヨーカドー三郷店2F,R298,,,
ぷれいらんど373三郷店,三郷市さつき平1-1-1 MEGAドン・キホーテ三郷店2F,新三郷駅,,,
ラウンドワンスタジアムららぽーと新三郷店,三郷市新三郷ららシティ3-1-1ららぽーと新三郷 2F,新三郷駅,,,
ミサトヤングボウル,三郷市戸ヶ崎5-131,TX八潮駅常磐線金町駅,朝10時～翌3時まで営業／年中無休,,
ウェアハウス草加店,八潮市南後谷507,県道115,18歳未満の児童も入場可,,
THE 3RD PLANET フレスポ八潮,八潮市大瀬822-1 フレスポ八潮3F,TX八潮駅,,,
ワンパクオウコク,久喜市久本寺谷田7番地1,東鷲宮駅・久喜駅からバス約5分、久喜市鷲宮西中学校から徒歩20分,,,
こころっこ東鷲宮店,久喜市桜田3-2-1 イオン東鷲宮店2F,東鷲宮駅,旧らんらんらんど東鷲宮店,,
ハローズガーデンモラモラ,久喜市久喜中央4-9-11イトーヨーカドー久喜店,,,,
キャロム栗橋,久喜市高柳字田中1741-3,R125,,,
プレイランド菖蒲店,久喜市菖蒲町菖蒲3555,R122バイパス,モラージュ菖蒲旧ソユークレイジースイーツファクトリー,,
ラウンドワンスタジアムさいたま・栗橋店,久喜市小右衛門192-1,,,,
宝島蓮田店,蓮田市東4-5-13 MEGAドン・キホーテ蓮田店2F,蓮田駅東口より徒歩5分,旧AN・ANT蓮田,,
にこぱ幸手店,幸手市大字上高野764,幸手駅,,,
スクウェアワン幸手店,幸手市上高野2142-1,杉戸高野台駅,旧セガワールド幸手,,
オートパーラVI ゲームセンター,行田市大字若小玉1798,R125,,,
エブリデイ行田店,行田市下忍644-1,R17熊谷バイパス,プライズマシンのみ,,
キッズファンタジー,加須市大門町20-58 加須カタクラパーク 2F,加須駅,旧ナムコランド,,
アミューズメントプラザ加須,加須市中央1-1-15,加須駅,,,
ファンタジーランドガルー,加須市鳩山町10-10 ユニー大桑店,,,,
プラサカプコン羽生店,羽生市川崎2-281-3 イオンモール羽生2F,R122/南羽生駅,専門店棟の中です,,
モーリーファンタジー羽生店,羽生市川崎2-281-3 イオンモール羽生2F,R122/南羽生駅,イオン棟の中です,,
ビッグボウル杉戸,北葛飾郡杉戸町大字杉戸2338,R4/杉戸高野台駅,ゲーム少し,,
WIZ SOYU 熊谷店熊谷駅,熊谷市銀座2-123-1 ニットーモール4F,,,,
namco熊谷店,熊谷市銀座2-97 CARPA 1F,熊谷駅,旧：熊谷ナムコランド店,,
セガワールド籠原,熊谷市美土里町1-169,,,,
PALO,熊谷市本石2丁目135 イオン熊谷店3F,R17,旧ダイナレックス熊谷店,,
エムランド,熊谷市新堀新田523マミーマート籠原店2F,籠原駅,旧ファミリーランド籠原店,,
万代書店熊谷店,熊谷市石原342-3,R140,プライズマシンあり,,
ハッピーランド,深谷市上柴町西4丁目2-14 イトーヨーカドー深谷店,深谷駅,,,
ROBOT,深谷市上柴町西4丁目12-1,深谷駅,旧キャラゲット深谷店,,
シティボーイ ゲームセンター,深谷市瀬山561,明戸駅,,,
モンテカルロ 深谷店,深谷市西島915-2,,,,
ムー大陸本庄,本庄市本町1019-1,R17,ムー大陸本庄はNEWSではない,,
ファミリーワールド本庄店,本庄市駅南1丁目2-1 本庄BLALA 3F,本庄駅,,,
ちびっこらんど,本庄市南1-2-10 アピタ本庄店,本庄駅,,,
イオンファンタジーワールド,児玉郡上里町大字金久保字蓮山359-1,R17,,,
ラウンドワンさいたま上里店,児玉郡上里町大字金久保宇周川394-1,R17,,,
キッズプラザきゃらんど,児玉郡上里町大字七本木2272-1,県道23,ウニクス上里,,
セガ千葉,千葉市中央区富士見2-4-1富士ビル,千葉駅,旧：ハイテクセガ千葉,,
アドアーズ千葉,千葉市中央区富士見2-4-15 第一東和ビル1F-3F,,,,
ラッキー中央店(フェリシダ),千葉市中央区富士見2-8-1,,,,
アサヒボウリングセンター ゲームコーナー,千葉市中央区新宿2-1-5,京成千葉中央駅,,,
スポーツウェーブ鉄腕24,千葉市中央区浜野町1025-59D'station浜野店 2F,浜野駅,,,
セガアリーナ蘇我,千葉市中央区川崎町6-9ハーバーシティ蘇我フェスティバルウォーク アミューズメント棟 1F,蘇我駅,,,
タイトーステーション アリオ蘇我店,千葉市中央区川崎町7-20 アリオ蘇我2F,蘇我駅,旧：ラクガキ王国蘇我,,
ゆにろーず横戸,千葉市花見川区横戸町911-1,,,,
ソユープレイランドソピア幕張,千葉市花見川区幕張町4-417-25 イトーヨーカドー幕張店2F,,,,
アミュージアム稲毛店,千葉市稲毛区小仲台1-4-20イオン稲毛2F,JR稲毛駅,,,
スポーツウェーブ鉄腕24稲毛長沼店,千葉市稲毛区長沼原町697,稲毛駅からバス,24時間営業一部0時閉店,,
ゲームファンタジア千葉北,千葉市稲毛区山王町316,四街道駅,,,
ラッキー西千葉店(LUKY WEST),千葉市稲毛区弥生町1-15,西千葉駅,,,
CLUBSEGA稲毛オーツーパーク,千葉市稲毛区園生町380-1,稲毛駅からバス,旧：SWオーツーパーク,,
ムー大陸稲毛,千葉市稲毛区小仲台2-5-7 海宝ビル 2F,稲毛駅,,,
パレパレ稲毛長沼店,千葉市稲毛区長沼原町731-17,稲毛駅からバス,2015/02/14開店旧：THE 3RD PLANETフレスポ千葉稲毛,,
らんらんらんど千葉長沼店,千葉市稲毛区長沼町330-50 ダイエー千葉長沼店 1F,,,,
わくわくワールド稲毛店,千葉市稲毛区小仲台7-2-1 マルエツ稲毛店 2F,,,,
西友都賀,千葉市若葉区西都賀2-2-2,,データカードダスとガチャポンのみ,,
ファンタジープラザ千城台,千葉市若葉区千城台北3-21-1 ラパーク千城台 3F,,,,
ナムコランドおゆみ野店,千葉市緑区おゆみ野中央2-3-1ミスターマックスおゆみ野ショッピングセンター内,京成千原線 学園前駅下車徒歩10分,,,
アミューズメントシティラクゾー鎌取店,千葉市緑区おゆみ野3-16 イオン鎌取店 5F,,,,
モーリーファンタジー鎌取店,千葉市緑区おゆみ野3-16 イオン鎌取店 3F,,,,
モーリーファンタジーおゆみ野店,千葉市緑区おゆみ野南5-37-1 イオンタウンおゆみ野2F,,MF鎌取店と混同しないこと,,
らんらんらんどあすみが丘店,千葉市緑区あすみが丘7-1 あすみが丘ブランニューモール 2F,,,,
セガ幕張,千葉市美浜区ひび野1-8 メッセアミューズモール1F,海浜幕張駅,旧：CS幕張,,
ファンパラダイス,千葉市美浜区高洲3-13-1 イオンマリンピア店 4F,,,,
ゲームファンタジア美浜,千葉市美浜区新港32-6-1 ハマニューポートリゾート 1号棟-2,稲毛海岸駅からバスあり,,,
namcoイオンモール幕張新都心店,千葉市美浜区豊砂1-1イオンモール幕張新都心グランドモール3F,,,,
モーリーファンタジー幕張新都心店,千葉市美浜区豊砂1-5イオンモール幕張新都心ファミリーモール2F,,,,
モーリーファンタジー銚子店,銚子市三崎町2丁目2660-1 イオンモール銚子 2F,R126沿い,イオン棟の中です,,
ゲームフジ市川,市川市市川1-9-11,市川駅,,,
ぷりモール宝島,市川市八幡2-6-7,本八幡駅,ぷりモール宝島の現在のOPはサン・ミューズです。,,
ゲームオット本八幡,市川市八幡2-16-6 八幡ビル B1F,旧：クラブセガ本八幡,,,
本八幡スターレーン,市川市南八幡4-9-1 メガドンキホーテ 6F,,,,
ラウンドワン市川鬼高店,千葉県市川市鬼高4-1-3,,,,
パロ市川店,市川市鬼高 1-1-1 ニッケコルトンプラザ 2F,鬼越駅,リンクはOPであるファンフィールドのサイトにしました。,,
らんらんらんど南行徳店,市川市南行徳2-20-25 ダイエー南行徳店　2F,南行徳駅,,,
TFS市川妙典店,市川市妙典4-1-1 イオン市川妙典店2番街 2F,,,,
モーリーファンタジー市川妙典3F店,市川市妙典5-3-1 イオン市川妙典店3F,2FのイオンはTFS市川妙典,,,
DAIKEIEN 大慶園,市川市大町359,,,,
アミューズメントパフェパレパレ市川妙典店,市川市妙典4-4-27,旧：ザ・サードプラネット市川妙典店2016/8/31閉店,,,
アドアーズ船橋店,船橋市本町1-31-26,船橋駅,2014/7/9 開店,,
わいわいランド船橋店,船橋市本町7-6-1 イトーヨーカドー船橋店 4F,,,,
タイトーステーション船橋店,船橋市本町1-6-1,2015/8/8 開店,,,
マリンガーデン,船橋市浜町2-1-1 ららぽーとTOKYO-BAY 西館3F,船橋競馬場/南船橋,2013/11/22開店,,
セガ ららぽーとTOKYO-BAY,船橋市浜町2-1-1 ららぽーとTOKYO-BAY 北館1F,2015/3/13開店,,,
テクモピア船橋店,船橋市浜町2-2-7　ビビット南船橋 4F,,,,
アミューズメントエース,船橋市前原西2-15-1 ファミービル 1F-3F,JR津田沼駅,,,
ゲームインファンファン北習志野店,船橋市習志野台2-6-17パチンコならしの 2F,北習志野駅,,,
パールプラザボウル,船橋市夏見1-16-38 パールプラザ 3F,,,,
船橋健康センター,船橋市夏見3-28-1,,,,
チャリオット船橋,船橋市藤原5-6-7 日野ビル 2F,,,,
namcoイオンモール船橋店,船橋市山手1丁目1-8イオンモール船橋3F,新船橋駅,,,
モーリーファンタジー船橋店,船橋市山手1丁目1-8 イオンモール船橋2F,,,,
エッグスポート船橋,船橋市浜町2-1-1 ららぽーとTOKYO-BAY 北館1F,2015年1月12日閉店,,,
モーリーファンタジー館山店,館山市八幡545-1 イオン館山店内,,旧：PP館山,,
館山ヤングボウル,館山市北条1564,JR内房線館山駅 徒歩12分,NESiCAxLive2筐体1セット(ALL.Net P-ras MULTIと入れ替え 公式HPに記載無し),,
ラッキー木更津店,木更津市中央1-2-19,,,,
イスカンダル,木更津市潮見4-1-2,,,,
宝島 新木更津店,木更津市請西南2-27-1イオンタウン木更津請西1F,,,,
ハローズガーデン 木更津店,木更津市ほたる野4-2-48 アピタ木更津店2F,,,,
パラボランド木更津,木更津市朝日3-10-19 グリーンシティ内,,,,
アドアーズアクアライン,木更津市中島地先 海ほたる4F,アクアライン経由のみ,アクアラインのPA内,,
ハイテクランドセガ岩瀬,松戸市岩瀬字鍛冶塚611-2,松戸駅から徒歩20分,,,
ソニックビーム,松戸市松戸1172-1,松戸駅東口徒歩2分,,,
カバロ松戸店,松戸市松戸1149　イトーヨーカドー松戸店 6F,松戸駅東口,,,
セガ松戸,松戸市日暮1-1-1 八柱駅第2ビル 2F,八柱駅/新八柱駅,AGスクエアはセガのお店になりました。,,
カバロ八柱店,松戸市日暮1-15　イトーヨーカドー八柱店,,,,
らんらんらんど新松戸店,松戸市新松戸3-2-2 ダイエー新松戸店 4F,新松戸駅,,,
Play Land 54 street 北小金店,松戸市小金1 イオン北小金店 5F,北小金駅,,,
北小金ボウル,松戸市根木内249-7,,,,
ときわ平ボウリングセンター　ゲームコーナー,松戸市常盤平2-8-2,新京成 常盤平駅,,,
ファミリーランド五香店,松戸市常磐平5-22-3　ザ・プライス五香店 2F,,,,
らんらんらんど五香店,松戸市五香8-44-6 オウル五香店 1F,,,,
にこぱ新鎌ヶ谷店,鎌ヶ谷市新鎌ヶ谷2-12-1 アクロスモール新鎌ヶ谷,,,,
モーリーファンタジー鎌ヶ谷店,鎌ヶ谷市新鎌ヶ谷2-7 イオン鎌ヶ谷SC2F,,,,
ファミリーブック鎌ヶ谷店,鎌ヶ谷市北初富8-1,新京成線北初富駅,,,
YAZワールド野田七光台,野田市七光台4-2 イオンタウン野田七光台内,,,,
千葉レジャーランド野田店,野田市吉春字鍵田776-1,,,,
モーリーファンタジーノア店,野田市中根36-1　イオンノア店1F,,,,
ゴジライオン野田店,野田市中根36－1　イオンノア店3階,,,,
アミュージアム茂原,茂原市高師1622-1,,音ゲー・ビデオ多数,,
アミューズランド・パル,千葉県茂原市六ツ野字高師野２７９９－４ イオン茂原,,,,
T/S茂原アスモ店,茂原市高師1735茂原ショッピングプラザアスモ2F,,旧：アスモメルヘンランド上記2店舗は別店舗なので注意,,
宝島成田店 成田ハートフルステーション,成田市赤坂2-1-14 ボンベルタ百貨店アネックスＢ館2F,,,,
セガワールド成田,成田市東町157-1,成田駅徒歩約15分,,,
プラサカプコン成田店,成田市ウイング土屋24 イオンモール成田 2F,京成成田よりバス有,,,
モーリーファンタジーイオン成田店,成田市ウイング土屋24 イオンモール成田 2F,イオン棟の中です,,,
ゲームパークZOOM,成田市ウイング土屋80ヒューマックスパビリオン成田 1F,,,,
ワンダービュー,成田市飯仲11-10,R51,ドンキ隣。旧ジョイタウン成田店?,,
テクモピアロックダム公津の杜店,成田市公津の杜4-5-3 ユアエルム成田 3F,公津の杜駅前,,,
アミュージアムユーカリが丘店,佐倉市ユーカリが丘4-1-4 ユーカリプラザ5F,ユーカリが丘駅,旧：よしもとゲームアミュージアム,,
マルエツ新志津店ゲームコーナー,佐倉市西志津4-1-1,,,,
臼井メルヘンランド,佐倉市王子台1-23,うすい駅,,,
ガロパ佐倉,佐倉市井野1475,志津駅東葉勝田台駅勝田台駅,,,
パラボランド東金,東金市東岩崎8-10 サンピア 3F,,,,
ピットイン東金,東金市家之子荒蒔467-9,,,,
T/S旭サンモール店,旭市イ-2676-1 サンモール3F,,,,
セガワールド旭,旭市ニ字野場3150-1,,「ニ」はイロハニのニ,,
GAME PIA津田沼,習志野市津田沼1-2-1 B1F,津田沼駅/新津田沼駅,旧：AM PIA津田沼,,
DEEP,習志野市大久保1-17-11,京成大久保駅,看板は無いが営業中,,
スーパービバホーム新習志野店2Fゲームコーナー,習志野市茜浜1-1-2,南船橋駅から徒歩10分,2015/7/2オープン,,
アドアーズ新習志野店,習志野市茜浜2-1-9,新習志野駅,,,
Kid's US.LAND 新習志野店,習志野市茜浜2-2-1ハイパーモールメルクス新習志野店 2F,時間制ゲーセン,,,
ラウンドワン習志野店,習志野市芝園1-4-5,,,,
モーリーファンタジー津田沼店,習志野市津田沼1-23-1　イオンモール津田沼3F,,イオン棟の中です,,
モーリーファンタジー東習志野店,習志野市東習志野6-7-8　イオンタウン東習志野1F,,,,
アミュージアム東習志野店,習志野市東習志野7-3-1 イトーヨーカドー東習志野店 4F,,元:ハローズガーデン,,
ジョイランド大久保,習志野市大久保1-27-3,2014/11/25 閉店,,,
新宝島津田沼店,習志野市谷津1-16-1 モリシア津田沼2F,2016年6月閉店,,,
ゲームアルファ,柏市柏1-1-11 ファミリ柏 B1F,柏駅,,,
ゴジラ,柏市柏1-1-11 ファミリ柏 B1F,,,,
ハイテクセガ柏,柏市柏1-1-11 ファミリ柏 B1F,,,,
ハイテクセガ柏2号店,柏市柏1-1-11,,,,
ゲームガリバー柏,柏市柏1-1-11 ファミリ柏 B1F,,,,
アドアーズ柏,柏市柏1-3-1 柏長崎屋共同ビル1F,旧：ゲームファンタジア柏,,,
T/S柏店,柏市柏2-3-1 フーサワビル,旧：クラブセガ柏,,,
ビーワン,柏市旭町1-1-16 中崎ビル B1F,,,,
T/S新柏PAZ店,千葉県柏市名戸ヶ谷字中久保888-1 パズ新柏2F,,旧：S/T柏,,
T/Sセブンパークアリオ柏店,柏市大島田950-1,,2016/4/25開店,,
