GAME PIA川口,川口市栄町3-1-16 川口共同ビル 3F,川口駅,旧：AM PIA川口,35.8029413,139.7175525
ゲームシティ川口,川口市栄町1-10-5,川口駅徒歩10分,,35.8025278,139.7256101
プレイランドこころっこ,川口市本町2丁目7-25 ミエル川口3F,,,35.800986,139.727449
セガ川口,川口市東領家2-2-10,,旧：セガワールド川口,35.7947768,139.74755
ソユーゴールドフィッシュ川口店,川口市並木元町1番79号アリオ川口3F,川口駅県道35産業道路,,35.8075439,139.7139197
楽市楽座 イオンモール川口前川店,川口市前川1丁目1-11 イオンモール川口前川,,旧：～川口キャラ店イオンモールでは母体名に愛称がつかなくなりました。,35.833609,139.707124
川口スプリングレーンズ,川口市川口6-3-34,県道68,1Fアミューズメントコーナー,35.8038604,139.7111586
デイトナIII,川口市芝新町4-30 星野ビル B1F,蕨駅,,35.8292437,139.6920647
ゲーム・イン・ヒューストン,川口市西川口1-6-3 西川口ビル 1F-2F,西川口駅,,35.8153561,139.7034194
ゲオ川口駅前店,川口市本町4-2-3友愛センタービル,川口駅,実質はリトルパーク旧：ウェアハウス川口駅前店,35.80198300000001,139.719794
カンカン 娯楽場（ぷらっと）,川口市並木3丁目25-15,JR京浜東北線西川口駅東口,7号営業。,35.8171081,139.7051393
アドアーズ蕨,蕨市塚越1-4-4 ラ・セーヌビル 2F,蕨駅,1Fはなくなった,35.827739,139.691516
ソユーパイレーツキッズ錦町店,蕨市錦町1丁目12-1 イトーヨーカドー錦町店2F,戸田駅,,35.8219794,139.6773067
ラウンドワンわらび店,蕨市北町5-1-6,北戸田駅,,35.8307831,139.6742333
namcoイオンモール北戸田店,戸田市美女木東1-3-1イオンモール北戸田3F,北戸田駅,旧：ナムコ縁起町二丁目、namcoイオン北戸田店,35.8268111,139.652702
モーリーファンタジー北戸田店,戸田市美女木東1-3-1イオンモール北戸田3F,北戸田駅,イオン棟の中です,35.8268111,139.652702
ゲームシティ戸田,戸田市笹目3-21-9,R17バイパス,,35.8136016,139.6490194
ギガステーション戸田店,戸田市大字美女木943-7,,旧ヒューケット戸田店,35.8342903,139.6532934
ウェアハウス上尾,上尾市上尾村1044,,,35.9886573,139.5983656
FESTA上尾,上尾市愛宕3-1-40 バリュープラザ上尾愛宕店内2F,上尾駅,旧：THE 3RD PLANET上尾店ザ・サードプラネットとのFC契約解消により店舗ブランド統一,35.9645164,139.5974635
上尾ミナミボウル,上尾市緑丘1-4-5,北上尾駅,東口徒歩10分,35.9817855,139.5829506
ラウンドワンスタジアム上尾店,上尾市平塚917-1,,,35.9858189,139.6082372
オートパーラー上尾,上尾市大字久保７０－２,北上尾駅,徒歩10分,35.9914929,139.5785728
アピナ上尾店,上尾市緑丘3-311-2上尾ショッピングアベニューP・A・P・A PRINCESS(B棟)内,北上尾駅,旧：ガロパ北上尾店2014年2月開店,35.9873915,139.5798732
桶川バッティングセンター,桶川市北１丁目２４−２５,,ゲーム機少々,36.0086547,139.5638403
タイトーステーション,北本市深井６丁目８７　Hey World,,旧こころっこ,36.0533558,139.5257746
モーリーファンタジー,北本市中央４丁目６３イオン北本店,,旧ハローズガーデン,36.0336118,139.5312774
アイビーボウル北本,北本市東間４丁目６０,,ゲーム機少々,36.03972230000001,139.530605
アミュージアム鴻巣,鴻巣市本町1-1-2 エルミこうのすショッピングモール3F,鴻巣駅前,音ゲー多数,36.0600943,139.5097253
邦英ジョイ,鴻巣市神明１丁目８－１０,,,36.0691603,139.5049048
ぷれいらんど373北鴻巣店,鴻巣市箕田３１１１－１メガドンキ内,,,36.079987,139.4888101
ラウンドワンさいたま・鴻巣店,鴻巣市箕田3163番7,,,36.0806249,139.4902145
ファンタジーランドガルー,鴻巣市袋９０－１アピタ吹上店,,,36.096434,139.465809
ベネクス川越,川越市大仙波340-1,,,35.9148331,139.4989812
キャロム川越インター,川越市大字大塚新田山王前462-6,R16/南大塚駅,,35.9251006,139.485793
ゲームシティプラス川越店,川越市泉町1-1 UNICUS南古谷シネマ棟1階,南古谷駅,,35.9039793,139.5152337
モナコ川越1号,川越市新富町2-4-1,同上,,35.913294,139.4831383
丸広百貨店わんぱくランド,川越市新富町2-6-1丸広百貨店内7F,同上,,35.9126757,139.4835608
ゲームマグマックス川越,川越市脇田町7-2 山二ビルB1F,同上,元ゲームファンタジア新川越,35.9099347,139.4822384
namco川越店,川越市脇田町3-6 長谷川ビル1F・2F,同上,,35.909049,139.482298
T/S 所沢店,所沢市日吉町3-7 スカイビュービルB1F,所沢駅,旧：シルクハット所沢,35.7879938,139.4721926
セガ所沢,所沢市日吉町8-1,所沢駅,旧：CLUBSEGA所沢,35.788476,139.471899
らんらんらんど所沢店,所沢市東町5-22 ダイエー所沢店,所沢駅,,35.78922310000001,139.4699921
アミューズメントパーク,所沢市上山口2227,西武球場前駅,,35.7698883,139.4169879
埼玉スポーツセンター,所沢市南永井1116,みずほ台駅,,35.8232315,139.531579
所沢スターレーン,所沢市星の宮 2-1-37,西所沢駅,,35.7855734,139.4633943
きゃらんど新所沢店 ゲームセンター,所沢市緑町１丁目２－１,新所沢駅,,35.8049092,139.4548723
新所沢ボウル ボウリング場名,所沢市緑町１丁目２１－２６,新所沢駅,,35.8065868,139.4556666
キャロム所沢,所沢市下安松969-1,東所沢駅,,35.791518,139.5041488
キャッツアイ狭山,狭山市入間川3141,狭山市駅（遠）,,35.8468264,139.4275588
モーリーファンタジー狭山店,狭山市大字上奥富1126-1 イオン狭山店,狭山市駅,旧：ファンタジーアイランド狭山店,35.8678327,139.4103057
セガワールド入間,入間市東藤沢2-18,武蔵藤沢駅,,35.8186519,139.4183136
モーリーファンタジー入間店,入間市大字上藤沢462-1 イオン入間ショッピングセンター2F,武蔵藤沢駅,旧ファンタジーアイランド入間店,35.8221055,139.3949189
ラウンドワンスタジアム入間店,入間市小谷田3-7-25,R299,,35.8279801,139.3760089
アミュージアム新座,新座市東北2-32-12 イオン新座3F,志木駅,,35.820153,139.5748
あそびの広場,新座市中野2丁目1-38 OSCデオシティ新座ミックスミックス,R463,,35.8170724,139.5490832
清瀬ボウル,新座市あたご2丁目4-20,,,35.7891888,139.5437929
ラウンドワンスタジアム朝霞店,朝霞市膝折町2-16-10,R254,,35.7902754,139.5796457
アドアーズ和光店,和光市本町3-5 Million Annex 和光1～3F,和光市駅,,35.788304,139.611568
タイトーステーション 和光店,和光市丸山台1-4-5,和光市駅,旧：セガワールド和光,35.7866435,139.6138036
ファミリーランド和光店,和光市丸山台1-9-3イトーヨーカドー和光店3F,和光市駅,,35.786441,139.612423
カバロキッズ上福岡東店,ふじみ野市大原2-1-30イトーヨーカドー上福岡東店2F,上福岡駅,ふじみ野市役所向かい,35.880453,139.518292
パロ埼玉大井店,ふじみ野市西鶴ヶ丘1-3-15ビバモール埼玉大井ショッピングセンター2F,上福岡駅,元 H/T ビバモール,35.8640697,139.5018036
アミューズメントフィールドバイヨン,ふじみ野市うれし野2-16-1LCモールうれし野2F,ふじみ野駅,,35.8561919,139.5227474
ダイナレックス大井店,ふじみ野市ふじみ野1丁目2-1 イオン大井店3F,ふじみ野駅,,35.8598449,139.5143767
ハローズガーデン 三芳店,入間郡三芳町大字藤久保字北新埜855番403 UNICUS三芳,R254,,35.8389162,139.5250047
キャロム坂戸,坂戸市関間2-151-1,R407/坂戸駅,,35.9526038,139.3985338
ブーボスボス坂戸,坂戸市片柳1732-1,北坂戸駅,,35.97709469999999,139.4051524
スイーツファンタジーパックン,東松山市あずま町四丁目3番地ピオニウォーク東松山2F,高坂駅高坂駅より路線バス,,36.00529119999999,139.4107065
ファミリーランド東松山店,東松山市箭弓町1-15-13ザ・プライス東松山店4F,東松山駅,,36.03507099999999,139.404016
アミューズメントランド（西友東松山店）,東松山市小松原町11-1,東松山駅,駅からバス「マイタウン巡回」または「熊谷駅」行き上沼停留所から徒歩3分。子供向けカードゲームのみ,36.0437124,139.4087632
ゲオ東松山店,東松山市松本町2丁目1-51,東松山駅,駅から徒歩20分弱。2014年夏時点では太鼓の達人とUFOキャッチャーのみ。,36.038227,139.4140684
あそびのくにファミリーランド,比企郡滑川町大字羽尾2780 ベイシアなめがわモール店,森林公園駅/県道47,,36.0594426,139.368707
ファッションセンターしまむらつきのわ店,比企郡滑川町月の輪1丁目4-1,つきのわ駅,徒歩2分。昔懐かしのゲームが残っている。子供向け。,36.0418675,139.3457942
アミューズメントプラザRANZAN,比企郡嵐山町志賀1822 嵐山ドライブイン,R254,,36.0511009,139.305436
越谷バッティングセンター,越谷市宮本町４丁目８８,越谷駅/R4,ゲーム機少々,35.8839094,139.7742005
ウェアハウス越谷,越谷市南荻島841-1,県道48,,35.91196050000001,139.7637724
ベネクス越谷,越谷市南荻島2770-1,,,35.9128551,139.7712022
テクモピア 南越谷店,越谷市南越谷1-15-1楽園タウン南越谷2F,東武新越谷駅JR南越谷駅,営業時間20:00まで,35.8750642,139.7931768
らんらんらんど南越谷店,越谷市南越谷1-2876-1ダイエー南越谷店,,,35.8738239,139.7907998
ユーズランド越谷店,越谷市東町4-21-1イオンレイクタウンKAZE 3F,越谷レイクタウン駅,,35.877778,139.82486
namcoイオンレイクタウン店,越谷市東町2-8イオンレイクタウンMORI 3F,越谷レイクタウン駅,旧：NLイオンレイクタウン店,35.882039,139.828022
モーリーファンタジー イオンレイクタウン店,越谷市東町2-8イオンレイクタウンMORI 3F,越谷レイクタウン駅,,35.882039,139.828022
ペニーポット越谷店,越谷市越ヶ谷1-16-6ミスターマックス越谷店2F,,,35.887022,139.787579
わんぱーく越谷店,越谷市越ヶ谷1-16-6ミスターマックス越谷店2F,,,35.887022,139.787579
ゲームファクトリーマグマ草加,草加市氷川町1132-1,草加駅,旧ハイテクランドセガ草加,35.822966,139.7961559
スクウェアワン草加,草加市西町632-1,R4,旧セガワールド草加,35.8309506,139.7918949
ラウンドワン草加,草加市谷塚上町204番地1,県道103,,35.8124733,139.7878598
モーリーファンタジー春日部店,春日部市下柳420-1イオンモール春日部2F,R4/R16,イオン春日部,35.9877584,139.7884323
ゲームファンタジア春日部,春日部市中央1-8-15春日部セントラル1-2F,春日部駅,,35.978995,139.751048
カバロ春日部店,春日部市中央1-13-1イトーヨーカドー春日部店5F,春日部駅,,35.9797406,139.7495471
かすかべ湯元温泉,春日部市下大増新田66-1,,,35.9556678,139.7433606
埼玉レジャーランド春日部,春日部市大字増富字谷際163-1,R16,,35.959357,139.728951
ゲーセン クレヨンしんちゃん 嵐を呼ぶプリプリシネマスタジオ,春日部市南1-1-1ララガーデン春日部内,春日部駅,,35.977137,139.7554199
ゲームパニック三郷,三郷市彦野2-25,R298,1000円80枚,35.8415416,139.8527262
ラクガキ王国三郷,三郷市天神2-22 イトーヨーカドー三郷店2F,R298,,35.84282,139.8548771
ぷれいらんど373三郷店,三郷市さつき平1-1-1 MEGAドン・キホーテ三郷店2F,新三郷駅,,35.8527622,139.867046
ラウンドワンスタジアムららぽーと新三郷店,三郷市新三郷ららシティ3-1-1ららぽーと新三郷 2F,新三郷駅,,35.859316,139.867185
ミサトヤングボウル,三郷市戸ヶ崎5-131,TX八潮駅常磐線金町駅,朝10時～翌3時まで営業／年中無休,35.7970537,139.8599851
ウェアハウス草加店,八潮市南後谷507,県道115,18歳未満の児童も入場可,35.8298043,139.8206868
THE 3RD PLANET フレスポ八潮,八潮市大瀬822-1 フレスポ八潮3F,TX八潮駅,,35.808691,139.8443292
ワンパクオウコク,久喜市久本寺谷田7番地1,東鷲宮駅・久喜駅からバス約5分、久喜市鷲宮西中学校から徒歩20分,,36.0791804,139.6624652
こころっこ東鷲宮店,久喜市桜田3-2-1 イオン東鷲宮店2F,東鷲宮駅,旧らんらんらんど東鷲宮店,36.0894922,139.6814473
ハローズガーデンモラモラ,久喜市久喜中央4-9-11イトーヨーカドー久喜店,,,36.070888,139.674933
キャロム栗橋,久喜市高柳字田中1741-3,R125,,36.117274,139.67363
プレイランド菖蒲店,久喜市菖蒲町菖蒲3555,R122バイパス,モラージュ菖蒲旧ソユークレイジースイーツファクトリー,36.0651249,139.6027358
ラウンドワンスタジアムさいたま・栗橋店,久喜市小右衛門192-1,,,36.1235748,139.7151401
宝島蓮田店,蓮田市東4-5-13 MEGAドン・キホーテ蓮田店2F,蓮田駅東口より徒歩5分,旧AN・ANT蓮田,35.9802827,139.6574851
にこぱ幸手店,幸手市大字上高野764,幸手駅,,36.0682064,139.7149537
スクウェアワン幸手店,幸手市上高野2142-1,杉戸高野台駅,旧セガワールド幸手,36.0570133,139.7143125
オートパーラVI ゲームセンター,行田市大字若小玉1798,R125,,36.1451166,139.4955135
エブリデイ行田店,行田市下忍644-1,R17熊谷バイパス,プライズマシンのみ,36.12225129999999,139.4626236
キッズファンタジー,加須市大門町20-58 加須カタクラパーク 2F,加須駅,旧ナムコランド,36.1301602,139.592762
アミューズメントプラザ加須,加須市中央1-1-15,加須駅,,36.1240833,139.5961979
ファンタジーランドガルー,加須市鳩山町10-10 ユニー大桑店,,,36.107097,139.655662
プラサカプコン羽生店,羽生市川崎2-281-3 イオンモール羽生2F,R122/南羽生駅,専門店棟の中です,36.1428893,139.5418351
モーリーファンタジー羽生店,羽生市川崎2-281-3 イオンモール羽生2F,R122/南羽生駅,イオン棟の中です,36.1428893,139.5418351
ビッグボウル杉戸,北葛飾郡杉戸町大字杉戸2338,R4/杉戸高野台駅,ゲーム少し,36.040185,139.7208181
WIZ SOYU 熊谷店熊谷駅,熊谷市銀座2-123-1 ニットーモール4F,,,36.138684,139.3939417
namco熊谷店,熊谷市銀座2-97 CARPA 1F,熊谷駅,旧：熊谷ナムコランド店,36.1390883,139.3944843
セガワールド籠原,熊谷市美土里町1-169,,,36.1707166,139.3184226
PALO,熊谷市本石2丁目135 イオン熊谷店3F,R17,旧ダイナレックス熊谷店,36.1454438,139.3788623
エムランド,熊谷市新堀新田523マミーマート籠原店2F,籠原駅,旧ファミリーランド籠原店,36.172844,139.321669
万代書店熊谷店,熊谷市石原342-3,R140,プライズマシンあり,36.1543777,139.3614125
ハッピーランド,深谷市上柴町西4丁目2-14 イトーヨーカドー深谷店,深谷駅,,36.1816026,139.2990496
ROBOT,深谷市上柴町西4丁目12-1,深谷駅,旧キャラゲット深谷店,36.1796708,139.2987408
シティボーイ ゲームセンター,深谷市瀬山561,明戸駅,,36.14381100000001,139.3023281
モンテカルロ 深谷店,深谷市西島915-2,,,36.1935995,139.2783502
ムー大陸本庄,本庄市本町1019-1,R17,ムー大陸本庄はNEWSではない,36.2483007,139.1924343
ファミリーワールド本庄店,本庄市駅南1丁目2-1 本庄BLALA 3F,本庄駅,,36.2362219,139.1871985
ちびっこらんど,本庄市南1-2-10 アピタ本庄店,本庄駅,,36.23708,139.182598
イオンファンタジーワールド,児玉郡上里町大字金久保字蓮山359-1,R17,,36.2605331,139.1360416
ラウンドワンさいたま上里店,児玉郡上里町大字金久保宇周川394-1,R17,,36.2516069,139.1448257
キッズプラザきゃらんど,児玉郡上里町大字七本木2272-1,県道23,ウニクス上里,36.2385972,139.1532336
セガ千葉,千葉市中央区富士見2-4-1富士ビル,千葉駅,旧：ハイテクセガ千葉,35.6094525,140.1177309
アドアーズ千葉,千葉市中央区富士見2-4-15 第一東和ビル1F-3F,,,35.61103,140.1164154
ラッキー中央店(フェリシダ),千葉市中央区富士見2-8-1,,,35.6102534,140.1182646
アサヒボウリングセンター ゲームコーナー,千葉市中央区新宿2-1-5,京成千葉中央駅,,35.6082453,140.1165454
スポーツウェーブ鉄腕24,千葉市中央区浜野町1025-59D'station浜野店 2F,浜野駅,,35.554117,140.126162
セガアリーナ蘇我,千葉市中央区川崎町6-9ハーバーシティ蘇我フェスティバルウォーク アミューズメント棟 1F,蘇我駅,,35.5927712,140.1178452
タイトーステーション アリオ蘇我店,千葉市中央区川崎町7-20 アリオ蘇我2F,蘇我駅,旧：ラクガキ王国蘇我,35.5882283,140.1224557
ゆにろーず横戸,千葉市花見川区横戸町911-1,,,35.6942217,140.1237576
ソユープレイランドソピア幕張,千葉市花見川区幕張町4-417-25 イトーヨーカドー幕張店2F,,,35.656148,140.051055
アミュージアム稲毛店,千葉市稲毛区小仲台1-4-20イオン稲毛2F,JR稲毛駅,,35.6368912,140.0950387
スポーツウェーブ鉄腕24稲毛長沼店,千葉市稲毛区長沼原町697,稲毛駅からバス,24時間営業一部0時閉店,35.6620233,140.1265534
ゲームファンタジア千葉北,千葉市稲毛区山王町316,四街道駅,,35.66018,140.1393916
ラッキー西千葉店(LUKY WEST),千葉市稲毛区弥生町1-15,西千葉駅,,35.6311904,140.1026479
CLUBSEGA稲毛オーツーパーク,千葉市稲毛区園生町380-1,稲毛駅からバス,旧：SWオーツーパーク,35.6511245,140.1200483
ムー大陸稲毛,千葉市稲毛区小仲台2-5-7 海宝ビル 2F,稲毛駅,,35.6380127,140.0931625
パレパレ稲毛長沼店,千葉市稲毛区長沼原町731-17,稲毛駅からバス,2015/02/14開店旧：THE 3RD PLANETフレスポ千葉稲毛,35.6576157,140.1277061
らんらんらんど千葉長沼店,千葉市稲毛区長沼町330-50 ダイエー千葉長沼店 1F,,,35.6576253,140.1170903
わくわくワールド稲毛店,千葉市稲毛区小仲台7-2-1 マルエツ稲毛店 2F,,,35.640688,140.090678
西友都賀,千葉市若葉区西都賀2-2-2,,データカードダスとガチャポンのみ,35.6328961,140.1461336
ファンタジープラザ千城台,千葉市若葉区千城台北3-21-1 ラパーク千城台 3F,,,35.6232153,140.1885599
ナムコランドおゆみ野店,千葉市緑区おゆみ野中央2-3-1ミスターマックスおゆみ野ショッピングセンター内,京成千原線 学園前駅下車徒歩10分,,35.554579,140.1604297
アミューズメントシティラクゾー鎌取店,千葉市緑区おゆみ野3-16 イオン鎌取店 5F,,,35.5613737,140.1774494
モーリーファンタジー鎌取店,千葉市緑区おゆみ野3-16 イオン鎌取店 3F,,,35.5613737,140.1774494
モーリーファンタジーおゆみ野店,千葉市緑区おゆみ野南5-37-1 イオンタウンおゆみ野2F,,MF鎌取店と混同しないこと,35.5444846,140.1724757
らんらんらんどあすみが丘店,千葉市緑区あすみが丘7-1 あすみが丘ブランニューモール 2F,,,35.5207614,140.2672727
セガ幕張,千葉市美浜区ひび野1-8 メッセアミューズモール1F,海浜幕張駅,旧：CS幕張,35.6497534,140.0423506
ファンパラダイス,千葉市美浜区高洲3-13-1 イオンマリンピア店 4F,,,35.6283438,140.0731154
ゲームファンタジア美浜,千葉市美浜区新港32-6-1 ハマニューポートリゾート 1号棟-2,稲毛海岸駅からバスあり,,35.6212489,140.0872178
namcoイオンモール幕張新都心店,千葉市美浜区豊砂1-1イオンモール幕張新都心グランドモール3F,,,35.6533793,140.0320222
モーリーファンタジー幕張新都心店,千葉市美浜区豊砂1-5イオンモール幕張新都心ファミリーモール2F,,,35.6571095,140.0261983
モーリーファンタジー銚子店,銚子市三崎町2丁目2660-1 イオンモール銚子 2F,R126沿い,イオン棟の中です,35.71063230000001,140.7880864
ゲームフジ市川,市川市市川1-9-11,市川駅,,0.0,0.0
ぷりモール宝島,市川市八幡2-6-7,本八幡駅,ぷりモール宝島の現在のOPはサン・ミューズです。,35.72183649999999,139.9280324
ゲームオット本八幡,市川市八幡2-16-6 八幡ビル B1F,旧：クラブセガ本八幡,,35.7215299,139.9267762
本八幡スターレーン,市川市南八幡4-9-1 メガドンキホーテ 6F,,,35.7193676,139.9256049
ラウンドワン市川鬼高店,千葉県市川市鬼高4-1-3,,,35.7116911,139.9273883
パロ市川店,市川市鬼高 1-1-1 ニッケコルトンプラザ 2F,鬼越駅,リンクはOPであるファンフィールドのサイトにしました。,35.716674,139.934985
らんらんらんど南行徳店,市川市南行徳2-20-25 ダイエー南行徳店　2F,南行徳駅,,35.6684906,139.905798
TFS市川妙典店,市川市妙典4-1-1 イオン市川妙典店2番街 2F,,,35.6925019,139.9269408
モーリーファンタジー市川妙典3F店,市川市妙典5-3-1 イオン市川妙典店3F,2FのイオンはTFS市川妙典,,35.6928356,139.9278607
DAIKEIEN 大慶園,市川市大町359,,,35.7686191,139.9589199
アミューズメントパフェパレパレ市川妙典店,市川市妙典4-4-27,旧：ザ・サードプラネット市川妙典店2016/8/31閉店,,35.6916742,139.926714
アドアーズ船橋店,船橋市本町1-31-26,船橋駅,2014/7/9 開店,35.700619,139.9844983
わいわいランド船橋店,船橋市本町7-6-1 イトーヨーカドー船橋店 4F,,,35.70326,139.984978
タイトーステーション船橋店,船橋市本町1-6-1,2015/8/8 開店,,35.6999107,139.9859038
マリンガーデン,船橋市浜町2-1-1 ららぽーとTOKYO-BAY 西館3F,船橋競馬場/南船橋,2013/11/22開店,35.6867943,139.9885516
セガ ららぽーとTOKYO-BAY,船橋市浜町2-1-1 ららぽーとTOKYO-BAY 北館1F,2015/3/13開店,,35.6863728,139.9895635
テクモピア船橋店,船橋市浜町2-2-7　ビビット南船橋 4F,,,35.687389,139.9931859
アミューズメントエース,船橋市前原西2-15-1 ファミービル 1F-3F,JR津田沼駅,,35.6922976,140.0201121
ゲームインファンファン北習志野店,船橋市習志野台2-6-17パチンコならしの 2F,北習志野駅,,35.722462,140.0436
パールプラザボウル,船橋市夏見1-16-38 パールプラザ 3F,,,35.706546,139.991481
船橋健康センター,船橋市夏見3-28-1,,,35.7158643,139.9878226
チャリオット船橋,船橋市藤原5-6-7 日野ビル 2F,,,35.740145,139.978342
namcoイオンモール船橋店,船橋市山手1丁目1-8イオンモール船橋3F,新船橋駅,,35.7114525,139.9786755
モーリーファンタジー船橋店,船橋市山手1丁目1-8 イオンモール船橋2F,,,35.7114525,139.9786755
エッグスポート船橋,船橋市浜町2-1-1 ららぽーとTOKYO-BAY 北館1F,2015年1月12日閉店,,35.6863728,139.9895635
モーリーファンタジー館山店,館山市八幡545-1 イオン館山店内,,旧：PP館山,35.0059565,139.8616615
館山ヤングボウル,館山市北条1564,JR内房線館山駅 徒歩12分,NESiCAxLive2筐体1セット(ALL.Net P-ras MULTIと入れ替え 公式HPに記載無し),34.9905648,139.8669461
ラッキー木更津店,木更津市中央1-2-19,,,35.382185,139.925379
イスカンダル,木更津市潮見4-1-2,,,35.3697392,139.9173994
宝島 新木更津店,木更津市請西南2-27-1イオンタウン木更津請西1F,,,35.3609943,139.9442195
ハローズガーデン 木更津店,木更津市ほたる野4-2-48 アピタ木更津店2F,,,35.3758688,139.9628072
パラボランド木更津,木更津市朝日3-10-19 グリーンシティ内,,,35.3857831,139.9363894
アドアーズアクアライン,木更津市中島地先 海ほたる4F,アクアライン経由のみ,アクアラインのPA内,35.46443,139.874265
ハイテクランドセガ岩瀬,松戸市岩瀬字鍛冶塚611-2,松戸駅から徒歩20分,,35.779194,139.910529
ソニックビーム,松戸市松戸1172-1,松戸駅東口徒歩2分,,35.7844272,139.9019932
カバロ松戸店,松戸市松戸1149　イトーヨーカドー松戸店 6F,松戸駅東口,,35.78381299999999,139.902422
セガ松戸,松戸市日暮1-1-1 八柱駅第2ビル 2F,八柱駅/新八柱駅,AGスクエアはセガのお店になりました。,35.7914073,139.9378938
カバロ八柱店,松戸市日暮1-15　イトーヨーカドー八柱店,,,35.7909898,139.9397905
らんらんらんど新松戸店,松戸市新松戸3-2-2 ダイエー新松戸店 4F,新松戸駅,,35.8251874,139.9157082
Play Land 54 street 北小金店,松戸市小金1 イオン北小金店 5F,北小金駅,,35.832683,139.931781
北小金ボウル,松戸市根木内249-7,,,35.8306644,139.9389467
ときわ平ボウリングセンター　ゲームコーナー,松戸市常盤平2-8-2,新京成 常盤平駅,,35.8027851,139.9498362
ファミリーランド五香店,松戸市常磐平5-22-3　ザ・プライス五香店 2F,,,35.7960538,139.9619411
らんらんらんど五香店,松戸市五香8-44-6 オウル五香店 1F,,,35.7966062,139.9814803
にこぱ新鎌ヶ谷店,鎌ヶ谷市新鎌ヶ谷2-12-1 アクロスモール新鎌ヶ谷,,,35.780873,140.0012628
モーリーファンタジー鎌ヶ谷店,鎌ヶ谷市新鎌ヶ谷2-7 イオン鎌ヶ谷SC2F,,,35.7784303,140.0011225
