Kid's US.LAND ベイタウン本牧店,横浜市中区本牧原12-1ベイタウン本牧5番街 4F,,,35.4254522,139.665136
T/Sイトーヨーカドー横浜別所店,横浜市南区別所1-115-2イトーヨーカドー横浜別所店内,,旧：H/T横浜,35.415908,139.594784
アミューズメントパークジアス上大岡店,横浜市港南区上大岡西2-1-28上大岡赤い風船1F,上大岡駅,,35.40691,139.596088
アミューズメントパークジアススクウェア,横浜市港南区上大岡西2-1-28上大岡赤い風船パート2 1F,上大岡駅,プリクラ専門,35.4068865,139.5959519
スコナランド港南台店,横浜市港南区港南台3-1-3港南台センターバーズ4F,港南台駅,旧：港南台センターナムコランド店,35.375082,139.5774908
わんぱくランド港南台高島屋店,横浜市港南区港南台3-1-3港南台髙島屋　屋上,港南台駅,,35.3743042,139.5772345
モーリーファンタジー港南台店,横浜市港南区港南台3-1-2ダイエー港南台店4F,上に同じ,,35.3759331,139.57718
イミグランデ上永谷店,横浜市港南区丸山台1-11-1上永谷ビル1・2F,上永谷駅,,35.400052,139.572793
プラサカプコン磯子店,横浜市磯子区磯子1-1-1マリコム磯子SC内,根岸駅,,35.4134046,139.6261911
クラブセガ新杉田,横浜市磯子区杉田1-1-1らびすた新杉田2F,新杉田駅杉田駅,,35.3858268,139.6190527
ゲームプラザピア小林店,横浜市磯子区杉田1-17-1プララ 杉田 杉田とうきゅう2F,京急線杉田駅と直結,,35.38386,139.616298
ゲームコスモ金沢文庫,横浜市金沢区谷津町344,金沢文庫駅,,35.3429162,139.6227528
モーリーファンタジー金沢八景店,横浜市金沢区泥亀1-27-1イオン金沢八景店2F,金沢八景駅,,35.3338377,139.6224657
キッズパーク イトーヨーカドー能見台,横浜市金沢区能見台東3-1イトーヨーカドー3F,能見台駅,ゲームコーナー,35.35818039999999,139.6274396
スコナランド金沢シーサイド店,横浜市金沢区並木2-13-13F,,イオン金沢シーサイド,0.0,0.0
八景島カーニバルハウス,横浜市金沢区八景島,シーサイドライン八景島駅,テーマパーク内ですが8号です。,35.3360588,139.6446064
クラブセガ綱島,横浜市港北区綱島西2-6-29城田ビル1F-3F,綱島駅,,35.5363741,139.6328761
イトーヨーカドー綱島店 ゲームコーナー,横浜市港北区綱島西2-8-1,綱島駅,ゲームコーナー,35.535395,139.6318018
ラウンドワン綱島店,横浜市港北区樽町2-6-40,綱島駅,,35.5319981,139.6371792
モーリーファンタジー横浜新吉田店,港北区新吉田東8-49-1イオン横浜新吉田店2F,新羽駅,旧：ファンタジーアイランド～,35.5324673,139.6128577
スウィングスタジアム横浜,港北区新羽町904,新羽駅,ゲームコーナー,35.5247346,139.6108071
namcoトレッサ横浜店,横浜市港北区師岡町700トレッサ横浜南棟3F,綱島駅,どの駅からも微妙な距離にあるため車、もしくはバス（綱島・日吉・鶴見・新横浜）が便利。,35.5246129,139.6456092
ドヌオス新横浜店,横浜市港北区師岡町911ZAM新横浜2F,綱島駅,ゲームコーナートレッサの近くのため上記と同様,35.525027,139.642001
ジアス新横浜,横浜市港北区新横浜2-1-19ingビル 2F,新横浜駅,,35.5070586,139.6166611
イミグランデ日吉店,横浜市港北区日吉2-2-4,日吉駅,通り沿いに1号館・2号館・3号館あり1号館→スタホ・スロット中心2号館→ガンスリンガーストラトス・MFC3号館→格ゲー・音ゲー中心,35.5540501,139.6464693
タイトーステーション戸塚西口店,横浜市戸塚区戸塚町4023,戸塚駅,旧：タイトーイン戸塚西口,35.3995319,139.5318297
モーリーファンタジーサクラス戸塚店,横浜市戸塚区戸塚町4253-1サクラス戸塚2F,戸塚駅,,35.4010327,139.5310224
スウィーツファクトリーパックン戸塚店,横浜市戸塚区上倉田町769-1アピタ戸塚店3F,戸塚駅,,35.3991284,139.5377051
モーリーファンタジー東戸塚店,横浜市戸塚区品濃町535-1イオンスタイル東戸塚店2F,東戸塚駅,,35.4303976,139.5610644
戸塚ボーリングセンター,横浜市戸塚区矢部町445,,,35.4085419,139.5341184
キッズトレイン東戸塚店,横浜市戸塚区品濃町537-1オーロラモール6F,東戸塚駅,,35.43057,139.558206
amue,横浜市戸塚区品濃町536-1オーロラモールアネックス7F,,,35.4300371,139.5601283
モラモラ東戸塚店,横浜市戸塚区川上町52-1オリンピック東戸塚店3F,,,35.4276562,139.5549915
ラウンドワン横浜戸塚店,横浜市戸塚区影取町1759-5,,,35.3642118,139.4978214
キッズプラザきゃらんど立場店,横浜市泉区中田西1-1-15イトーヨーカドー立場店3F,,,35.413242,139.500519
NICOPA　四季の森フォレオ店,横浜市旭区上白根3-41-1四季の森フォレオ3F,,旧：H/T四季の森,35.49874459999999,139.5410186
ファミリーランド鶴ヶ峰店,横浜市旭区鶴ヶ峰1-7-10ザ･プライス鶴ヶ峰店3F,鶴ヶ峰駅,,35.4733092,139.5455988
イトーヨーカドー若葉台店,横浜市旭区若葉台3-7-1,上に同じ,ゲームコーナー,35.50547220000001,139.4980529
アミューズメント・パラダイスシティ,横浜市旭区二俣川1-43-28ドン・キホーテ二俣川店5F,二俣川駅,,35.464671,139.531815
ヤードパル・アストロ,横浜市旭区鶴ヶ峰本町1-38-3,鶴ヶ峰駅,,35.4767223,139.5433421
アミューズメントスポットドリームス鴨居,横浜市緑区鴨居3-1-9,鴨居駅,,35.5099576,139.5690365
Play Land 54Street 十日市場店,横浜市緑区十日市場町818-2ダイエー十日市場店3F,十日市場駅,,35.5247308,139.5169436
スウィーツファクトリーパックンアピタ長津田店,横浜市緑区長津田みなみ台4-7-1アピタ長津田店2F,,,35.5183252,139.4984157
フロンティア三ツ境店,横浜市瀬谷区三ツ境6-1,三ツ境駅,,35.4664207,139.5049842
モーリーファンタジー三ツ境店,横浜市瀬谷区三ツ境7-1ダイエー三ツ境店2F,三ツ境駅,,35.4659241,139.5039814
モラモラ瀬谷店,横浜市瀬谷区中央6-20マルエツ瀬谷店2F,,,35.471628,139.482255
アクティランド橋戸,横浜市瀬谷区橋戸2-36-1フジシティオ内,,,35.4600181,139.4799357
すすき野湯けむりの里,横浜市青葉区すすき野3-2-7,上に同じ,ゲームコーナー入場料必要,35.5778232,139.5283961
ナムコランドWAOこどもの国店,横浜市青葉区奈良1-2-1三和ショッピングセンター3F,こどもの国線こどもの国駅,,35.557135,139.48406
プラボ都筑店,横浜市都筑区川和町846-1,川和町駅,,35.5197977,139.5533904
ファンタスティックジャーニー,横浜市都筑区池辺町4035-1イトーヨーカドーららぽーと横浜店2F,鴨居駅,,35.5177964,139.5669966
namcoららぽーと横浜店,横浜市都筑区池辺町4035-1ららぽーと横浜2F,鴨居駅,,35.5180962,139.565926
namco港北TOKYUショッピングセンター店,横浜市都筑区茅ヶ崎中央5-1港北東急百貨店6F,センター南駅,旧：ワンダーパーク港北,35.5445303,139.5722217
ネバーランド,横浜市都筑区中川中央1-36-16,センター北駅,,35.5560825,139.5797457
THE 3RD PLANET 港北ニュータウン店,横浜市都筑区中川中央1-25-1ノースポート・モール 6F,センター北駅,,35.5526758,139.5797151
モーリーファンタジー,横浜市都筑区中川中央1-31-1モザイクモール5F,センター北駅,,35.5550964,139.5780482
アメイジングワールド,横浜市都筑区中川中央2-2-1ルララこうほく4F,センター北駅,,35.5487776,139.5778169
ドラマ港北インター店,横浜市都筑区東方町321-6,鴨居・小机駅,新羽・鶴見・中山・大倉山駅からバスが便利,35.5192486,139.5847936
SILK HAT 川崎ダイス,川崎市川崎区駅前本町8ダイスビルB2F,川崎駅,旧：AM PIA川崎ダイス,35.531414,139.700024
AM PIA 川崎モアーズ,川崎市川崎区駅前本町7岡田屋モアーズ1F-2F,〃,,35.530542,139.6996382
スターライト,川崎市川崎区小川町14-3,〃,※スロットゲーセン,35.5282561,139.6995848
アドアーズイサゴ店,川崎市川崎区砂子2-5-5岡田屋2BKビル 1F-2F,〃,メダルゲーム専門,35.5297504,139.7004319
アドアーズ川崎店,川崎市川崎区砂子2-6-26泉屋砂子ビル1F,〃,メダルゲーム専門,35.528612,139.700085
ウェアハウス川崎店,川崎市川崎区日進町3-7,〃,8号営業ですが18禁。,35.5269619,139.6938603
川崎グランドボウル,川崎市川崎区宮前町11-14,〃,ゲームコーナー,35.5276895,139.7066731
NICOPA&nicoground川崎,川崎市川崎区富士見1-5-5マーケットスクエア川崎イースト1F,港町駅,,35.53365290000001,139.7118008
キッズトレインなっつべりい,川崎市川崎区港町12-1イトーヨーカドー川崎港町店2F,鈴本町駅,,35.5345204,139.7193593
こころっこ川崎店,川崎市川崎区中瀬3-20-20ホームズ川崎大師店2F,東門前駅,,35.5374844,139.7331028
アミュ－ズメントベネクス川崎店,川崎市川崎区鋼管通4-95,浜川崎駅,,35.5122664,139.7127896
ラウンドワン川崎大師店,川崎市川崎区殿町1-5-1,産業道路駅,,35.5380415,139.7416951
プレイランド川崎店,川崎市川崎区小田栄2-2-1イトーヨーカドー川崎店3F,小田栄駅,旧：～エスパ川崎店,35.5145782,139.7088353
モーリーファンタジー川崎小田栄,川崎市川崎区小田栄2-3-1コーナン川崎小田栄2F,小田栄駅,,35.515048,139.7065986
AM PIA ラ チッタデッラ,川崎市川崎区小川町4-1ラ・チッタデッラ B1F,2014/11/3閉店,,35.5280918,139.6979694
サムズタウン川崎店,川崎市川崎区駅前本町4-12ムラタヤビル アネックス1F-3F,2018/1/31閉店,,35.5297209,139.6991746
namcoラゾーナ川崎店,川崎市幸区堀川町72-1ラゾーナ川崎プラザ4F,川崎駅,旧：NL川崎店,35.5330472,139.6959016
YAZ川崎店,川崎市幸区小倉1658-35クロスガーデン川崎1F,尻手駅,,35.53582,139.6671653
ジョイランド中原店,川崎市中原区上小田中6-19-6,武蔵中原駅,,35.5801538,139.6421823
イトーヨーカドー武蔵小杉駅前,川崎市中原区小杉町3-420,武蔵小杉駅,,35.575474,139.6578534
タイトーステーション 溝の口2号店,川崎市高津区溝口2-13-5,JR南武線 武蔵溝ノ口駅東急田園都市線・大井町線 溝の口駅,2015/10/4オープン,35.6012953,139.6124009
イミグランデ溝の口,川崎市高津区溝口1-14-7 カスタムビル,,,35.6004909,139.6144708
ラウンドワン高津店,川崎市高津区二子4-8-1,東急田園都市線 高津駅,,35.6024062,139.6189389
テクモピア 向ケ丘遊園店,川崎市多摩区登戸2755ミノワホームズ1F,向ケ丘遊園駅,EMBED採用,35.6160974,139.5636871
モーリーファンタジー向ケ丘店,川崎市多摩区登戸2789ダイエー向ケ丘店3F,〃,,35.6151159,139.566672
ゲームインスターズ,川崎市多摩区登戸2978,〃,,35.6175313,139.566138
遊びっこ広場ふぉるむ川崎宮前店,川崎市宮前区犬蔵3-9-12マルエツ川崎宮前店内,,,35.5905146,139.5538494
わんぱくキッズランド,川崎市宮前区野川16-1FUJI上野川店内,,,35.5778612,139.6077347
ファミリーランド向ヶ丘店,川崎市宮前区平2-3-10ヤマダ電機2F,,旧：ダイクマ向ヶ丘店(ナムコ系列),35.599752,139.571464
遊びっこ広場ふぉるむ川崎野川店,川崎市宮前区野川3961-1,,移転,35.5717358,139.5973628
イオン新百合ヶ丘ファミリーパーク,川崎市麻生区上麻生1-19イオン新百合ヶ丘4F,新百合ケ丘駅,,35.602303,139.506772
ムトス相模原店,相模原市中央区中央2-1-5,相模原駅,OPが2012年9月に破産、ともかく目玉のようなネオンが目印,0.0,0.0
相模原パークレーンズ,相模原市中央区相模原2-7-4,相模原駅,ゲームコーナー,35.5793775,139.3696961
イミグランデ相模原店,相模原市中央区東淵野辺4-15-1,古渕駅,手前に旧館、奥に新館がある,35.55585780000001,139.4123679
相模原バッティングセンター,相模原市中央区南橋本4-6-11,南橋本駅,,35.5730492,139.3498314
モーリーファンタジー相模原小山,相模原市中央区小山3-37-1コーナン相模原モール2F,南橋本駅,,35.58319,139.356331
namcoダイエー上溝店,相模原市中央区上溝5-14-19グルメシテイ上溝店4F,上溝駅,,35.5580485,139.3613502
ドラマ星ヶ丘,相模原市中央区星ヶ丘3-7-7,上溝駅,,35.558159,139.3717687
アピナ橋本店,相模原市緑区西橋本5-1-1 1F,橋本駅,ラ・フロ－ル内,35.5976249,139.3374956
コーナン相模原西橋本,相模原市緑区西橋本5-4-3,橋本駅,,35.5970057,139.3342709
アドアーズ橋本店,相模原市緑区橋本3-3-1SING橋本2F,橋本駅,,35.594427,139.348944
アミューズメント PLABI アリオ橋本店,相模原市緑区大山町1-22アリオ橋本2F,橋本駅,,35.5909158,139.3497595
町田ボウリングセンター,相模原市南区上鶴間本町3-11-8,,,35.540054,139.4440517
クラブセガ相模大野,相模原市南区相模大野3-13-2東和ビル2F,,旧：サミーズストリート相模大野唯一の旧サミーアミューズメントのお店です。,35.5321868,139.4358379
（株）大野バッティングセンター,相模原市南区鵜野森2-3-21,,,35.5415871,139.4318805
namcoイオン相模原店,相模原市南区古淵2-10-1　イオン相模原店内,古淵駅,旧：NLイオン相模原店,35.553598,139.4173662
モーリーファンタジーイオン相模原,相模原市南区古淵2-10-1 イオン相模原3F,古淵駅,,35.5535423,139.4165071
セガワールド古淵,相模原市南区古淵3-13-33イトーヨーカドー3F,古淵駅,,35.552793,139.418566
ニコパニトリモール相模原,相模原市南区大野台6-1-1ニトリモール相模原3F,古淵駅,,35.5551681,139.4099126
キッズトレイン相模原,相模原市松が枝町17-1イトーヨーカドー相模原店3F,小田急相模原駅,,35.515511,139.425101
GAME SILK HAT 横須賀中央,横須賀市若松町1-5プライムビル,横須賀中央駅,旧：AM St.Tropez 横須賀中央,35.279247,139.670864
アミューズメントパラダイスゼロワン,横須賀市若松町1-6ヨコビル内,レトロビデオゲームが多数,,35.279608,139.671118
プラサカプコン横須賀店,横須賀市若松町2-30モアーズシティ内,,,35.2782445,139.6701893
アドアーズ横須賀店,横須賀市本町3-27 横須賀APT 1F,汐入駅、横須賀駅,,35.2809497,139.6623569
パロ横須賀店,横須賀市本町2-1-12ショッパーズプラザ横須賀4F,汐入駅、横須賀駅,旧:アトランティックシティー,35.2827294,139.6624408
らんらんらんど横須賀店,横須賀市本町2-1-12ショッパーズプラザ横須賀 4F,,同一OPでもパロ横須賀店とは別,35.2827294,139.6624408
ゲームランデブー横須賀店,横須賀市本町2-1-12ショッパーズプラザ横須賀 5F,,旧：オクティガーデン,35.2829829,139.6625347
リヴインよこすか　キッズパーク,横須賀市平成町3-21-4リヴインよこすか2F,,,35.2749108,139.6837131
モーリーファンタジー久里浜店,横須賀市久里浜5-13-1イオン久里浜店3F,,旧：ファンタジーアイランド…,35.2290393,139.7040162
ゲームファンタジア平塚店,平塚市紅谷町14-21,JR東海道線　平塚駅,,35.3285055,139.347524
namcoOSC湘南店,平塚市代官町33-1OSC湘南シティ内,〃,旧：ナムコランド平塚店、OSCの方にもゲームコーナーあり,35.328522,139.358495
アミューズメントランドYAZ平塚店,平塚市田村1-4-26,,,35.3653824,139.3605687
SEEK ONE,平塚市田村2-7-31ドン・キホーテビル4F,,,35.3697093,139.3609315
アミューズメントべネクス平塚店,平塚市四之宮6-10-27,,,35.3623466,139.35958
GAME PIA大船,鎌倉市大船1-24大船駅前ビル 1F-3F,大船駅,旧：AM～,35.353224,139.532525
ホームラン,鎌倉市大船1-5-10大船会館 2F,大船駅,,35.352066,139.532352
ジャンボリー大船店,鎌倉市大船6-1-1イトーヨーカドー大船店2F,大船駅,,35.354121,139.538306
アドアーズ藤沢北口店,藤沢市藤沢460-1,藤沢駅北口,元アブレイズ藤沢店,35.3396452,139.4863446
ゲームインファンファン藤沢店,藤沢市鵠沼石上1-3-8,藤沢駅南口,,35.3365873,139.4891721
TFS藤沢店,藤沢市南藤沢21-1,,,35.3372817,139.4873362
ゲームランデブーダイエー藤沢店,藤沢市藤沢520ダイエー藤沢店5F,,,35.3404138,139.4845037
アニメイト藤沢店,藤沢市鵠沼東1-2藤沢プラザ B1F,,ゲームセンター併設,35.335762,139.490202
ソユーゲームフィールド湘南店,藤沢市辻堂新町4-1-1湘南モールFILL 2F,,旧：SOYU LAGOON湘南店,35.3388534,139.464659
楽市楽座湘南藤沢店,藤沢市辻堂新町4-3-5ミスターマックス湘南藤沢SC 2F,,,35.3398337,139.4647401
ドラマ藤沢店,藤沢市本藤沢5-6-8,小田急線善行駅徒歩15分,,35.358487,139.4717237
プレイランドピカキッズ,藤沢市石川6-2-1イトーヨーカドー湘南台店,,,35.392371,139.446713
長後ゲームセンター,藤沢市下土棚507,長後駅,,35.4118715,139.4648375
カバロ藤沢店,藤沢市鵠沼石上1-10-1イトーヨーカドー藤沢店5F,,,35.335067,139.489119
T/S小田原シティーモールクレッセ店,小田原市前川120小田原シティーモールクレッセ 2F,,旧：TAC小田原,35.2811003,139.1944713
セガワールド小田原,小田原市中里296-1ダイナシティイーストモール イトーヨーカ堂 3F,JR鴨宮駅から徒歩20分小田原厚木道路 小田原東ICから車で5分西湘バイパス 国府津ICから車で5分,,35.281699,139.188716
小田原メトロポリス,小田原市前川219-4,JR国府津駅から徒歩20分巡礼街道沿い,コロナワールド小田原内,35.278763,139.1940702
T/S小田原店,小田原市栄町1-3-12,小田原駅,ようやくインベーダーの仲間入り小田原の2店舗を間違えないように,35.2549401,139.1561373
ヒルトン小田原リゾート＆スパ(ホテル内ゲームコーナー),小田原市根府川583-1,,旧スパウザ小田原,35.2067628,139.1316628
モーリーファンタジー茅ヶ崎店,茅ヶ崎市茅ヶ崎2-7-71イオン茅ヶ崎店3F,,旧：ダイナレックスイオン茅ヶ崎中央店と間違えないこと 2015年6月27日にリニューアル,35.3347856,139.4091225
モーリーファンタジー茅ケ崎中央店,茅ヶ崎市茅ケ崎3-5-16イオン茅ヶ崎中央店3F,,旧：ファンタジーアイランド茅ヶ崎店イオン茅ヶ崎店と間違えないこと,35.3359947,139.4026096
PLAY-IC 東海大学前店,秦野市南矢名1-15-1,東海大学前,,35.3721044,139.272272
コパ3,秦野市南矢名2-19-5,,,35.3681716,139.2726359
秦野マスターズボウル,秦野市今川町1-7明玉ビル5F,,ゲームコーナー,35.3714005,139.2253172
モーリーファンタジー秦野店,秦野市入船町12-1イオン秦野店2F,,旧：ファンタジーアイランド…,35.37737,139.227578
SILK HAT 本厚木,厚木市中町2-4-13本厚木駅前ビル,,,35.4402187,139.3653545
パームトップス,厚木市中町4-15-9,,旧：LaOXコンピュータ館隣パームトップスはセガです。,35.4390462,139.3619056
ゲームインファンファン本厚木店,厚木市中町2-1-6,,,35.4392879,139.3634971
イミグランデ本厚木店,厚木市中町3-2-1,,厚木市中町2-11-10から移転,35.439485,139.3615862
ファミリーランド厚木店,厚木市中町4-13-1イトーヨーカドー厚木店内6F,,,35.438398,139.361715
厚木プラザボウル　ゲームコーナー,厚木市中町2-3-1ダイヤプラザビル7F,,,35.4405297,139.3644423
ミリアンパーク,厚木市田村町9-25,本厚木駅徒歩10分,,35.4349993,139.3578503
神奈川レジャーランド厚木店,厚木市戸室5-31-1,,TVゲームエリアは24:00まで,35.4477335,139.3430819
アクティランド戸室,厚木市戸室1-29-15パシオス2F,,,35.4512064,139.3523911
厚木ツマダボウル,厚木市妻田北1丁目11-14,,R246,35.463257,139.3591808
アドアーズ大和店Ａ館,大和市大和東1-4-3大黒屋ビル1F-2F,大和駅,,35.4705287,139.4623706
ゲームリスボア,大和市大和東1-3-12,大和駅が近いです,,35.4704861,139.4619005
桜ヶ丘ボウル,大和市深見3875,,GC併設,35.4595432,139.4679116
アミューズメントべネクス大和店,大和市下鶴間2752-2,,,35.4896122,139.4641911
イミグランデ大和店,大和市鶴間2-12-27,,,35.4915058,139.4547664
ドヌオス鶴間店,大和市下鶴間2-1-6,,ゲームコーナー,35.4917143,139.4587801
プレイランド大和鶴間店,大和市下鶴間1-3-1イトーヨーカドー大和鶴間店3F,,,35.490683,139.457106
モーリーファンタジー大和鶴間店,大和市下鶴間1-2-1イオン大和鶴間店3F,,,35.4885715,139.4580965
モーリーファンタジー大和店,大和市下和田字上ノ原1216-1イオン大和店3F,,MF大和鶴間店と間違えないこと,35.434757,139.466182
月見野バッティングセンター,大和市下鶴間807-1,,,35.5061113,139.463857
T/S ダイエー伊勢原店,伊勢原市白根630-1ダイエー伊勢原店内,,旧：ダイエー伊勢原,35.3974076,139.2955463
ファミリーランド伊勢原店,伊勢原市桜台1-8-1イトーヨーカドー伊勢原店3F,,,35.395026,139.314944
T/S 海老名ビナウォーク店,海老名市中央1-18-1ビナウォーク6番館2F,海老名駅,旧：タイトートラップ,35.4525998,139.3954662
ハローズガーデン海老名店,海老名市中央2-4-1イオン海老名店2F,海老名駅,,35.4506634,139.3929756
イミグランデ海老名店,海老名市中央1-19-32,海老名駅,旧サンデーサン,35.451684,139.3920279
ファンタジーキッズリゾート海老名店,海老名市中央3-2-5ショッパーズプラザ海老名3F,海老名駅,,35.4504633,139.3905457
ネバーランド2,座間市ひばりが丘4-11-8,さがみ野駅,,35.480161,139.4325964
モラモラ大雄山店,南足柄市関本569ピアゴ大雄山店2F 3F,,,35.3193987,139.1023142
ミネボウル,綾瀬市上土棚南5-5-7,,,35.4076244,139.4466247
ハローズガーデン綾瀬店,綾瀬市深谷3734-1綾瀬タウンヒルズショッピングセンター2F,,,35.436785,139.428937
アミューズメントガーデン大磯,中郡大磯町国府本郷546,,,35.305494,139.2763198
ゆう遊空間 新潟弁天橋店,新潟市中央区紫竹山5-1-15,JR新潟駅より車で5分,,37.8986285,139.0675669
ファミリーランド,新潟市中央区本町通6-1122-1イトーヨーカドー丸大新潟店6F,,,37.919992,139.047142
ROUND 1 スタジアム新潟店,新潟市中央区美咲町2-1-38,ホンマ健康ランドそば,,37.8878535,139.0180369
DeKKY401ファミリーパーク,新潟市中央区上近江4-12-20DeKKY401 2F,越後線 関谷駅,,37.898297,139.0298416
ビルボードプレイスゲームコーナー,新潟市中央区八千代2-5-7万代シテイビルボードプレイス／BP2内,上越新幹線 新潟駅,,37.915954,139.053714
シルクドゥガリバー 新潟店,新潟市中央区南笹口1-1-1ドンキホーテ2F,新潟駅徒歩5分,,37.9084046,139.0638747
カプコサーカス新潟東,新潟市東区大形本町3-1-2ジャスコシティ新潟東内,,,37.924864,139.1147495
新潟空港ビル,新潟市東区松浜町3710,,,37.9510723,139.1126521
モーリーファンタジー新潟東,新潟市東区大形本町3-1-2イオン新潟東店3F,白新線 大形駅,,37.924864,139.1147495
カプコサーカス新潟東,新潟市東区大形本町3-1-2イオン新潟東店内ゲームコーナー,,,37.924864,139.1147495
ゲオ新潟空港通り,新潟市東区浜谷町2-4-6,R113,,37.9485718,139.0908149
ポピー豊栄,新潟市北区内島見浦潟2545-2,,,37.9428682,139.2077492
モーリーファンタジー・ｆ NIIGATAMINAM店,新潟県新潟市江南区下早通柳田1-1-1イオンモール新潟南2階,,旧名famiu,37.8760671,139.0812391
モーリーファンタジー新潟南店,新潟県新潟市江南区下早通柳田1-1-1イオンモール新潟南3階,,,37.8760671,139.0812391
ハローズガーデン 新潟亀田店,新潟市江南区鵜ノ子4-446 アピタ亀田店2F,,,37.872044,139.088837
ゆう遊空間 新潟新津店,新潟市秋葉区程島萱の中1964-1,,,37.7868027,139.1157545
わんぱく遊園,新潟市秋葉区新津山谷南4566-1,,,37.7907557,139.1105706
メジャーロード白根店,新潟市南区上下諏訪木948-2,,,37.760566,139.0221102
ららぽーと,新潟市南区茨曽根2433-1,,,37.7144842,139.0025207
タイトーＦステーション イオン新潟西店,新潟市西区小新南2-1-10 イオン新潟西店3F,,,37.8683801,138.9947942
リバプール,新潟市西区寺尾朝日通27-25,JR小針駅より車で5分新潟西郵便局向かい,,37.8827251,138.9832272
メジャーロード黒崎店,新潟市西区山田3302,サントノーレ裏,,37.8636596,139.0152921
ハローズガーデン 新潟西店,新潟市西区小新白鳥474 アピタ新潟西店2F,,,37.880503,139.0030561
モーリーファンタジー新潟青山店,新潟市西区青山2-5-1,イオン新潟青山店2階,イオン新潟青山店復活に伴い開店,37.8962826,139.0048827
TFSイオン新潟西店,新潟市西区小新南2-1-10 イオン新潟西店3F,,旧：TFS新潟サティ店,37.8683801,138.9947942
プレイハウス エリナ,新潟市西蒲区津雲田640,JR岩室駅より車で5分,,37.7175606,138.8906467
