遊スペース アローズ,神戸市西区丸塚2-81-1メガパレス内,第二神明道路 玉津ICより国道175号線を南へ約700m,,34.679142,134.982952
らんらんらんど西神中央店,神戸市西区糀台5-3-4ダイエー西神中央店3F,,,34.7199919,135.0193836
楽市楽座イオンモ－ル神戸北店,神戸市北区上津台8-1イオンモ－ル神戸北3F,中国道 神戸三田ICより車で5分,旧：アーバンスクエア イオンモ－ル神戸北店,34.8614175,135.1946671
モーリーファンタジー神戸北店,神戸市北区上津台8-1イオンモ－ル神戸北3F,中国道 神戸三田ICより車で5分,イオン棟の中です,34.8614175,135.1946671
らんらんらんど藤原台店,神戸市北区藤原台中町1-2-2ダイエー藤原台店4F,神戸電鉄 岡場駅下車徒歩5分,,34.82171,135.220543
イオン赤穂ファミリーランド,赤穂市中広字別所55-3イオン赤穂店2F,JR赤穂駅から東に徒歩15分,親テナントの名称が変わったので当然店舗名も変更,34.7497599,134.395831
モーリーファンタジー和田山店,兵庫県朝来市和田山町枚田岡774イオン和田山店内2F,,旧：ジャスコ和田山店ファンタジーアイランド,35.3294767,134.8637012
プレイランド和田山店,朝来市和田山町枚田岡774イオン和田山店内1F,,旧：アーバンスクエア和田山店,35.3294767,134.8637012
ABCバッティングセンター,尼崎市西大物町12-41,阪神尼崎駅下車東へ徒歩5分,,34.71877449999999,135.4191747
ゲームプラザ カウンタック,尼崎市神田北通2-25-1,阪神尼崎駅下車北へすぐ,,34.7222183,135.4063955
セガ あまがさきキューズモール,尼崎市潮江1-3-1あまがさきキューズモール4F,JR尼崎駅下車徒歩約1分,旧：セガワールドCOCOEあまがさき,34.7335736,135.4308647
セガつかしん,尼崎市塚口本町4-8-1つかしん内 にしまち2F,阪急稲野駅下車徒歩5分JR猪名寺駅下車徒歩10分,2012年10月営業再開。旧：セガワールドつかしん,34.7611067,135.4179347
T/S 尼崎つかしん店,尼崎市塚口本町4-8-1つかしん内 ひがしまち北館3F,同上,旧：ラクガキ王国inつかしん,34.7615434,135.4193874
ROUND 1 尼崎店,尼崎市西難波町4-5-25,阪神出屋敷駅下車徒歩5分,,34.72363199999999,135.4067732
ROUND 1 JR尼崎駅前店,尼崎市潮江1-4-5プラストいきいき館4階,JR尼崎駅下車徒歩1分,,34.7333741,135.432963
らんらんらんど塚口店,尼崎市南塚口町2-1-3ダイエー塚口店B1F,阪急塚口駅下車徒歩1分,,34.7522628,135.4164263
モーリーファンタジー尼崎店,尼崎市次屋3-13-18イオン尼崎店1F,,,34.7421889,135.4421652
アルクリオ　ゲームコーナー,淡路市志筑新島10－2イオン淡路店（専門店街アルクリオ）3F,,,34.4260569,134.9061564
テクモピアフォーレ伊丹店,伊丹市藤ノ木1-1-1イオンモール伊丹3F,JR伊丹駅下車徒歩1分,ダイヤモンドシティ時代からの愛称「テラス」が外れ、イオンモール伊丹に名称変更,34.78149459999999,135.4234186
モーリーファンタジー伊丹店,伊丹市藤ノ木1-1-1イオン伊丹3F,JR伊丹駅下車徒歩1分,旧：ファンタジーアイランド,34.78149459999999,135.4234186
エクスクラメーションR171店,伊丹市瑞穂町1-10サンクス2F,阪急伊丹駅下車徒歩20分国道171号線大鹿交差点そば,伊丹ドンキホーテの交差点向い側の本屋さん（サンクス）の二階,34.7896256,135.4054661
カリヨンパーク,伊丹市池尻4-1-1イオンモール伊丹昆陽4F,県道42号線(尼宝線)沿い,イオンモール伊丹と名称が似ているが、全く別の施設なので間違えないように,34.784467,135.3813798
モーリーファンタジー伊丹昆陽店,伊丹市池尻4-1-1イオン伊丹昆陽3F,県道42号線(尼宝線)沿い,リンクはイオンファンタジーに張っています,34.784467,135.3813798
ROUND 1 伊丹店,伊丹市昆陽7-29,国道171号沿い伊丹市役所より西へ700m,,34.7790734,135.3934676
アミパラ 加古川店,加古川市尾上町今福71-2ジョイパーク加古川内,国道250号線沿い,旧：K-CAT加古川店,34.751322,134.828581
加古川富士バッティングセンター,加古川市尾上町安田425,,,34.7483899,134.8352505
遊スペース スプラ,加古川市尾上町安田351メガコート内,山陽電鉄本線 浜の宮駅下車北に徒歩10分,,34.7456153,134.8354866
ROUND 1 加古川店,加古川市尾上町安田325-6,明姫幹線沿い安田交差点すぐ,,34.7470428,134.8369253
TFSイオン加古川店,加古川市平岡町新在家615-1イオン加古川店2F,東加古川駅が最寄,３階にも店舗あり,34.7490897,134.8622833
モーリーファンタジー加西北条店,加西市北条町北条308-1イオン加西北条2F,北条鉄道 北条町駅下車徒歩7分,,34.9304411,134.8284644
らんらんらんど川西店,川西市多田桜木1-1-1ダイエー川西店2F,能勢電鉄 鼓ヶ滝駅下車徒歩5分,,34.854938,135.4161256
アミューズスペースミール,三田市対中町5－21,神戸電鉄三田線三田本町駅下車徒歩5分,バッティングセンター併設,34.8808995,135.2297614
ハローズガーデン 三田店,三田市けやき台1-6-4イオン三田ウッディタウン2番街,神戸電鉄公園都市線ウッディタウン中央駅下車徒歩3分,,34.9080636,135.1859837
ドライブインながさわ　山崎,宍粟市山崎町木の谷字山本4－1,,少しの遊具とUFOキャッチャー類のみ,35.0641094,134.5740625
ROUND 1 宝塚店,宝塚市栄町1-14-3,JR・阪急宝塚駅下車徒歩7分国道176号線沿い,,34.8100771,135.3450515
らんらんらんど宝塚中山店,宝塚市売布東の町21-22ダイエー宝塚中山店2F,阪急中山駅下車徒歩5分,,34.8169881,135.3676323
らんらんらんど竜野店,たつの市龍野町堂本字五反田250-1ダイエー竜野店3F,,,34.8581809,134.5529116
宝島 氷上店,丹波市氷上町本郷300番地ゆめタウン氷上2F,北近畿豊岡道氷上ICすぐ,,35.15882879999999,135.0453384
ヒカミスカイボウル,丹波市氷上町横田735,,種類が少ないらしいので初めて行く人は期待して行かない方が良い,35.1512393,135.0515645
namco豊岡店,兵庫県豊岡市中陰617 3F,JR豊岡駅下車徒歩20分,旧：プラボ豊岡店,35.5549715,134.8122516
ジョイプラザ豊岡店,豊岡市加広町7-32コープデイズ豊岡内2F,JR豊岡駅下車徒歩10分,ジョイプラザ豊岡はRRBではない,35.550841,134.8163791
アイティキッズ・パーク,兵庫県豊岡市大手町4-5アイティ内4F,豊岡駅下車徒歩3分,,35.544484,134.814924
アミューズメントスペース タカラヤ,兵庫県豊岡市城崎町湯島395,JR城崎温泉駅下車徒歩10分御所の湯のななめ前,まぎれもない8号営業の店舗です。一般客も可,35.6257247,134.8079957
ゲームプラザ王冠,西宮市今在家町3-16,阪神西宮駅下車南へ徒歩1分,,34.7363326,135.338473
セガららぽーと甲子園,西宮市甲子園8番町1番地100,阪神甲子園駅下車 南へ徒歩5分阪神甲子園球場横のららぽーと甲子園2F,旧：SWソニックタウンららぽーと甲子園タイトーステーションではありません,34.7173455,135.3644131
タロフォフォ,西宮市田中町5-21TSビル,阪神西宮駅下車西口より西へ徒歩2分,,0.0,0.0
プレイステーションネーブル西宮店,西宮市両度町6-10両度ビル1F,阪急西宮北口駅下車南西へ徒歩5分JR西ノ宮駅下車北東へ徒歩10分山手幹線沿い,,34.7425854,135.3541586
らんらんらんど西宮店,西宮市林田町2-24ダイエー西宮店B1F/2F,,,34.7559345,135.3621531
G-pala姫路,姫路市飾磨区加茂字釜池203-1,姫路バイパス中地ランプより南に車で5分,一部24時間営業ここはゲームアイビス飾磨店のあったところです。,34.7992578,134.6612182
遊楽舎　姫路花田店,兵庫県姫路市花田町上原田2-1ブックワン２Ｆ,R372「花田」交差点付近,ブックワン２F,34.8385111,134.7291861
ゲームスタジオジーフラット姫路駅前店(2号店),姫路市東駅前町59,姫路駅からパステルおみぞ商店街内に入って徒歩2分,UFOキャッチャー中心旧：ビッグジョイ,34.8287891,134.6926322
クラブセガ姫路OS,姫路市駅前町254姫路OSビルB1F,,開店当初から「姫路OS」です。,34.828892,134.691149
ザ･モール姫路店,姫路市今宿2017-1,,,34.8380629,134.6604044
山陽マルナカ広畑店,姫路市広畑区吾妻町29-3,,,34.7965086,134.6239617
セガワールド花北,姫路市増位新町1-6ヴィーナスシティ花北2F,JR播但線野里駅すぐ,,34.856006,134.709352
姫路セントラルパーク サイバーステーション,姫路市豊富町神谷1436-1,,,34.8712602,134.7644433
広畑富士バッティングセンター,姫路市広畑巳長町1－1,,,34.815149,134.6853528
プリッズ姫路店,姫路市飾磨区細江520姫路リバーシティSC2F,山陽電鉄 飾磨駅下車徒歩10分,,34.7972654,134.6684617
まんがの広場キャンプ,姫路市西今宿3-9-17,JR播磨高岡駅前,,34.8427652,134.659546
ぷらっとらんど姫路店,兵庫県姫路市延末435-3　イオンタウン姫路,JR、山陽姫路駅下車後徒歩10分イオンタウン姫路店2F,,34.825398,134.68288
ゲームアイビス太子店,揖保郡太子町太田2149,国道179号線沿い,"1F:UFOキャッチャー,レースゲーム等2F:アーケードゲーム,カードゲーム中心3F:メダルゲーム",34.8323413,134.5999884
モーリーファンタジー猪名川店,川辺郡猪名川町白金2-1イオンモール猪名川3F,,イオン棟の中です,34.9019275,135.3644012
アミューズメントCUE奈良三条店,奈良市三条町478-1,JR奈良駅下車徒歩5分,,34.6817818,135.8221376
アメイジングワールド,奈良市二条大路南1-3-1イトーヨーカドー奈良店5F,近鉄新大宮駅より徒歩約13分,キッズ向け中心,34.68491160000001,135.8025405
ぷらっとらんどイオン富雄,奈良市富雄元町2-6-1イオン富雄店2F,,キッズ向け中心,34.691786,135.735665
キッズサーカス奈良柏木店,奈良市柏木町456-1奈良パワーシティー1F,国道24号線 柏木交差点すぐ奈良パワーシティ ショッピングセンター内,,34.6717776,135.7992839
アミューズメントCUE大和高田店,大和高田市東中2-11-16,,,34.499776,135.7355951
モーリーファンタジー大和高田店,大和高田市幸町3番地6オークタウン大和高田5F,,,34.5180027,135.744348
ハローズガーデン 大和郡山店,大和郡山市田中町宮西517アピタ大和郡山店2F,,,34.64158800000001,135.769376
ブック245,大和郡山市横田町75-1,近鉄筒井駅から徒歩40分,24H営業の古本屋とゲームセンターが合体した店舗国道24号線と国道25号線が交わる交差点沿いのニュー北京の建物の地下1階にある,34.6196218,135.8014818
楽市楽座 イオンモール大和郡山店,大和郡山市下三橋741-333イオンモール大和郡山3F,JR・近鉄郡山駅よりバス,専門店棟の中です,34.6504898,135.8021272
モーリーファンタジー大和郡山店,大和郡山市下三橋741-333イオンモール大和郡山3F,JR・近鉄郡山駅よりバス,イオン棟の中です,34.6504898,135.8021272
ゲームフェイス奈良健康ランド店,天理市嘉幡600-1,R24沿い。JR・近鉄天理駅、近鉄平端駅、JR郡山駅より無料送迎バスあり,入場は入館料（1620円）要今回よりOPであるフェイスにリンクを張っています。旧タイトーOP。,34.5922413,135.7958304
モーリーファンタジー天理店,天理市東井戸堂町381　ザ・ビッグエクストラ天理店,JR・近鉄天理駅徒歩15分,旧：ファンタジーアイランド…,34.5908,135.825024
アミパラ橿原店,奈良県橿原市十市町1222-1 ツインゲート橿原1F,,旧Ｋ－ＣＡＴツインゲート店,34.5293069,135.7962046
ソユーミクロガーデン,橿原市曲川町7丁目20-1イオンモール橿原3F,JR金橋駅より徒歩約10分だが高田市（×高田）駅から路線バスもあり,×イオンモール橿原アルル専門店棟の中です,34.506714,135.762948
モーリーファンタジー橿原店,橿原市曲川町7-20-1　イオンモール橿原2F,同上,旧：ファンタジーアイランド…イオン棟の中です,34.5072317,135.7623153
香具山ブックリ,奈良県橿原市南浦町910,近鉄畝傍御陵前駅から徒歩40分,24H営業ブック245の姉妹店だが麻雀格闘倶楽部やスロットのみ,34.4930116,135.8148187
モーリーファンタジー桜井店,桜井市上之庄278-1イオン桜井店2F,,,34.5217889,135.8367246
ファインワールド五條,五條市今井2-150イオン五條店2F,JR和歌山線 五條駅,,34.3534133,135.7022233
楽市楽座イオンモール奈良登美ヶ丘店,生駒市鹿畑町2501-1イオンモール奈良登美ヶ丘3F,近鉄けいはんな線学研奈良登美ヶ丘駅下車すぐ,旧：楽市楽座イオン奈良登美ヶ丘SC店、～イオン奈良登美ヶ丘SC店ほとんどメダル・プライズ,34.7257058,135.7501736
モーリーファンタジー登美ヶ丘店,生駒市鹿畑町2501-1イオンモール奈良登美ヶ丘2F,近鉄けいはんな線学研奈良登美ヶ丘駅下車すぐ,イオン棟の中です,34.7257058,135.7501736
アスパワールド,生駒市辻町480-1,阪奈道路沿い,旧：SW阪奈スポーツガーデンセガを引き継いで営業2015/1/16 改装の為休業(7月20日現在まだ改装中の模様),34.6968955,135.7129383
エムボウル,宇陀市榛原下井足49-1オークワサンクシティ3F,近鉄大阪線 榛原駅,,34.52686,135.950894
アピタ西大和店ゲームコーナー,北葛城郡上牧町大字上牧3000-1,,,34.5618651,135.7108602
レインボーランド広陵,北葛城郡広陵町安部450-1イズミヤ広陵店内,,,34.5338133,135.7454938
てんとう虫パーク 和歌山インター店,和歌山市松島348てんとう虫パーク和歌山店内 2F,国道24号線沿い和歌山インターから車で5分,旧：インターボウル100円15分系,34.2456412,135.2129899
ピタゴラス,和歌山市土入73-1,国道26号線延時交差点 和歌山バス「延時」徒歩1分,,34.2529335,135.1458647
プレイランドサーカス 太田店,和歌山市太田372-1,JR阪和線和歌山駅から徒歩4分ほど,元 駅裏ブックワン(現在はゲーセンのみ),34.230362,135.1932813
プレイランドサーカス 松江店,和歌山市松江北1-3-13,南海加太線松江駅から徒歩3分ほど,,34.248645,135.1389986
パームシティ和歌山ナムコランド,和歌山市中野31-1パームシティ和歌山店2F,,,34.255341,135.140403
ゲームランド BALLY,和歌山市毛見1527和歌山マリーナシティ内,JR海南駅からバスで15分南海和歌山市・JR和歌山駅よりバスで約1時間,旧：モンテカルロ（セガ系）ポルトヨーロッパの外にある為、入場料不要（＝園内から入場不可）,34.155319,135.179168
ラウンドワンスタジアム 和歌山店,和歌山市小雑賀739-3,県道和歌山海南線国体道路沿い,,34.1985322,135.185455
ユーズランド 和歌山店,和歌山市中字楠谷573イオンモール和歌山 2F,和歌山大学前駅,2014年3月開店,34.2757044,135.1489387
モーリーファンタジー 和歌山店,和歌山市中字楠谷573イオンモール和歌山 1F,和歌山大学前駅,2014年3月開店,34.2762674,135.1483707
TFS セントラルシティ和歌山店,和歌山市小雑貨805-1セントラルシティ和歌山店 1F,和歌山バス「和田川橋」下車徒歩約1分,2014年9月開店株式会社アスモ運営,34.1955844,135.1833685
レトロゲームミュージアム「@Mu's(あっとみゅーず)」,和歌山市松島348てんとう虫パーク和歌山店内 1F,国道24号線沿い和歌山インターから車で5分,2016年2月開店,34.2456412,135.2129899
紀の川ボウル,岩出市西国分656-1,R24沿い,,34.2642134,135.3300763
トークランドボウル,有田市箕島51,JR箕島駅下車徒歩約8分,,34.0830565,135.1282017
プレイランド ドレミ,有田市新堂字弁天10-3オークワ箕島店内2F,JR箕島駅下車徒歩約5分,,34.08504,135.128077
ジョイパーク海南,海南市築地1番1シーサイド海南スーパーセンターオークワ海南店内,JR海南駅から徒歩10分海南インターから5分,株式会社アスモ運営,34.1522277,135.2077822
パロ 橋本彩の台,橋本市あやの台1-50-2オー・ストリート彩の台内,南海線林間田園都市駅よりあやの台行バス15分,,34.3363589,135.6527749
TFS オークワロマンシティ御坊店,御坊市湯川町財部631-2オークワロマンシティ内3F,,旧：ハロータイトー御坊直営からFCへ移行株式会社フエゴ運営,33.8975608,135.1484576
BIG-ONE,田辺市東山2-31-22,県道31号橋谷交差点そば,ローソン向かい,33.7246506,135.3962663
プリッズ田辺店,田辺市稲成町新江原3165パビリオンシティ田辺店C館2F,国道42号バイパス稲成ランプそば,,33.744065,135.377158
らんらんらんど田辺店,田辺市宝来町24-26グルメシティ田辺SC店1F・3F,,,33.734755,135.388175
TFS オークワ南紀店,新宮市佐野3-11-19スーパーセンターオークワ南紀店内,紀伊佐野駅が近いが新宮駅からバスも可,旧：S/T南紀直営からFC店舗へ移行株式会社バリーボンド運営,33.6750021,135.9695864
モーリーファンタジー新宮店,新宮市橋本2-14-23()イオン新宮SC2F,新宮駅からバス,,33.71431700000001,135.990464
オートスナック由良苑 吉備店,有田郡有田川町大字明王寺148,JR藤並駅下車徒歩約15分国道42号沿い,ビデオゲームは麻雀系のみ半分ぐらいの筐体が稼動していない,34.0619394,135.1979173
あそびの広場 ピエロ,有田郡湯浅町大字湯浅1852-1オークワ湯浅店内2F,JR湯浅駅下車徒歩20分国道42号沿い,20時まで営業,34.0413197,135.1870282
アミパラ鳥取店,鳥取市南隈173-1イオンモール鳥取北別棟,,,35.5238334,134.2011821
アミューズメントTOP,鳥取市栄町718-3,,,35.495025,134.2268202
アミューズサルビア,鳥取市富安1-21,鳥取駅よりダイエー側へ徒歩15分26号線沿い,,35.488834,134.2287257
メカランドサルビア,鳥取市秋里271-2,国道9号沿い､南隈交差点を東へ,,35.5154918,134.2155401
セガ鳥取,鳥取市安長(字河原口)416,県道318号沿い､八千代橋の近く鳥取駅からバスでも可,旧：セガワールド鳥取,35.5122308,134.2068718
モーリーファンタジー鳥取店,鳥取市天神町1イオン鳥取店2F,,旧：ファンタジー…イオン棟の中です,35.4934186,134.2218442
モーリーファンタジー鳥取北店,鳥取市晩稲100番1イオン鳥取北店2F,,旧：ファンタジー…イオン棟の中です,35.5247422,134.2015581
てんまやパーク,米子市西福原2丁目1番10号,,,35.4406152,133.3411603
セガワールド米子,米子市両三柳(字忠次郎南)2778-2,境港方面R431号左側,,35.4500305,133.3248276
モーリーファンタジー米子駅前店,米子市末広町311イオン米子駅前店3F,,旧：ダイナレックスイオン米子駅前3F,35.4228033,133.3329347
モーリーファンタジーホープタウン店,米子市米原2-1-1ホープタウン3F,,旧：ダイナレックス…,35.4422208,133.3305222
スーパーヒーロー倉吉,倉吉市見日町633,バス・西倉吉方面行き/厚生病院前下車徒歩3分,道路隔てて斜め向かい側にスーパーヒーロー２がある倉吉市見日町589の辺り裏の遊歩道は国鉄の跡。,35.4382788,133.8393401
パロ 境港店,境港市竹内団地81番地3,JR境線高松町駅より徒歩18分 PLANT-5北隣り,,35.5220352,133.2522546
ニューラッキースタジオ,東伯郡三朝町大字三朝,,,35.4102495,133.8938285
泉娯楽場,東伯郡三朝町大字三朝923-3,,,35.4103273,133.8934425
アミューズメントUFO,東伯郡琴浦町徳万443,,パチンコ屋です,35.5042306,133.6924171
アミパラ米子店,西伯郡日吉津村大字日吉津1319-1イオンモール日吉津西館1F,米子ICから5分米子駅からバスも可,専門棟の中です。,35.4455705,133.3856328
モーリーファンタジー日吉津店,西伯郡日吉津村日吉津1160-1イオン日吉津店2F,,旧：イオンファンタジ－…イオン棟の中です。,35.4455906,133.3860376
オートパーラーやすぎ,安来市西荒島町33,JR荒島駅徒歩15分国道9号線沿いバスも可,全席喫煙可　休憩スペースあり昔から8号です。,35.4325245,133.1918612
わくわくランド,松江市黒田町字下ノ原427松江タウンスクエアキャスパル2F,,旧：アピアランド,35.475033,133.043548
セガ松江,松江市嫁島町12-15,JR乃木駅より徒歩10分松江市営バスも可,旧：セガワールド松江,35.4500922,133.0478147
VIVACE松江店,松江市東朝日町203-1,JR松江駅より徒歩14分,旧：AGスクエア松江OPは変わっていません。,35.4636718,133.0741396
モーリーファンタジー・ｆ松江店,松江市東朝日町151イオン松江店3F,松江駅からも徒歩圏だがバスのほうが楽,旧：イオンファンタジーワールド…,35.46424770000001,133.0696542
松江センターボウル,松江市寺町99-26,松江駅徒歩7分,,35.4620633,133.0596464
フラワーランドルート9,松江市出雲郷470-1,,余談だが、出雲郷は「あだかえ」。,35.4332099,133.1285783
ラピタランド,出雲市今市町87 ラピタ2F,,,35.368893,132.753818
パラオランド,出雲市今市町259-1 パラオ3F,,,35.3672324,132.7576284
youme CIRCUS,出雲市大塚町650-1ゆめタウン出雲店東館3F,,,35.377403,132.756228
出雲会館センターボウル,出雲市渡橋町112,,,35.3694375,132.75204
G-pala出雲,出雲市渡橋町784-1,,旧：セガワールド出雲,35.3660626,132.7434242
モーリーファンタジー出雲店,出雲市渡橋町1066 イオン出雲店2F,,旧：ファンタジーアイランド…,35.3676914,132.7387765
VIVAショッピングセンター内ゲームコーナー,出雲市平田町1708-1,,2017年7月1日リニューアルオープン,35.4280959,132.8104759
らんらんらんど浜田店,浜田市周布町イ61番1トライアル浜田店1F,,旧：ナムコランド,34.8630414,132.0261063
ピノッキースパティオ浜田店,浜田市港町227-1ゆめタウン浜田3F,,2014年6月12日オープン旧：タカラ島 浜田店,34.8998307,132.0715319
ロードショウ浜田,浜田市新町23,,,34.8975026,132.0770975
ファンタジーランド浜田店,浜田市相生町139-8シティパルク浜田3F,,,34.8980807,132.0909656
ゲームスポット エース,益田市乙吉町イ97-4Tom'sビル1F,益田サティより徒歩一分石見交通 日赤前仮停留所そば,,34.6820664,131.8438118
ピノッキーズパティオ益田店,益田市高津7-21-12イズミゆめタウン益田2Ｆ,益田駅からバス,,34.6911678,131.8158974
メルヘンランド,大田市長久町土江97イオン大田店,R9沿い。静間駅徒歩15分,元ナムコランド,35.198773,132.480809
らんらんらんど江津店,江津市嘉久志町2306-30江津グリーンモール内2F,JR江津駅徒歩5分,旧：グリーンランド,35.0102315,132.2188139
セガ イオンモール岡山,岡山市北区下石井1-2-1イオンモール岡山 6F,岡山駅東口から徒歩5分,,34.662267,133.917801
モーリーファンタジーｆ 岡山店,岡山市北区下石井1-2-1イオンモール岡山 4F,岡山駅東口から徒歩5分,,34.6626119,133.9171285
岡山ジョイポリス,岡山市北区下石井2-10-1,岡山駅東口から徒歩10分,,34.6585729,133.9185797
アミパラ岡山店,岡山市北区青江1-13-8,国道2号線バイパス・青江交差点から北へ行き赤十字病院を西へ,,34.6362117,133.9199885
スターダスト,岡山市北区駅前町1-7,岡山駅東口から近く,,34.6665692,133.9210513
アミパラ・テクノランド,岡山市北区大和町1-7-12,法界院駅から徒歩10分バスなら「大和町」下車徒歩30秒,,34.6791764,133.9274976
プレビ エブリイOkanaka津高店,岡山市北区横井上83-3エブリイOkanaka津高 4F,岡山IC入口そば,,34.7000825,133.9023836
岡山ヤングボウル,岡山市北区北長瀬表町3-3-20,北長瀬駅を南へ徒歩10分県道162号沿い,,34.6490702,133.8845145
岡山フェアレーン,岡山市北区清心町16-31,岡山駅から徒歩15分バスも可,アミパラではありません。2Fに設置。8号営業です,34.6748182,133.9196374
ドライブイン旭川,岡山市北区建部町吉田1168,国道53号線沿い,,34.8382489,133.9173881
ネットジャパン,岡山市北区神田町2-5-21,十日市交差点そば,上記「NET J」に改名,34.638831,133.9240963
ゲームアイビス岡山店,岡山市中区高屋308-1フレスポ高屋店,国道250号線沿いホンダの向かい,18歳未満の児童のみの入店もできるようになりました,34.672342,133.966784
アミューズメントプレイス・ギミック・セガ,岡山市中区藤崎599-12,倉田交差点を南へ3キロかなり遠いが岡山からバスも可,パチンコメトロ隣,34.6088695,133.9766202
ふぇすたらんど平島店,岡山市東区東平島1609番地マルナカ平島店1F,,,34.7079434,134.0494955
