ROUND 1 鳴海,名古屋市緑区鳴海町字杜若28,,,35.0989113,136.9527377
鳴海中日スタジアム　ゲーム場,名古屋市緑区鳴海町字杜若92,,,35.0966781,136.9510323
SOYU BREMEN TOWN 鳴海店,名古屋市緑区鳴海町字伝治山3-9アピタ鳴海店2F,,,35.094105,136.9594116
プラサカプコン 徳重店,名古屋市緑区鳴海町字徳重 18番地の44ヒルズウォーク徳重ガーデンズ2F,地下鉄桜通線 徳重駅から連絡通路で直通,旧：タイトーFステーション,35.09438859999999,136.9992084
サムソンみなと店,名古屋市港区当知2-1501ポートウォークみなと2F,,,35.109618,136.847821
Bundy,名古屋市港区品川町2-1-6イオンモール名古屋みなとシネマ棟1階,,旧：ドリームワールド,35.103689,136.8643862
モーリーファンタジー名古屋みなと店,名古屋市港区品川町2-1-6イオン名古屋みなと店3F,あおなみ線荒子川公園駅徒歩5分,,35.1032471,136.8619681
わくわくランド,名古屋市港区品川町2-1-6イオン名古屋みなと店4F,あおなみ線荒子川公園駅徒歩5分,,35.103266,136.8633403
ハッピーランド 木場店,名古屋市港区木場町8-51 ザ・チャレンジハウス2F,,営業時間 10:00～21:00,35.100501,136.900971
Kid's US.LAND イオン南陽店,名古屋市港区春田野1丁目330 イオン南陽店 2Ｆ,,15分108円の会員制ゲームコーナー,35.116307,136.8166573
あそびの国 みなと店,名古屋市港区一州町1−3カインズ名古屋みなと店 2F,あおなみ線稲永駅徒歩4分,営業時間 10:00～20:00,35.0916267,136.8663179
ホームセンターコーナン 南十番町店 ゲームコーナー,名古屋市港区南十番町1丁目1番2号ホームセンターコーナン 南十番町店 2F,,,35.117715,136.882138
namcoイオンモール名古屋みなと店 あそびパーク,名古屋市港区品川町2-1-6イオンモール名古屋みなと 1F,あおなみ線荒子川公園駅徒歩5分イオンモール名古屋茶屋とのシャトルバスあり,15分110円の屋内遊園地3F「キャラポップストア」「プライズアウトレット」もナムコの店,35.1033063,136.8619252
トム・ソーヤのなかまたち,名古屋市港区品川町2-1-6イオンモール名古屋みなと 1F・2F,,2Fは子供向け遊具メインの「SPORT」,35.103266,136.8633403
モーリーファンタジー・ｆ 新瑞橋店,名古屋市南区菊住1-601-1イオン新瑞橋店3F,,,35.1147073,136.9353123
モーリーファンタジーメイトピア店,名古屋市名東区高間町501-1イオンリテールメイトピア店2F,,旧:らんらんらんどメイトピア店,35.1603783,137.0030782
モーリーファンタジー名古屋東店,名古屋市名東区猪子石原2-1701イオンリテール名古屋東店1F,,旧：らんらんらんど名古屋東店,35.1953445,136.9938111
Kid's US.LAND 清水屋藤ヶ丘店,名古屋市守山区森孝東1-509 清水屋藤ヶ丘店 5Ｆ,,15分108円の会員制ゲームコーナー,35.1913105,137.0195432
モーリーファンタジー守山店,名古屋市守山区笹ヶ根3-1228イオン守山店2F,,,35.2347714,137.004048
ボナンザキッズランド,愛知県愛西市須依町前田面95-1ヨシヅヤ佐屋店1F,,,35.151013,136.718006
ファンタジーパーク,愛知県愛西市北一色町東田面10-1ピアゴ佐屋店2F,,,35.1476844,136.7302465
アミューズメントシティ ザ・モール安城店,安城市大東町9-31,,,34.9654406,137.0809689
ソユープレイランドソピア安城店,安城市住吉町3-1-8イトーヨーカドー安城店2F,,,34.985128,137.08331
ユーファクトリーin安城,安城市住吉町丸田24-6,,,34.9830104,137.0793967
安城メトロポリス,安城市浜富町6-8,,,34.955498,137.0972953
セガ安城,安城市百石町2-35-13,名鉄バス「中央図書館前」下車徒歩2分,旧：セガワールド安城,34.9473926,137.0731591
ハローズガーデン 安城南店,安城市桜井町貝戸尻60アピタ安城南店 2Ｆ,,,34.9202936,137.0876567
セガ イオンモール木曽川,一宮市木曽川町黒田字南八ツヶ池25-1イオンモール木曽川3F,名鉄黒田駅徒歩3分,旧：セガワールドおもしろ遊戯御殿木曽川,35.350317,136.773959
モーリーファンタジー木曽川店,一宮市木曽川町黒田字南八ツヶ池25-1イオンモール木曽川2F,名鉄黒田駅徒歩3分,,35.3503115,136.7746049
モーリーファンタジー妙興寺店,一宮市大和町妙興寺字白山西3-2ピアゴ妙興寺店3F,名鉄 妙興寺駅すぐ,旧：らんらんらんど妙興寺店,35.2867173,136.7975177
セガワールド尾西,一宮市篭屋3-9-7アソビックスびさい1F,,旧：セガワールド尾西,35.3090226,136.7715812
ゲームセンター千秋24,一宮市千秋町加納馬場字清水53,県道63号沿い,24時間営業ではなくなった？営業時間11:00～翌朝5:00 入口に記載,35.3069079,136.8655044
ゲームゾーン,一宮市羽衣2丁目5番地1,コジマNEW一宮店､一宮競輪場隣,24時間営業メダルゲームコーナー9：00 ～ 24：00,35.3054594,136.8103484
ゲームコーナー　ナイル,愛知県一宮市木曽川町黒田八ノ通51-4アピタ木曽川店2F,,,35.3446042,136.7905604
namcoテラスウォーク一宮店,愛知県一宮市両郷町一丁目2番地テラスウォーク一宮2F,名鉄バス「両郷町口」から徒歩1分名岐バイパス沿い,,35.310625,136.81681
モーリーファンタジーピアゴ大和店,一宮市大和町毛受字一本松19番地ピアゴ大和店2F,,,35.2967649,136.7830732
ハローズガーデン　尾西店,一宮市小信中島東鵯平59ピアゴ尾西店 2F,,,35.3120581,136.7519297
日本ゲーム博物館,犬山市今井山神洞9-1,リトルワールド近く「成沢リトルワールド入口」下車徒歩10分,2016年1月より休館小牧メトロポリスの一角でレトロコーナーとして営業,35.3787131,137.0090359
ヨシヅヤ平和店 ゲームコーナー,稲沢市平和町須ヶ脇367番地ヨシヅヤ平和店1F,名鉄 六輪駅から徒歩3分,,35.2043727,136.7286975
ゲームプラザミッキー,稲沢市朝府町2-33,稲沢市役所近く,,35.25189,136.7788102
namcoアピタ稲沢店,稲沢市天池五反田町1シネマ＆アミューズ館 2F・3F,,旧：NL稲沢店ボウリング場併設,35.2511676,136.7719506
ヨシヅヤ新稲沢店 ファンタジックランド,愛知県稲沢市朝府町4番1号ヨシヅヤ新稲沢店2F,,,35.2516761,136.7767547
タイトーステーション パールシティ稲沢店,稲沢市井之口大坪80-1パールシティ稲沢2F,,旧：ハロータイトー稲沢,35.2373675,136.8185847
稲沢グランドボウル,愛知県稲沢市井之口大坪町80-1,パールシティ南,1Fがゲームコーナー,35.2374706,136.8193355
プラサカプコン稲沢店,稲沢市長野町7-1-2リーフウォーク稲沢2F,JR稲沢駅から徒歩10分,,35.260715,136.819024
フラミンゴキッズ,愛知県稲沢市下津穂所一丁目１番１アピタ稲沢東店2F,JR稲沢駅から徒歩10分,リーフウォークとの連絡通路有り,35.2591584,136.8194726
友遊縁日アピタ岩倉店,岩倉市旭町1-25 アピタ岩倉店2F,名鉄犬山線岩倉駅すぐ,アピタ直営店,35.276542,136.872903
ゲームファンタジーランド・ダイナソアエイジ,大府市東新町3-87,,,35.0309762,136.9561987
ビバーチ大府店,大府市柊山町1-98 リソラ大府ショッピングテラス2F,大府駅徒歩15分,,35.0169696,136.957894
スタジアム大府店,大府市明成町4-133アピタ大府店2F,,,35.0213066,136.9515967
セガ岡崎,岡崎市上地3-50-4,,旧：セガワールド岡崎,34.9113546,137.169312
ADX MAMY 岡崎店,岡崎市井田新町6-1,北岡崎駅から徒歩約11分,モンキーパンチ跡地にオープン,34.9770122,137.1617216
ゲームファンタジアン岡崎店,岡崎市錦町2-4,北岡崎駅は近い,2014年2月開店旧：LOOP岡崎店,34.9737402,137.1600412
アリス岡崎店,岡崎市日名北町1-1岡崎グランドボウル1F,,,34.9741224,137.157613
ジースクエアアピタ岡崎北,岡崎市日名北町4-46,,,34.9751093,137.152628
ゲームアミューズジョイ,岡崎市福岡町字峠5-1,,,34.9090267,137.1607187
モーリーファンタジー岡崎店,岡崎市上六名町字宮前1SCコムタウン1F,,旧：らんらんらんどコムタウン岡崎店,34.95096729999999,137.1567671
ステーション201,岡崎市美合町一ノ久保1-64サンリバー1F,,,34.9237267,137.1964197
ゲームランド 岡崎店,愛知県岡崎市戸崎町字外山38-5イオンモール岡崎 シネマ館 2F,JR岡崎駅か名鉄東岡崎駅からバスで「イオンモール岡崎」,カプコン直営店,34.937846,137.164454
西友岡崎店ゲームコーナー,岡崎市戸崎町越舞2-1西友岡崎店 2F,,,34.9315723,137.1653072
M's PARK 三郷店 西館,尾張旭市南原山町字赤土207,,旧：ADX MAMY 三郷店,35.215047,137.045025
タカラ島尾張旭,尾張旭市北本地ヶ原4-29,,,35.1991291,137.0413509
ピアゴ印場店 遊ランド,尾張旭市庄中町一丁目5番地1ピアゴ印場店 2F,名鉄瀬戸線印場駅徒歩5分,営業時間 10:00～20:00,35.2062041,137.0131622
モーリーファンタジー瀬戸みずの店,瀬戸市みずの坂2丁目253番地イオン瀬戸みずの店2F,,,35.2428654,137.0672739
クラブセガ春日井,春日井市岩野町字菅廻間4180,,旧：セガワールド春日井,35.269504,136.9605372
オークランド春日井,春日井市鳥居松町3-11,国道41号線沿い,,35.2456556,136.968985
チャオランド春日井西,春日井市西高山町2-3-6バロー春日井西店2F,,,35.2570632,136.9464379
プレイハード50(ファイブオー)春日井,春日井市不二ガ丘1-36,,,35.2673965,137.0122357
ADX MAMY (春日井店？),春日井市不二ガ丘1丁目5,国道155号沿い、不二が丘交差点角,,35.2673271,137.0126829
アミュージアム春日井店,愛知県春日井市六軒屋町東丘22THE MALL春日井3F,,,35.2590037,136.9824408
キッズインタイトーイオン春日井店,春日井市柏井町4丁目17番地イオン春日井店３Fゲームコーナー,,,35.2381257,136.9624441
モーリーファンタジー春日井店,春日井市柏井町4丁目17番地イオン春日井店4F,,,35.2381257,136.9624441
友遊縁日アピタ高蔵寺店,愛知県春日井市中央台1-2-2 サンマルシェアピタ館2F,,アピタ直営,35.2826694,137.0488756
ヤングプラザドットコム,蒲郡市大塚町平原84-1,,,34.8118446,137.2783454
ゲームファンタジアン蒲郡店,蒲郡市竹谷町中野1-12,JR東海道線 三河塩津駅,,34.8289529,137.211134
アミューズメントプラザマルシン,刈谷市池田町4丁目609番地,,,35.0069308,137.0091697
M's PARK 刈谷店,刈谷市稲場町3-206,,旧：名豊ワールド,35.0054807,137.0014037
ADXﾏﾐｰ 刈谷店,刈谷市末広町1-19,,,34.9742246,137.0452695
セガイオンタウン刈谷,刈谷市東境町京和1,,旧：AGスクエア刈谷店,35.0386452,137.0272345
楽市街道名古屋店,北名古屋市中之郷神明45-1,国道22号線沿い,,35.239849,136.8488049
ROUND 1 名古屋西春,北名古屋市宇福寺神明15,国道22号線沿い名鉄一宮から送迎バスが楽でしょう。,,35.2548498,136.8436265
Kid's US.LAND パレマルシェ西春店,北名古屋市鹿田3926番地10号パレマルシェ西春店 5階,名鉄西春駅,15分108円の会員制ゲームコーナー,35.2447352,136.8719918
チャレンジハウス ダイナマイト,清須市大字西田中字本城18,,,35.1998641,136.8529447
ワンダーフォレスト 江南西店,江南市松竹町上野205VIA MALLアピタ江南西店2F,,ハローズガーデン系列,35.34316,136.8552041
わくわくらんど江南,江南市上奈良町栄61-3平和堂江南店2F,,,35.3324012,136.8566242
ブランズウィックスポルト江南,江南市上奈良町緑13,,,35.33247780000001,136.8586568
Kid's US.LAND ピアゴ江南店,愛知県江南市村久野町瀬頭163番地ピアゴ江南店 2F,,15分108円の会員制ゲームコーナー,35.3548446,136.8736652
M’s PARK 小牧店,小牧市村中稲荷783,,,35.3042554,136.9116126
小牧メトロポリス,小牧市村中新町31,,,35.2956845,136.9030326
Kid's US.LAND 清水屋小牧店,小牧市郷中1-263 清水屋3F,,15分108円の会員制ゲームコーナー,35.2785038,136.9209556
セガ東名ボール,瀬戸市西原町2-114,,旧：メルクス東名ちなみにメルクス東名は別の区画,35.2091868,137.062857
Kid's US.LAND ピアゴ菱野店,愛知県瀬戸市緑町一丁目106番地 ピアゴ菱野店2F,,15分108円の会員制ゲームコーナー,35.2086547,137.0864891
WAVE 田原,田原市神戸町字大坪152-1,神戸（かんべ）駅が近い,,34.6682751,137.2767331
ファミリーランド　ドリーム,田原市田原字南新地76-1イオン田原店（パオ田原店）,,,34.6728031,137.2742919
伊良湖クリスタルポルト,田原市伊良湖町宮下3000-65 1F,伊勢湾フェリー名鉄フェリー等,道の駅,34.5840276,137.0199622
レストハウスマミー,知立市山町小林24-1,,,35.008893,137.0488577
セガワールド知立,知立市長篠町大山18-1ギャラリエアピタ北館1F,,,34.999035,137.0528617
ADX MAMY 甲子園店,津島市寺野町五反田43,西尾張中央道沿い,旧：セイタイトー甲子園,35.1900087,136.7750909
アッシュ津島店,愛知県津島市大字津島字北新開351番地 ヨシヅヤ津島本店2F,,,35.175402,136.747044
アミューズメントプラザワイド,東海市名和町二番割上16-2,名和駅が近い,APプラザワイドは紛れもなくセガのお店,35.06506359999999,136.9114615
ゲームファンタジーランド・ナイル,東海市名和町三番割上40,名和駅が近いAPワイドは比較的近隣,,35.0629888,136.9124224
ゲームファンタジーランド・アトランティス,東海市養父町3-38-39,,,35.0072827,136.8875242
アミューズファクトリー 常滑店,常滑市りんくう町2-20-3イオンモール常滑 2F,名鉄空港線りんくう常滑駅,カプコン直営店,34.880752,136.826505
モーリーファンタジー常滑店,常滑市りんくう町2-20-3イオンモール常滑 2F,名鉄空港線りんくう常滑駅,,34.880752,136.826505
ポケットファミリーランド,豊明市前後町善江1735パルネス豊明,,旧：サムソン豊明,35.053023,136.995557
ユーワールド豊明,豊明市前後町螺貝1384-1,,元セガワールド豊明総商とはOPが違うので現時点では営業しています,35.0586891,136.9890076
ダイナレックス豊川サティ,豊川市開運通2-31,,,34.8274843,137.3844581
豊川メトロポリス,豊川市下長山町上アライ14-1,牛久保駅が最寄だが豊橋からコロナの送迎バスもあり,,34.8025832,137.3845019
Kid's US.LAND 豊川プリオ店,豊川市諏訪3丁目133　豊川プリオ B1F,,15分108円の会員制ゲームコーナー,34.826059,137.370193
モーリーファンタジー豊川店,豊川市開運通り2-31イオン豊川店2F,,,34.8274274,137.3844512
G-SQUARE アピタ豊田元町店,豊田市土橋町2-65 アピタ豊田元町店2F,名鉄豊田線土橋駅,アピタ改装中に伴い休業中,35.0624216,137.1311873
M’s PARK 豊田店,豊田市寿町3-10-11,,,35.0554881,137.1329163
プラサカプコン 豊田店,豊田市東山町1-5-1グリーンシティ3F,名鉄豊田市駅東口よりバスで「渋谷町一丁目」,,35.087649,137.1845095
セガ豊田,豊田市深田1-65-1,,旧：ハイテクセガ豊田,35.0679112,137.1238418
タイトーキッズランド　GAZA,愛知県豊田市喜多町1丁目140番地GAZA3F,名鉄豊田駅徒歩1分,,35.0879497,137.1573181
モーリーファンタジー豊田店,豊田市広路1-1イオンスタイル豊田3F,,子ども向けVR(単眼ＶＲ)導入,35.0784874,137.1596657
サーフ21,豊橋市飯村北2-29-4,,,34.7465226,137.42275
セガ飯村,豊橋市飯村町字西山25-121,,旧：セガワールド飯村,34.7493359,137.4139563
アーチバッティングセンター北山店,豊橋市北山町字西野原40-20,,,34.7330262,137.3976585
アミューズメントクラブNOVA,豊橋市三本木町字元三本木80-2,,,34.7236329,137.3951896
パラダイス,豊橋市下地町字宮前26-1,,,34.7800005,137.3841887
シーキャットパート1,豊橋市中浜町219-30,,,34.7430549,137.3740491
タイトーステーション 豊橋店,豊橋市藤沢町141-4ホリデｲスクエア内アミューズメントビル1F,,旧：セガアリーナ豊橋ボウリング場併設,34.7436245,137.3717705
モーリーファンタジー豊橋南,豊橋市野依町字落合1-12イオン豊橋南店2F,,,34.7097085,137.388251
ゲームファンタジアン長久手店,愛知県長久手市武蔵塚705,リニモ「長久手古戦場駅」より徒歩5分。駐車場あり。,,35.1714297,137.0454571
namcoイオンモール長久手店,長久手市長久手中央 土地区画整理事業地内5・10・11街区イオンモール長久手3F,リニモ「長久手古戦場駅（イオンモール長久手 前）」直結,VR型施設あり,35.173514,137.05142
モーリーファンタジー長久手店,長久手市長久手中央土地区画整理事業内5・10・11街区イオンモール長久手3F,リニモ「長久手古戦場駅（イオンモール長久手 前）,,35.173376,137.050448
カーニバルＣドーム,西尾市上町南又七山35-2,,,34.8728211,137.0455037
天野ゲーム博物館,西尾市高砂町41,名鉄西尾駅から徒歩3分,,34.8662778,137.0550336
ファンタジーウエストタウン西尾店,西尾市高畠町3-23-9ヴェルサウォーク西尾店 3F,名鉄西尾駅徒歩1分,,34.863832,137.05948
コムテックプラザ赤池,日進市赤池1-2901,地下鉄 赤池駅からすぐ,,35.120836,137.0177309
セガプライムツリー赤池,日進市赤池町箕ノ手1番プライムツリー赤池3F,地下鉄鶴舞線・名鉄豊田線「赤池駅」から徒歩4分,VR型施設SEGA VR AREA AKAIKE併設,35.11845479999999,137.0241606
ファミリーファーム赤池店,日進市赤池町箕ノ手1番プライムツリー赤池3F,地下鉄鶴舞線・名鉄豊田線「赤池駅」から徒歩4分,,35.11845479999999,137.0241606
半田メトロポリス,半田市旭町3-10,東成岩駅が最寄,旧：アミューズメントキャット半田,34.876396,136.9233656
サムソン半田店,半田市乙川吉野町9パワードーム半田B1F,,,34.905667,136.9370616
ラウンドワンスタジアム半田店,半田市瑞穂町6-7-8,,送迎バスは廃止されたので注意!!,34.885288,136.9411831
アミューズメントスペース GAMEダイコク,半田市青山2-27-1,,,34.8767011,136.905051
モーリーファンタジー半田店,半田市有楽町8-7イオン半田店2F,,,34.8692521,136.9175437
モーリーファンタジー三好店,みよし市三好町青木91イオン三好店2F,,,35.0922993,137.0795389
タイトーステーション 弥富店,弥富市五明字蒲原1371-4イオンタウン弥富,,旧：セイタイトー弥富,35.1148355,136.716823
Kid's US.LAND アソビックスかにえ店,海部郡蟹江町大字蟹江新田字上芝切71アソビックスかにえ内,,15分108円の会員制ゲームコーナー,35.124959,136.7857429
ユーズランド東浦店,知多郡東浦町緒川字旭13-2イオンモール東浦2F,,旧：イーストランド東浦,34.9776464,136.9737869
モーリーファンタジー東浦店,知多郡東浦町大字緒川字旭13-2イオン東浦店1F,,,34.9797025,136.9740465
ドミー東浦店,知多郡東浦町森岡字前田55-1,スーパー内ゲームコーナー,,34.9922786,136.968907
Kid's US.LAND コノミヤ武豊店,知多郡武豊町瀬木19 コノミヤ武豊店 2Ｆ,,15分108円の会員制ゲームコーナー,34.8496119,136.9160124
ナムコランド ヒーローズキャンプ名古屋店,西春日井郡豊山町大字豊場林先1-8エアポートウォーク名古屋 3F,県営名古屋空港隣,ウルトラマンCLUB併設,35.245539,136.9254783
楽市楽座 扶桑店,丹羽郡扶桑町大字南山字名高塚5-1イオンモール扶桑2階,,,35.361204,136.900497
ヨシヅヤ大口店 ゲームコーナー,丹羽郡大口町奈良子2丁目79 ヨシヅヤ大口店2F,,,35.3214697,136.8966986
モーリーファンタジー扶桑店,丹羽郡扶桑町大字南山名字高塚5-1イオンモール扶桑2F,,,35.361204,136.900497
ポート24幸田店,額田郡幸田町大字高力字沖原15,JR相見駅が近いです,,34.889216,137.1642215
ファミリーアミューズメント 幸田店,額田郡幸田町大草山添170ピアゴ幸田店１F,,,34.8724681,137.1747551
ROUND1 津・高茶屋店,津市高茶屋小森町277-8,JR高茶屋駅下車徒歩約15分三重交通バス「サンバレー」下車徒歩約3分,画像1,34.6724656,136.5194702
オークランドシティ,津市雲出本郷町1805,三重交通バス「サンバレー」下車徒歩約2分,一部（主に音ゲー）24時間営業,34.6704714,136.5203813
セガワールド久居,津市久居明神町字風早2534-1,伊勢自動車道久居ICから1分,外観画像1,34.68411010000001,136.4668323
NICOPA　イオン津店,三重県津市桜橋3-446 イオン津店　2F,津駅 東改札を出て徒歩約15分、もしくはバス10分にて。,,34.73672,136.5185184
モーリーファンタジー イオンタウン津城山,三重県津市久居小野辺町1130-7,津駅東口より「警察学校」行きに乗車し約25分,画像1,34.6794843,136.5013836
にこにこＢＥＡＲ,津市久居明神町風早2660&br()ジャスコ久居店1階,,旧 ファンタジーアイランド　画像1　画像2,34.682681,136.463198
津グランドボウル,三重県津市垂水９１５−１,近鉄津駅より三交バス藤枝南バス停（平安閣前）下車徒歩2分。,,34.6911582,136.510376
ゲームスマイルキッズ津河芸店,津市河芸町中別保丸垣内100番&br()ザ・ビッグエクストラ津河芸店1階,,旧：ポップンパーク津河芸店　画像1　外観,34.78728640000001,136.5441747
オークワ河芸 ｹﾞｰﾑｺｰﾅｰ,県津市河芸町上野259−2?,,Iwill経営 参考画像,34.7955987,136.5532472
桑名グランドボウル,三重県桑名市新西方1-22,桑名駅からバスで約15分,参考画像　参考画像2,35.0723812,136.6622437
イオンモール桑名 モーリーファンタジー,三重県桑名市新西方1-22,桑名駅からバスで約15分,画像1,35.0723812,136.6622437
ｲｵﾝﾓｰﾙ桑名内 ｳﾞｨﾚｳﾞｧﾝ前ｹﾞｰﾑｺｰﾅｰ,三重県桑名市新西方1-22,,参考画像,35.0723812,136.6622437
セガワールド桑名,桑名市大字大仲新田字宮前158番地,東名阪道桑名ICよりR421をいなべ方面に直進公共交通なら「新大仲新田」停留所が最寄,入口画像,35.0828778,136.6067461
クラブセガ アドバンスモール松阪,松阪市田村町235-1&br()アドバンスモール内,R166沿だがアドバンスモール松阪へのバスもあり,,34.5550284,136.5119142
ゲームチャオ松阪,松阪市船江町780,R42号線沿い松阪駅から車で5分,旧：セガワールド松阪,34.5886531,136.5258425
モーリーファンタジー松阪店,松阪市船江町1392-27&br()イオン松阪店3階,,旧：ファンタジーアイランド…　画像1,34.5936998,136.522726
G-スクエア　アピタ松阪店,三重県松阪市市場庄町1266番地の1,松阪ICより車で10分　近鉄松ヶ崎駅より徒歩15分,,34.6041821,136.5204398
バンダイワールドみくも,松阪市久米1216,,営業時間に注意　画像1　画像2,34.6009963,136.5202122
スーパードーム内バッティングセンター,松阪市久米1216,近鉄山田線松阪駅徒歩20分,画像1,34.6009963,136.5202122
浪漫遊　松阪店,三重県松阪市塚本町72-1,近鉄松ヶ崎より徒歩5分,クレーンゲームのみ。旧：万代書店　画像1,34.5954079,136.5218427
トライアル松阪店内ｹﾞｰﾑｺｰﾅｰ,三重県松阪市東町５９−６?,,画像1株式会社コカド 運営,34.5773999,136.5504434
KAYO AMUSE PARK,三重県四日市市日永4-2-41 イオン日永店2F,近鉄内部線『南日永駅』下車徒歩　約5～10分,画像1　画像29月30日にOPEN,34.946361,136.604475
YAZワールド四日市,四日市市泊小柳町4-34&br()TAIKI四日市南店内,JR南四日市駅徒歩2分,,34.9392506,136.606754
アミューズメントパーク イオン四日市泊 店,三重県四日市市泊小柳町4-5,あすなろう鉄道内部線 泊駅下車 徒歩5分,,34.9382254,136.6012905
フリークス四日市東店,四日市市西新地17-1,,一部24時間営業,34.9697228,136.6238122
モーリーファンタジー四日市尾平店,四日市市尾平町字天王川原1805&br()イオン四日市尾平店3階,,旧：ファンタジーアイランド…,34.977396,136.591138
モーリーファンタジー四日市北店,三重県四日市市富州原町2−2−40&br()イオンモール四日市北店2階,富田駅のすぐ近く,旧：ファンタジーアイランド…イオン棟の中です,35.0082904,136.6555425
NICOPA四日市北店,三重県四日市市富州原町2−2−40&br()イオンモール四日市北店2階,富田駅のすぐ近く,専門棟の中です,35.0082904,136.6555425
セガ生桑,四日市市生桑町字川原崎299-1,,旧：セガワールド生桑,34.986454,136.601595
ユーユーカイカン店,四日市市智積町3359,,,34.9863422,136.5439412
万代書店 四日市店,四日市市東茂福町8-12,近鉄 富田浜駅より徒歩3分,,34.9988111,136.6500042
